"I was living with my parents. I was 17. They told me to leave, then tried to stop me from leaving. I have been in an abusive relationship with my mom and my stepdad for years. Friends helped me load the car, that was 12 years ago. Never been back.",2015-05-28 21:21:51,ToastnEggs,3244
"Kinda late, but I'll share my story.

I grew up in Foster Care and all the homes I lived in either were abusive or run in a ""business"" (collecting cash to house kids) format.

My actual mom was a very heavy drinker and was abusive (hence being in Foster Care). As an adult, we had a very good relationship. She was proud of me, impressed with my work ethic, and amazed that I got a fully paid for education via scholarships at the state university.

Everything was going swimmingly until I started to ""do better"" than my immediate family. They started to think I had abandon them, and that I was ""too good"" for them once I started pursuing my education.

The last conversation I had with my mother and sisters occurred on Thanksgiving, 2011 when I drove 3 hours to sit down and have our first legitimate family dinner in several years. I showed up, my mom was drunk, and my sisters were incoherently intoxicated on narcotics. My sisters yelled at me for ""abandoning the family"" and called me unforgivable things. My mother said to me ""I hope you achieve all of your dreams, lord knows you've abandon ours."" I got up from the dinner and left. I spent the entire drive back home, for 3 hours, hysterically sobbing. I haven't talked with them since. I know it was bitterness, and the drugs talking, but it really shattered me to the core.

My mother passed away this last year, that dinner was the last time I ever saw her or spoke with her. Both of my sisters were incarcerated at the time, so I flew home to clear out her estate. She didn't have anything but a mountain of bills, and a house full of items to sort through. I donated almost all of it to Goodwill. While sifting through her belongings, I did find a lockbox though.

The lockbox contained her wedding ring from my late father, and some photos of my sisters and I as kids; perfectly preserved. It also had a single note inside, which was addressed to all 3 of us, with corresponding paragraphs dedicated to us. My paragraph said:

""Daniel, words cannot describe how sorry I am for how much I have hurt you. It has eaten at me every day for the last 10 years. I drink because I wish I could've been the mother you deserved. You are the strongest man I have ever met. I'm sorry. You deserve so much more than I gave you. I love you with all my heart. I hope someday you can forgive me.

Mom""

It destroys me inside to know that mom died thinking that she didn't mean the world to me. If I'm being honest, I started drinking very heavily after she passed. She died thinking I didn't love her with all my heart. I carry her Driver's License in my wallet, above mine, so that every time I take it out I get to see her; but more importantly, so that she can see me and know that I'm always right here.

Anyway, that's my story, reddit. Thanks for reading.",2015-05-29 02:19:19,DaedricDanny,1555
"Sort of.
My cousin went for a walk once.

He was dating this woman, who just an awful human being.  She got pregnant, swore it was his, and once the kid was born the state went after him for child support, as he wasn't on the birth certificate, even though they were living together.

Anyways, the paternity test came back showing it wasn't his, and she flipped her lid.  Just lost it.  He asked her to calm down and said he wanted to take a walk to cool off.  He left everything he owned, minus the clothes on his back and his wallet, and went for a walk that he never came from from.  A few years back the kid found him, he was 16 or 17, and went on some giant rant about him being a bum and a punk ass and whatever other nonsense.  My cousin told him he wasn't his dad, the paternity test showed that, and he had no idea why she told him he was the father and abandoned them.  Kid left a whole helluva a lot more confused then he showed up I think.

Edit-calm not qualm.",2015-05-28 22:36:02,theostrichsays,1945
"i was living with a very mean and controlling girlfriend. If it wasn't her way or all about her she threw a fit. One day I had enough and said I was going to the store and just kept driving. I literally drove for 12 hours and showed up at a friends house 5 states away and asked if I could crash on his couch. I called my boss and said I wanted to quit work. He was pretty cool about it, he knew my girlfriend, and actually set me up with a job in my new city. I have never spoken to my ex since. Soon after my relocation I met my (now) wife and I could not be in a better relationship. Best thing I ever did.",2015-05-28 21:33:02,rduncang,4509
"Lived in an abusive house with my mom. Got a job after college and in 3 months rented an apartment and went home. Took a garbage bag full of clothes and booked it. 

She didn't want me leaving because she was talking all of my money. She would take my car when I didn't pay her my full pay check. I had to resort to pulling fuses when I parked because she would hide my car on different streets trying to get me fired. Even in college I had finals to graduate and took my car and I had no way to get there. Had to rent a car just to take my finals. 

God...the stories I could tell...

Anyway, waddled in the apartment with my garbage bag and nothing else slept on the floor and for the first time felt peace. 

Now have a decent job, house, wife and a kid.


Edit:  Since there is a lot of interest in my story I'm open to questions.

Ask away!",2015-05-28 21:45:05,madman2011,4644
"Said I was going to uni. My sister dropped me off at the station, said my goodbye and left the country. Patents and sisters were abusive and manipulative. Lived in fear for many years since they threatened to shoot me if they found me. I struggled a lot with alcohol for years and self hurt but im happily married and don't think of them as family at all.",2015-05-28 21:53:32,CuntanasChief,1070
"I was left. My dad and my mom had a fight, my dad leftâ€¦ then he killed himself. 

On one hand, I have no memories of him (I was too young). And I am very sympathetic to mental illness, and suicidal ideation. I have had bouts of serious depression in my life.

On the other hand, his absence, the lack-of-dad, left a huge gaping hole in my life. 

The strangest part is when I turned the age he was when he killed himself. I'm 36, and I'm older than my dad ever was. And I still feel young, like I have many years ahead of me.

I wish I had had the opportunity to know him. Everything I know about him is someone else's memory. 

Thanks for giving me space to share this.",2015-05-28 23:13:26,card_set,267
"Parents were split and hated each other and would always put me in the middle. The drugs and alcohol they were both doing didn't help.

Got kicked out of each of their places and went back and forth over some shitty circumstances involving them wanting all of my money to live with them, then playing the guilt card on each other that they took me in when the other kicked me out. 

Got a steady retail job that I had to work 6-7 days a week at odd hours to get full time. 2 weeks before christmas mom said her place wasn't a truck stop and I couldn't come and go at all hours of the night and that I had to leave. Heard similar from her before and didn't want to go to dad's again so I called some family and they all refused to take me in because my mom had called and told them I hit her. Since I was still in the same house I told her she was a horrible person, but an even worse mother, and left. 

Grandma knew parents were crazy so she helped me as much as she could. Still get phone calls/emails/Facebook messages asking me when I'm ""going to stop being a bitch so we can be a family again.""

Have seen both since. Invited some ""friends"" through Facebook to things that they in turn invited my parents to. Finally nutted up and told them both to get the fuck out of my life. Mom still leaves me drunk/high/crying voice mails in the middle of the night either telling me she loves me or that I'm all that's wrong with her life. Dad sends me emails telling me to get the stick out of my ass because I'm still his son.

Still spend time with my grandma. Friends parents mean more to me than my own ever did.

Now I've got a full time job, an awesome dog, working on doing better in life in general, and trying to move into a place solo.

Blood is not thicker than water.

Will never speak to either of them again if I can help it. No regrets.",2015-05-28 22:44:31,beeraduh,959
"I left my home like this. 

One night, I just packed the essentials into my backpack, walked to a train station and got on a train to Newport News, VA from Pasco, WA. No one knew I was gone until 3 o'clock the next morning. 

It was to be with a girl my family was totally, 100% against. 

That was a year ago, it's all working perfectly. I am happier now than I ever have been before.",2015-05-28 17:06:48,MyNameIsChar,2993
"Throwaway for good reason. I've always lived in an abusive home, both mentally and physically and never saw a proper way out. I started working at 14 years old in a convenience store for 8 dollars an hour and hid all of the money I made in a locked container in a nearby wooded park area. I did this because my parent would have taken my money if they knew I was working at all. By the time I turned 18 I had close to 10 thousand saved up and had finished high school. I was supposed to start university that year but early on in the summer I waited until my parents went out to work, found and took all of my documents, unenrolled out of the University program I was supposed to be in and left. 

I took a bus to Alberta and i've been living here since doing labour, it's been a year and a half and they haven't searched from me yet, not that i'm aware of at least. How is my life now? I'm poor, barely getting by but at least im living alone and happier than i was before. 

Edit: First of all I want to thank all of you for the kind words and support that you've written to me in this thread. Originally I wasn't even going to write this because everytime I think about it, it brings me on the verge of tears. It's definitely something I try to avoid discussing in real life. Reading the comments reminds me that Reddit has a great community.",2015-05-28 20:00:06,throwawaaaaaaaaway,4988
"My father just walked out on us when I was nine, walked out on everything. Racked up a load of debt before he went without my mother knowing, through a gambling habit he had which we didn't know about until immediately after and the hounding from the people/companies he'd borrowed money from. Some of them were the kinds of people you didn't really want to owe money to, and the next few years were kinda rough.

To add to that my mother got sick around the same time and ended up unable to leave her bed for a few years, I think the illness was caused or at least exacerbated by the shock of his leaving. Not going to lie, it was really rough. I ended up getting home schooling as they were afraid that he'd show up and pick me up from school one day, and after a little while of that my confidence was so drained that I avoided school as much as possible.

Police were looking for him and eventually found him after a year or two in a town ~200 miles away, but he didn't want to get in contact with anyone and nothing came of it. He was an ex-policeman so I guess he knew what to say, or something.

Then a few years later we got a phone call from a lady who had found his address book, informing us that he had died and she was looking for his next of kin. It ended with us traveling to where he had been staying, to find an elderly lady he was basically bleeding dry financially.

Some of the stories he'd been spinning to manipulate people were incredible. People there thought of him as a hero, he told them about how he'd started a new life after nursing his sick wife with cancer until she passed away. How my brother had been inspired by his story and was working as a doctor abroad, and in his fantasy I had never actually existed.

I can't really say I'm angry about it. I grew up afraid that I'd end up like him, but I think when you're exposed to something like that as a child you can either see it as an example of how to live; or you can look at it and do everything in your power to avoid becoming it.",2015-05-28 22:33:20,Goatbrush,406
"I ran away from my family. My mom, and whatever family is attached to. I feel so much better. I resented the bullshit my mom would pull on me. She once got me pretty screwed around and told everyone I was abusing her, her finances etc. She told me to my face she was going to lie and get away with it. And she did. And that was pretty much the family dynamic I was caught up in.

When I called her an abuser she couldn't handle it. It felt good to leave and not look back. I got a new job, and a new place and changed numbers.",2015-05-28 22:23:27,Minacsed,74
"Left my family close to 5 years ago to move to California to start a new life. I was 400lbs, living a lifestyle of prescription drugs and drinking at 17 with my family. I was good in high school and even went to college early but wasn't able to secure a loan there to continue past the first year. Dropped my shit life there and came here. It was very rough for a time but I'm a lot better now. I had some help from my adoptive father but paid my way aside from the ticket here. I live on my own now and manage an office selling printer parts and various other money makers online. I started my own business last year and have been paying out of pocket to continue school here because the college I went to back home wouldn't release my transcript. I've lost a great deal of weight and am away from any unhealthy addictions. My family is for the most part very cross with me. My mother died two years ago nearly exactly. I had planned to go back for her birthday (tomorrow incidentally) in 2013 but she died two weeks prior to it. The only regret I have is leaving that door open. I like to think she'd be proud of where I went.",2015-05-28 18:51:00,jburg255,783
"Question to anyone here who has moved cross-country (US) without much planning: How do you get by the first few nights? I mean, what is it like to show up somewhere with no home, no job, no money, etc.? Do you just sleep in the street for weeks after leaving the airport or what? I'm genuinely curious.

EDIT: Thanks for all the feedback, guys. I'll be sure to read them all after work.",2015-05-28 22:22:49,A_Fabulous_Gay_Deer,294
I joined the Army without telling anyone right before I turned 19. Had my recruiter take me to the airport.,2015-05-28 20:54:20,241410,1068
"Growing up I was handed around from family member to family member. My parents were divorced my mother was a sociopolitical liar. My mom bounced me from relative to relative because she thought I was ""just like my father"" and hated that her youth disappeared quickly after having me and then my sister. 

As the years set in the abuse got worse and worse. It got more physical. Then she married a crazy former marine and things continued to escalate as I reached my teens. 

One time she hit me hard enough to chip a tooth. That's when I had enough. I called the cops. She sent me to my grand parents house. They had never been abusive until then. 

One afternoon mid summer they went to work and I had my girlfriends dad (a veteran cop) pick me up, when he arrived I was in bad shape but sitting on the porch with all my stuff in a bag. Mad as he was as an officer, he respected that I didn't want to involve the cops, I just wanted out. 

He let me stay with them, his wife, and his daughter (my gf). I finished out high school living with them. He and I fell away from each other during college, but Randy (her dad) I still respect to this day. 

Years later I would up and leave my home town on a whim with a car load of stuff leaving EVERYTHING behind with no warning and leave for Colorado. Just to free myself from the perpetual cycle of going no where in life. 

I now make $50,000 a year. Single and a Self made man. I lived in fear I wouldn't ever make it. But I'm 30 and I've made it, at least in my mind.",2015-05-28 22:30:20,secretcolorado,957
"American that moved to Australia for 2 years. Got a girl pregnant. Fell in ""love"". Saw her for the horrible person that she really was, but stuck it out. After the baby was born I had to be sure he was mine. The test came back showing no paternal match. I confronted her. We fought, she swore up and down it was a bad test. 

Wanting to believe it, I scheduled another test for the 3 of us to go in. $800 later, 2 days before the test, she played dumb and said she never agreed to that. Told me to get out of their life, and that her child was not a science experiment. I stayed with a friend a couple days then came back. She acted like nothing happened, and wanted to just move on. Another test was no longer an option in her book.

It was the hardest decision of my entire life, and it still makes me sick to think about...a week later I scheduled a flight back to California. I've been back for 4 years now. We had talked a bit over the year after I left, but just went back to her wanting to fight. After some anti-depressants and heavy drinking, I'm finally starting to feel whole again. I look at the world very differently now.

Edit: Thank you everyone so so much for your kind words. Uplifting really. I miss that little boy with all my heart. He still has my name and a great deal of loving people that know who I am. I only hope he hears some of good about me when he is older. I did everything for them. I did what I had to.

Edit again.. Mixed responses. Either way thank you for showing interest in my post. After having a laptop broken over my head, a vacuum slammed on me while I'm sleeping, and the brothers she filled with lies after me. I did what was necessary to diffuse the situation. Thanks for the gold kind sirs, even though I don't deserve it. I was just sharing my story on a relevant post.",2015-05-28 18:37:50,scrotoe,2197
"I left my abusive husband 7 years ago, I just walked out the door. I never spoke to him again. I had squirreled away money for years, because he controlled my income. He had this idea that I was miserable because we didn't have children, so he tried to change that by raping me so I would get pregnant. He didn't know I was using birth control. I had resigned my job, so I just left. I couldn't bring children into that life. 
I went to live with my parents in a different part of the country. 

Now I live in a different country, I have a kind and loving partner, and we have a daughter! I'm happy most of the time. My family don't tell people where I live, in case he should find out. I don't know what happened to him. I hope he's dead.",2015-05-28 21:29:13,Grumblegrumblehiss,2047
"Left home shorty before high school graduation, aweful living situation. My parent was in town and told me to go home while she stayed in town. I went home and packed my stuff and left. Returned the car with a note and no one even bothered to call/text me for a week.",2015-05-28 17:51:15,ktymarie,655
"I was at a shitty party full of shitty people doing shitty coke and drinking shitty beer.  I had just put my notice in at my shitty job, hated my shitty life, and didn't know how to make any of it better. 

So--because why the fuck not--I rallied about $100 in cash from everyone for a beer run, put half of it in my gas tank, stopped at the room I was renting and got my backpack and my sleeping bag, then drove until I was in another state and started over.",2015-05-28 17:05:58,one_long_year,4099
"Just failed out of college. Moved back in with my dad. Things weren't going real well between us. I was depressed and not really going anywhere. I was angry at my dad because he came down on me so hard but I was mostly angry at myself, and his attitude toward me just kind of compounded it all. 

Anyway one day after being out at a friends house and hanging out all over the city for a couple days I finally came home and things around my house were just tense and I felt like nothing and like I would never get out from under this.. weight.  So I just started packing some stuff.   As I was leaving I remember I was coming out of my room with a Bag. This wasn't unusual because I would often take a bag with me when Id be gone to a friends house, but today, my dad was standing at the top of the steps just looking down at me. I remember very vividly , him standing there with his hands in his pockets kind of looking at me then looking away and he quietly just asked.

""where you going son?""

I just looked up like everything was normal and just said "" Im going to so and so's house""

He nodded slowly "" when ya com in back?""

I shrugged slowly "" I don't know dad""

Somehow he knew. I could feel it.  I never came back home, days turned into weeks and months and then years.   I could tell he knew.  It makes me so sad now when I think of it. Like I tore his heart in two. He has never been a very expressive man, but I could just tell how sad he was.  I needed this though, I needed to go off on my own and suffer the real world and grow up some.

It still hurts my heart to think about him slowly nodding after I told him "" I don't know dad""",2015-05-28 20:07:20,wearehell,3967
"I hope some of those who have left see this. Im not the one that ""left"" my sister did. We lived in a crappy neighborhood. My mom had depression and my dad was never home. One day she went to school (she was barely starting college) and didnt come back. she did leave a note saying that she was leaving. This tore our family apart and made my mom suicidal. My dad became an alcaholic and I was depressed. She contacted us after 2 years. I went through hell. No matter how bad things may be please contact your family members I you can. There is always someone that cares for you.",2015-05-28 21:18:47,doublepoly123,3338
"I did this, basically.  Told my parents I was going for a hike in the woods for a few days, instead took a flight to europe and joined the French Foreign Legion. They figured I was dead for a few weeks but eventually they figured out what I had actually done.

It's been almost 2 years, and I'd still rather not see them ever again, but one of these days I'm gonna have to go back and see all my younger brothers who still live there.  

As for why...it's a long story...I didn't have the greatest childhood.  Basically I decided I had nothing better to do and life was boring as hell, so I might as well do something stupid or crazy.  So I just left and never looked back.  Whether or not I'm better off now than I was before is debatable, but at least I can say I've done something with my short little life.

**EDIT** Because everyone keeps thinking I just up and left for no reason, here's a bit of background info on my life.

Parents were/are religious fanatics and complete narcissists with their own special brand of Christianity.  They home schooled me my entire life until I was 17, at which point they kicked me out due to religious disagreements.  

I managed to survive for around half a year by myself.  Unfortunately I was kinda lacking in the life skills department.  Basically until I left at 17, I never had any friends, never left the house without my parents, and had no diploma or any other record of me doing school. 

I also found myself kinda...lost without someone yelling at me all the time telling me what to do.  So I figured I would join the military.  Just do as I'm told, not have to worry about bills or food or anything.  Perfect.  Unfortunately my national army told me to wait 2 years and I have no patience at all so the next logical step was obviously to join the FFL.

So I didn't last long by myself, ended up coming crawling back to them and staying with them until I turned 18.  But I wasn't idle.  I saved up money,  stole all my documents from the lockbox where they kept them, and bought a plane ticket. 

And so here I am now.  Halfway round the world, speaking a different language and protecting a different people.",2015-05-28 17:13:04,SirAwesomely,2630
"My mother left me at her door. I would visit every Saturday for a few hours. Then she wasn't there.....

After 10+ years of extreme hate towards her... My uncle enlightened me... He said ""maybe she left you for the better""..

Turns out she has extreme mental issues.. Drug abuse... Its amazing how few words can change your life",2015-05-28 21:59:09,PM_ME_UR_BOOOOTY,340
"Not really the same thing, and there's other drama involved but to keep it short:

* Went through a bad break up. To get away from it I went to Sri Lanka in 2004 during Christmas. The Tsunami happened. 
* Came back and told my family and about 2 friends I was leaving LA. 
* Boarded a plane  a few days later for New York with only two bags, no apt, no job. 
* Found a job and a flat within the first few weeks. 
* I've been here 10 years now and have no regrets. 

Edit: She's married now and very happy. Took all of the plans we spoke about and applied them to her (then) new dude and did them with him. They live in the same area and xyz. I'm happy for her regardless. She was a great person. We were just young.",2015-05-28 19:01:16,transmigrant,580
