"[Ants](http://www.cracked.com/article_19651_7-reasons-ants-will-inherit-earth.html) already dominate.  Ants do many of the same things we do to survive. In some cases, like building cities, they do it [better](https://www.youtube.com/watch?v=l31tukNRDIU&amp;t=4m).",2015-05-29 06:46:16,RivenPhalanx,8
"I'm surprised nobody has said bears. They are in some form or another across most of the worlds continents. They are omnivorous and quite intelligent. Certain varieties are particularly ferocious (polar bears and grizzlies) while others are much more cunning (black bears have opened car doors in search of food). While not specifically social or pack creatures  I reckon there is a degree of sociality involved in mating and raising of offspring. 

The only question left is which bear is the best bear?",2015-05-29 07:36:03,the_cockie_monster,3
"The world will descend into chaos and seven Noble Species will fight for what remains of Earth post-human.

- Canine species lead by Sandor ""The Hound"" Clegane

- Feline species lead by Tywin Lionnister/Daenerys Tigeryen (disputed)

- Birds lead by The High Sparrow

- Sea Creatures lead by Robb Shark

- Wildebeests lead by Moose Bolton

- Other wild animals lead by Giraffy Baratheon

- Insects lead by Grey Worm and Varys the Spider

All the conflict ends when the next Ice Age begins, hordes of Penguins sweep the lands and become the ultimate rulers of the Earth.",2015-05-29 07:18:38,yours_duly,11
Beavers. They already cut down trees to make houses with.,2015-05-29 05:29:42,skateboarderguy,6
Deer. Most of the predators are gone and then once grass reclaimed all the land humans have taken it would be an explosion of population.,2015-05-29 05:30:34,Magnon,3
"Giraffes, because of their long necks.",2015-05-29 06:27:20,jacobsnemesis,4
I'm going with some sort of microbe.,2015-05-29 05:30:09,olanike95,2
cats,2015-05-29 05:50:47,acuallytristram,2
"Likely a different dominant species in each region. Lions in Africa, monkeys in India, panda's in China?",2015-05-29 06:38:23,CashCop,3
"Squids,",2015-05-29 07:00:41,Cycloneozgirl,3
Pikachu,2015-05-29 07:19:43,Pedrojonah,1
"Probably otters, they're so smart and agile, give em a couple million years and they might become the next civilization.",2015-05-29 07:45:15,kitterpup,1
"Raccoons.  We have made them smarter with our attempts to keep them out of things, they have excellent manual dexterity.  Those things are extremely capable",2015-05-29 08:08:33,coelurosauravus,1
"I'd say elephants. They've got strong family ties that keep them in groups, a huge amount of intelligence, and can survive in tough environments.",2015-05-29 08:31:55,TrippyJesus,1
Dolphins for sure.  They're the third most intelligent animal on earth.,2015-05-29 05:34:29,xSidious,3
Eventually ants !,2015-05-29 05:44:58,Irememberedmypw,2
Spiders,2015-05-29 05:38:51,jalkadulla,1
Whales,2015-05-29 05:56:23,All-Shall-Kneel,1
Octopuses,2015-05-29 05:59:32,Jatz55,1
Insects,2015-05-29 06:03:49,Unclecurtis,1
"Mice, no more mice traps",2015-05-29 06:05:50,retaiLcamL,1
[deleted],2015-05-29 06:15:17,,1
Cockroaches. They'd survive a nuclear war and even thrive and they eat everything (like fucking everything).,2015-05-29 06:17:22,AtheistComic,1
The Black Widow!,2015-05-29 07:01:57,kingmi123,1
Elephants. 100%. Elephants.,2015-05-29 07:12:48,NuclearQueen,1
Cats who ride dolphins with octopus hats.,2015-05-29 07:17:41,midnight_stoner,1
Crocodile.,2015-05-29 07:32:32,PrinceWhiteFrog,1
Really tough luck for dolphins and orcas. Those big brains and they're stuck in the water with dumb old flippers.,2015-05-29 07:39:31,MackMizzo,2
Rodents or Felines most likely.,2015-05-29 07:42:04,HANDS-DOWN,1
Praying mantis. They are the kings of the insect world. I'm going to assume what kills us off will also kill all the other mammals and likely reptiles and amphibians leaving insects to rule.,2015-05-29 07:42:24,PurpleURP,1
Probably sloths - assuming they can evolve opposable thumbs and get their shit together of course.,2015-05-29 07:58:55,Trojan_Moose,1
No other life form on earth has the intelligence to dominate earth and its resources,2015-05-29 08:03:13,steiner_math,1
If humanity died out I highly doubt there would ever be another species that rises to the same level in the rest of earth's history.,2015-05-29 08:12:39,Agent_Orange7,1
Ants,2015-05-29 08:13:04,Harryheck,1
Whatever came before the primate,2015-05-29 08:13:47,eintstrinmna,1
"I would have to say cats. Besides humans,  they are easily the top predator.",2015-05-29 08:18:01,jbhilt,1
dogs,2015-05-29 08:18:49,Lemerney2,1
"Octopi. Highly intelligent, able to manipulate their environment, omnivorous.",2015-05-29 08:19:26,theskepticalheretic,1
Raccoons man. They're like toddlers but also bears.,2015-05-29 08:20:57,Missterycaller,1
Rats,2015-05-29 08:24:16,Springheeljac,1
"But if we look back and draw a correlation from previous events and give that credence it would be birds. After every major mass extinction of species new species has arised to profit from cleared areas and habitats, and i think that in almost every case the new species has handled the next extinction better, the major new species that took hold of planet earth after dinosaurs are birds (and us)",2015-05-29 08:24:45,baronmad,1
Puppies that never age,2015-05-29 08:25:10,I--AM--SPERM,1
OP's Mom,2015-05-29 08:27:56,LangesHolz,1
"Seen a lot of dolphin responses. You know what's smarter than a dolphin? You know what outsmarts and hunts Dolphins, what eats Dolphins? Orcas. Orcas will inherit the earth. [They're already preparing their mainland invasion!](http://youtu.be/00-Ivz--SHE)",2015-05-29 08:39:28,20CharactersJustIsnt,1
Probably elephants.,2015-05-29 08:40:41,Zeoniic,1
Birds.,2015-05-29 08:41:22,4EverUnknown,1
"Crows, Raccoons, or Rats

Dolphins also has some potential, but I'd expect the other three first",2015-05-29 08:42:02,Icalasari,1
"Cats would be the first to rise, enslaving the canine for around five centuries, employing them to build their monuments and cities. But such a life can only last for so long. The next rise to societal levels would be the Pug.",2015-05-29 05:45:01,Just_That_Kevin,1
Probably one of those species tumblr makes up every few minutes.,2015-05-29 06:52:21,smashsenpai,0
"Toss up, or compromise, with rats &amp; cockroaches.",2015-05-29 05:39:11,Shiba-Shiba,-1
Primates,2015-05-29 06:00:50,why4bro,-2
"Wars would just be thousands of soldiers arguing over who shot who first and why they aren't dead because they have a special flak jacket that renders them
Impervious to whatever weapon you happen to have, ah but your weapon is the new version of what they are impervious to and so has been designed to counteract their flak jacket tech which is now out dated.",2015-05-28 20:52:43,Cloud6556,509
"My kid was crying when i picked him up (it was the last day of school) I asked why, ""I don't want to get a job, I want to be 7 years old forever"" sounds like a plan to me...",2015-05-28 19:36:06,remotefixonline,321
"There would be lots of astronauts, firemen, pirates, quarterbacks and a fuck ton of princesses.",2015-05-28 18:50:00,MuffCream,916
U.N.!!! Russia's putting his foot on my side!,2015-05-28 20:46:09,Plz_Dont_Gild_Me,131
"Anything, and I mean **anything**, would fly if you slapped something on it you could call ""wings"".",2015-05-28 18:46:12,MarkJolle,244
"Fatality rate of 100%? 

Cooties.",2015-05-28 19:27:27,worlds_loudest_mime,166
"Stepping on a crack actually would break your mother's back.  As such, crack repair would be a maintenance matter of the utmost priority.",2015-05-28 20:39:51,schnit123,64
"When we need money, we just take more out of the atm",2015-05-28 19:30:48,WiseauIsLife,128
Teachers wouldn't have to pay rent since they live in the school.,2015-05-28 20:56:51,Starbucks_Lovers,59
"The older sibling rule.

How this would work is people would have to wear a tag that says how old they are and their birthday in plain sight. Anytime someone who was older wanted something, they'd be able to take it from someone who was younger. Plus in any argument they could tell everyone to do something and follow with ""...because I'm the oldest and I said so!""",2015-05-28 22:53:39,masonr08,49
"I used to think that touching a girl would get her pregnant, so by now I bet the number of women I've gotten pregnant would be like... nevermind",2015-05-28 19:02:47,julesrtheman,127
Everyone in corporate america would have their pants on fire at all times,2015-05-28 19:37:19,SEXY_SEXY_DAD_BOD,132
we would all take sides and fuck with each other...oh wait,2015-05-28 18:46:22,naturelover7777,158
"Armies fight wars with protective blankets, shooting each other with finger guns while working on the honor system, if you think that someone cheated, you don't invite them out to play war the next time and joke about him while he isn't around.

Girls have cooties and if one of your friends had a girlfriend, he was totally gay. 

Politicians would have a truce and this would be held in high regard. Everything would depend on a matter of calling it first, or dibs as defined in the constitution (available for view at the White Tree House).",2015-05-28 19:27:12,Rancid_Remnants,30
"If anyone ever covered their eyes, the universe would end.",2015-05-28 18:45:27,boobieaficionado,124
"FADE IN

INT. A BANK LOBBY - DAY

*We see an upscale bank lobby populated by a handful of patrons, all of whom are going about their own business. At first, nothing seems amiss... until two masked BANDITS - each clad in black-and-white-striped shirts - burst through the front doors and fire submachine guns in the air.*

**BANDIT ONE:** This is a robbery! Nobody move!    
**BANDIT TWO:** Everybody put your hands in the air!    
**BANDIT ONE:** Yeah, do that, but then *don't move!*

*All of the patrons freeze in place, their arms held above their heads.*

**BANDIT ONE:** Okay, where's the manager? *Where is the bank manager?!*

*The second BANDIT leaps over the counter and rushes up to an overweight man in a suit. This is the MANAGER.*

**BANDIT TWO:** You! You're the manager!    
**MANAGER:** No, I'm not.

*The first BANDIT joins his partner behind the counter. He approaches the MANAGER, whom he smacks across the face.*

**BANDIT ONE:** You're the manager!    
**MANAGER:** Jeez, fine, I'm the manager.   
**BANDIT TWO:** Give us all of the money, and don't try anything stupid!    
**MANAGER:** Okay, but I have to open the vault first.    
**BANDIT ONE:** ... What?    
**BANDIT TWO:** The big safe. That's where the money is. It's called a vault.    
**BANDIT ONE:** Oh, yeah, I knew that.

*A sudden commotion draws everyone's attention back to the front door. Three uniformed POLICE OFFICERS rush into the bank, their weapons drawn.*

**OFFICER ONE:** Drop your guns! This robbery is over!    
**BANDIT ONE:** Nuh-uh! We have the manager, and we're kidnapping him!    
**MANAGER:** No, you're not. You're holding me hostage.    
**OFFICER TWO:** What's the difference?    
**MANAGER:** You have to take the person somewhere for it to be kidnapping.    
**BANDIT ONE:** Okay, we're holding his hopscotch!    
**OFFICER THREE:** Not if you're *dead!*

*The third OFFICER opens fire. His cohorts immediately follow suit.*

**BANDIT TWO:** Stop, stop, *stop!*

*All of the shooting ceases.*

**OFFICER ONE:** What now?    
**BANDIT TWO:** Police can't shoot first! *Bad guys* shoot first! That's the rule!    
**MANAGER:** That's not true!    
**BANDIT TWO:** Yes *huh!* Police can't shoot until the bad guys do!    
**BANDIT ONE:** Well, just pretend *we* shot first, then?    
**BANDIT TWO:** Okay.

*Bullets immediately begin flying through the bank again. Several shots strike the first BANDIT in the chest, but he continues to act as though nothing happened.*

**OFFICER THREE:** I shot you, Kevin! You're dead!    
**BANDIT ONE:** Nuh-uh!    
**OFFICER THREE:** Yes *huh!* I totally shot you! Lie down!    
**BANDIT ONE:** Nuh-uh, you didn't, because I have a force field!

*A shimmering, translucent sphere engulfs the first BANDIT.*

**OFFICER ONE:** No fair! No force fields!    
**OFFICER TWO:** I have grenades that break force fields!

*The second OFFICER pulls a grenade from his belt and lobs it towards the BANDITS.*

**BANDIT ONE:** Okay, but then I catch it and I throw it back at you!

*The OFFICERS look down to see the grenade at their feet.*

**OFFICER THREE:** No, um... because... because police can't be hurt by grenades!    
**BANDIT TWO:** They can too!    
**MANAGER:** Yeah, they can.    
**BANDIT TWO:** Shut up, Tommy.    
**MANAGER:** I'm not playing anymore! I'm a racecar driver now!

*The MANAGER quickly exits the bank, hops into a waiting Formula One car, and speeds off.*

**OFFICER ONE:** Nice one, *Alan*.    
**BANDIT TWO:** Shut up. It's not my fault.    
**OFFICER TWO:** Kevin, you're still dead. Lie down.    
**BANDIT ONE:** I'm not playing anymore, either.    
**BANDIT TWO:** Hey, no fair! You can't have three police against one bad guy!    
**OFFICER THREE:** Okay, um... okay, pretend I was a bad guy in disguise the whole time!

*The third OFFICER rips off his uniform, revealing a black-and-white-striped shirt.*

**OFFICER TWO:** What? No *traitors!* You can't do that!    
**BANDIT TWO:** I don't want to be the only bad guy!

*The rumble of a racecar engine becomes audible again. The MANAGER reenters the bank, a look of delight on his face.*

**MANAGER:** Guys, guys! I just had an awesome idea!    
**OFFICER ONE:** What is it?    
**MANAGER:** What if we were on a *spaceship?*

*A moment of silence passes.*

**BANDIT ONE:** I have a lightsaber!    
**OFFICER THREE:** Me too! Oh, oh, and I have a laser gun!    
**BANDIT TWO:** I get to be an alien!

*The BANDITS, OFFICERS, and MANAGER all rush from the bank. The patrons are left standing there, all of their arms still held aloft.*

**PATRON:** What the *fuck* just happened?

FADE OUT",2015-05-28 19:07:03,RamsesThePigeon,772
My dad really would beat up your dad.,2015-05-28 19:06:54,500Questions,23
"Well, as we all know, trees make the wind. Ever noticed how whenever it's windy, the trees are moving? Yeah, the movement of the trees pushes the air to make the wind.  

So we should cut down all the trees in tornado-prone areas to prevent them.",2015-05-28 20:38:27,uncquestion,22
I remember telling my mother to buy a boat when I was about 6 years old. She said she doesn't have enough money for a boat. I told her to just write a check.,2015-05-28 21:56:53,FromanJump,22
"Fallout shelters, tanks, and most any structure the provides protection would be built entirely out of blankets.

Edit: And no-one would ever call call 9-11 to report crimes in progress, unless the crime was being committed by their older sibling.",2015-05-28 20:17:56,standerj,21
Who says it isn't?,2015-05-28 18:45:21,snow_yoshi,41
NASA missions to harvest valuable cheese from the moon.,2015-05-28 19:36:52,AmbystomaMexicanum,17
"Nobody would be guilty of anything, ever, because ""it was an accident.""",2015-05-28 22:19:07,ultradiamondplatinum,17
"One night a year, EVERYTHING is legal. But, only that one day. Bad guys WILL NOT do illegal things every other day of the year because...BECAUSE THEY WILL. All crime is over! I saveded the day!",2015-05-28 22:24:17,naynaythewonderhorse,26
"You'd be eaten live by a dinosaur because Jenny, princess no.14477,  thinks your shoes are the wrong shade of yelple (her invented colour mix of yellow and purple, which she most definitely named herself). And now the floor is lava.",2015-05-28 19:37:38,dragon-roost,34
Student loans would disappear when I covered my face with the blanket.,2015-05-28 22:32:29,NachosWithBeans,12
"When ever anyone got caught for any crime everyone else you just shout ""Ooooooooohhhhhh""",2015-05-28 22:34:55,SasquatchHunter69,11
"Warp drive has been achieved via the constant asking of ""Are we there yet?""",2015-05-28 22:45:52,ImBasicallyJesus,11
No trade backs would be a thing.,2015-05-28 20:17:55,kingofsurrey,9
Everyone would have a pony,2015-05-28 19:37:11,mwes99,8
"For one, I'd be able to buy a mansion and four cars with a hundred bucks",2015-05-28 22:52:20,xizzy7,8
Pornos would start with the guy throwing a four-square ball at the hot girl's face.,2015-05-28 23:04:16,casperdellarosa,8
Babies would come from large birds flying in the sky,2015-05-28 20:39:14,V44,7
There would be a giant rift in the gene pool and would result in 2 different life forms: sound reflecting rubber people and acoustic absorbing glue monsters.,2015-05-28 23:50:28,clusterfuck45,8
THE FLOOR WOULD BE LAVA!,2015-05-28 20:41:39,ChubbyChoomChoom,13
Don't move it won't see you,2015-05-28 18:45:52,Sneeriousgrinch,6
"Rich People: We took all the money!  No take backsies!

Everyone else: Aw ok :(",2015-05-28 19:23:38,choicemeats,6
"Dibs! 

I am the captain now.",2015-05-28 23:18:46,blargishyer10,6
"Desset is good for you

Yeah i'm cool with this.",2015-05-28 18:51:44,penguinpilates,10
The currency would be crayons or those twistable things.,2015-05-28 20:13:49,Monstrous_13,5
"Just print more money, duh.",2015-05-28 20:45:06,Tostecles,5
Capes make you fly.,2015-05-28 21:30:24,Annepackrat,5
Banks would give me money just because they want me to have toys and camping trips.,2015-05-28 21:59:20,CurlyFern,5
The currency would be in candy.,2015-05-28 19:40:33,magnificentpineapple,4
"I used to think if someone else touched a person's bruise/injury/whatever, they'd be able to feel the pain too.",2015-05-28 20:07:53,metzie,4
Isn't this the plot of Idiocracy?,2015-05-28 20:34:39,Damaso87,4
"Music would be grouped into eras comprising ""Pre-Madonna"" and ""Post-Madonna""",2015-05-28 22:20:38,anewname,4
We would all be required to share.  Anyone who made a lot of money would have a large portion of their income collected by the government and redistributed in accordance to the need of the proleta-I mean their friends.,2015-05-28 23:22:18,blackmantle,4
Kissing a girl would result in a sentence to timeout due to the spreading of cooties.,2015-05-28 20:25:24,JaguarGator9,3
"Hide all of our problems and mistakes in the closets.

Not far off.",2015-05-28 20:28:48,UzumakiW,3
"Well, I would win. That we can be sure of.",2015-05-28 21:31:26,_graboid,3
Lighter objects would fall slower.,2015-05-28 21:52:13,Logic_Nuke,3
Every family dog would be a barking human.,2015-05-28 22:32:35,arachus,3
Owning a cardboard box would give you access to any form of transportation you desired.,2015-05-28 23:19:31,UsernameClassified,3
"A LOT of ladders and magic shoes, because lava would be everywhere.",2015-05-28 23:35:18,stinkpalm,3
"Seeing as you can't drink and drive, everyone who goes home must be so thirsty",2015-05-28 23:38:30,here_for_the_lols,3
"No more jail, they're just officially uninvited from birthday parties.",2015-05-29 00:11:02,BlondePhant0m,3
You could be a Football playing King in space.,2015-05-29 00:14:01,EpicLegendX,3
"Assuming that you have recently read the NYTimes, Washington Post or any other ""mainstream"" newspaper,  how can you believe that the world runs on something besides ""kid logic""

Read the statements of any of our presidential candidates, (with the possible exception of Elizabeth Warren), and tell me that that is adult logic.",2015-05-29 00:17:41,gmpierce001,3
Everyone would live to exactly 100.,2015-05-29 01:17:14,veritabli,3
We would just print more money and everyone would be rich,2015-05-29 01:23:45,KingBonu77,3
One for the Aussies: If anyone is chasing you (for whatever reason) just get to the designated **barley** and they can *not* get you.  You have instant immunity.,2015-05-29 04:00:27,Slo-MoDove,3
"The kids would be high tier reality warpers akin to the Orks of Warhammer 40k.

However they will be hampered by their own underdeveloped brain.",2015-05-29 04:35:29,velocity010,3
"Last year, a 6 yo told me water's alive. She actually walked up and asked how the water under the surface breathes because it doesn't touch the air...",2015-05-28 19:24:37,,2
"Pretty sure it already does.

*Insert some reference to religion that reinforces my point.*",2015-05-28 21:27:11,dickielegs,3
Different colors of light would blend to form a muddy brownish color.,2015-05-28 21:42:06,Scrubie_Wahoooo,2
"the entire world would be communist and every country would be lumped together (I fell asleep in the car when we were going on holidays, so in my mind we just went on a car trip to Italy, but in reality I slept through a car trip, a plane, and a train ride)",2015-05-28 22:59:28,GuyOutsideYourWindow,2
It wouldn't,2015-05-28 23:23:29,Vimda,2
"Today is Opposite Day. Just kidding, tomorrow is. Actually, got cha, yesterday was.",2015-05-28 23:23:42,djchuckles,2
No eating ice cream past our bed times because the boogeyman takes whoever has the sweetest stomach contents.,2015-05-28 23:32:36,RatHead6661,2
Everyone would always have more than the other... think about it for a second.,2015-05-28 23:42:13,flipjargendy,2
"In war, no one would die because everyone would claim they have a force-field protecting them when they get shot.",2015-05-28 23:43:36,alargenumberofcrows,2
Women would pee out their butts and poop out their vaginas.,2015-05-29 00:40:26,eldritchkraken,2
Salt and pepper would just offset each other.,2015-05-29 00:50:15,zasabi7,2
Bills and treaties would be persuaded by gifts of candy and puppies.,2015-05-29 00:51:46,costanza_cantstandya,2
All doors and containers would immediately open upon being struck twice in quick succession.,2015-05-29 01:05:46,Centropomus,2
"When I was very young I believed the clouds used to live down on the Earth with us.  They tasted really good so people took bites out of them sometimes.  Thne day a long time ago the clouds got sick of being eaten and moved to the sky, but they still come down to visit sometimes when its foggy. :]",2015-05-29 01:09:54,ManboyFancy,2
A day in the life of an anti-vaxxer..,2015-05-29 01:15:04,UnreasonableCaptcha,2
"Lots of mothers with broken backs. But really, don't step on the cracks",2015-05-29 01:22:44,tridoc,2
Exactly like the U.S. House of Representatives.,2015-05-29 01:38:01,el_supreme_duderino,2
"No contracts, just pinky promises.",2015-05-29 02:18:32,ouikipedia,2
The International system of Dibs and the No-Take-Back Policy would be very important.,2015-05-29 03:43:36,TodtheT1000,2
"The furniture store in my town that seems to have been running a ""Going Out of Business"" sale for the past 20 years.",2015-05-28 11:44:09,ObidiahWTFJerwalk,3265
"I can't believe my local mall is still around. It's  three quarters vacant, there's never anyone there, and the Mexican guy running the phone case stand in the hallway still has old Nokia cases.",2015-05-28 09:38:56,Jux_,3352
"Fye. Inexplicably, they're still around. Still selling $18 CDs.",2015-05-28 10:02:01,trainspotting2,2469
"Any company, especially the tax places, that have someone dressed in a costume, holding a sign by the highway.",2015-05-28 11:21:51,MisterMcGibbletss,1291
"Sears. 
It's like a Ghost town, a very cluttered and disorganized Ghost town.",2015-05-28 11:17:02,zygotepiegoat,2350
AOL. It's still servicing two million senior citizens.,2015-05-28 08:47:55,Refresh98370,4172
"[Nishiyama_Onsen_Keiunkan](http://en.wikipedia.org/wiki/Nishiyama_Onsen_Keiunkan)

A family-owned hotel. In business since **705 AD**",2015-05-28 14:53:10,yumcake,471
"DeVry

It's such a shady school with a terrible reputation for being a diploma mill. Just like the cash for gold stores that are mentioned in other comments, this company just preys on those who don't know any better.

There truly are for-profit schools that have a good mission with good values, but schools like DeVry really destroy the idea of a for-profit school.",2015-05-28 12:37:42,SoupyWolfy,1655
"Those nick nack shops downtown in smaller towns.  You walk by them and look inside and see all the rubbish they have and wonder how they can afford to stay in business.

Then you assume they are selling drugs or something else.",2015-05-28 10:22:46,Decyde,2143
There's a Sam Goody in a mall near me.  I was shocked.,2015-05-28 11:55:19,angela_bee,195
"A little place called Pacific Custom Cable. It's ridiculous. They make cables by hand, shoddily, and sell them for ridiculous prices. That's not actually what makes me wonder about them still being around ... the fact that there's a full time 'webmaster' and there has been for years, to maintain [THIS](http://pacificcable.com).",2015-05-28 11:35:25,i_forgot_how_it_goes,357
"My friend goes to school in Amherst, MA and told a story about a typewriter shop in their downtown area that is never open and he's never seen anyone inside. It's literally filled wall to wall with typewriters. Even real businesses on that block go out of business every few years because of the exorbitantly high rent on that block, but somehow this typewriter store is still there. He's convinced it's a front for a drug lord.",2015-05-28 11:26:35,T4ggerung,259
