"My game controller. I've purchased several and destroyed many. They were obviously the reason I wasn't able to beat the various video games I played. Obviously, I say! There is no other reason!",2015-05-29 06:41:48,elee0228,2
"I got even with a soda machine at work that constantly took my money, yet wouldn't let down the cans ...",2015-05-29 06:43:48,Back2Bach,2
"Bubble wrap, like I'm trying to open a box but there's fucking 100 tons of bubble wrap I just rip it all and smash it all over the place.",2015-05-29 06:51:21,kyle8998,2
"A picture of my step pop and I together. After my Nan died, I was so angry at the way he treated her that I burned that photo.",2015-05-29 06:59:28,IdPopACapinSancho,2
Dark Souls. I actually bit my mouse.,2015-05-29 07:36:00,DovahSpy,2
When I was a kid I was playing Candy Land with my family. I was at the very end of the board when I drew Plumpy and got sent back to the beginning. So I ripped him in half.,2015-05-29 08:00:34,curious-cuttlefish,1
"Not me, but I when I was a bartender, I worked on wedding where the Father of the Bride was obviously not happy.  He sat at the bar, put a $50 in my tip jar, and just told me to keep giving him 7 and 7s.  Anyways, after three (I was slowing him down at this point), he got up, walked over, looked at a statue, and punched it as hard as he could multiple times, then pushes it over.  He then spit on it, then walked off, his hand bleeding.

tl;dr- Guy at a wedding gets in a fight with a statue, wins.",2015-05-29 08:01:07,PM__me_compliments,1
"I was touring with a band. It was about 2:00 in the morning on a drive from Miami to New York. All I wanted to do was watch Fight Club for the 58th time. The DVD player on my laptop decided it didn't want to play the burned copy I had made (don't judge me... I was beyond poor at the time). I hadn't really slept in a couple weeks, so I calmly removed the disk, pulled the drive out of my laptop, and threw it out the window of our van while going about 70mph up I-95 somewhere in South Carolina. 

It's said if you listen carefully late at night, you can still hear the sounds of it clicking and whirring on the breeze.",2015-05-29 08:05:25,DocHoss,1
"Ever tried removing a heater core with the dash still in place?

THE GUIDE SAID THERE WAS ENOUGH CLEARANCE!!!

Lets just say I needed a lot of JB weld to put the airbox back together after I ripped the fucking thing out and stomped on it screaming ""WHO IS YOUR DADDY NOW?""",2015-05-29 08:07:57,Megaross,1
When I was was a freshman in college I bought the cheapest printer I could find. Finally got tired of it constantly jamming and just threw it down the hallway in my dorm.,2015-05-29 08:08:23,Iguanas14,1
"A friend's dad asked him to move his dresser before he went to play golf with me. Friend did not, and instead just played golf with me. We come home, and his dad was in the process of destroying the dresser with an axe in the driveway. You can't even be mad at that.",2015-05-29 08:11:18,kickedthehabit,1
"My buddy's GPS wouldn't shut up so I yelled ""COLLISION AHEAD!"" and elbowed it right in the screen.",2015-05-29 07:43:46,kitterpup,1
News papers. I deliver them for a living and I kid you not it gets so frustrating and so old sometimes that on at least two occasions beaten a half-rolled paper on the side of my car.,2015-05-29 05:51:31,Weedners,2
Mobile,2015-05-29 06:24:14,sachinraju,1
I once threw one of those peg games across the room at Friendly's.,2015-05-29 06:25:40,string97bean,1
Many many video game controllers,2015-05-29 06:44:15,happywaldo,1
Xbox,2015-05-29 06:53:39,Bu5ybee,1
Laptop.,2015-05-29 07:23:52,PrinceWhiteFrog,1
"When i was a kid around 7-8 years Old i had received as a gift the gameboy advance . i was playing with pokemon ruby version something like 24/7 so one day i finally reached the league and my mom , who was asking me to shut it down, took it and threw it out of the balcony. Saddest moment of my life :( . It somehow survived and still worked but it opened in half at that moment. The pain in my eyes was :(((((((( I still have it and i played with it so much that for press even a key you need to use an hammer.",2015-05-29 07:26:57,Tynot,1
"I tried with my one piece nokia phone, I beat it against a cafeteria table, the phone was fine, the table surface got a solid crack in it.",2015-05-29 07:33:05,Hijis,1
"Play video game, badly. Throw controller at wall. Get new controller. Repeat.",2015-05-29 07:33:34,sengoku,1
"Several headsets, keyboards, computer mouses (both laser and ball), playstation controllers and Xbox controllers. I guess I've got somewhat of a rage issue when it comes to gaming..",2015-05-29 07:34:01,skackinator,1
I was trying to restring a guitar but the peg was broken. Decided to get rock star with it instead.,2015-05-29 07:35:28,junhyuk,1
"[""PC load letter?... what the fuck does that mean?""](http://big.assets.huffingtonpost.com/1120officespace.gif)",2015-05-29 07:37:49,EasyTigrr,1
N64 comtrollers....,2015-05-29 07:44:12,slooted,1
I got mad and threw a chair at the ground,2015-05-29 07:44:17,Poogmaster1999,1
"I guess it wasn't totally destroyed, but I ripped the pull chord out of a chainsaw when it wouldn't start. I hate when things don't work.",2015-05-29 07:45:14,therealmaxipadd,1
i was playing crash bandicoot on my ps1 and i kept losing so i threw it against the wall,2015-05-29 07:50:10,c4stiel,1
My laptop because of a flash game. I was not a smart 13yr old,2015-05-29 07:57:46,HighSchoolThrowAw4y,1
My Xbox pad.,2015-05-29 07:58:54,TheBeardedBandit94,1
"Surprisingly, *not* my PS2 controller, but not for lack of trying.  There are some pretty good controller-shaped dents in my rec room wall thanks to the RC missions in GTA San Andreas.  Coincidentally, there are some pretty neat posters near the TV in the rec room now.",2015-05-29 07:59:49,PhilosophyOfTheWorld,1
One of the Assassins Creed multiplayer discs. I hated it so much that I bent it in half back and forth until it cracked just so that I couldn't play it again.,2015-05-29 08:01:03,Satans_Master,1
"tamagotchi

also a disc-man",2015-05-29 08:01:27,p199y,1
"My ps3 controller, I was playing call of duty and there were people that just knew where I was all the time! So I got really frustrated cause I would shoot them first and they just would turn around and kill me! So I threw my controller against the ground 10 times, broke it then cried... I'm an 18 year old dude",2015-05-29 08:04:07,LSDprincess,1
"Sometimes when I get really angry (very rarely), I just grab some pencils and break them in half. Good anger relief.",2015-05-29 08:04:37,Agent_Orange7,1
I used an old kirby vacuum as a sledgehammer to destroy a canon ink jet printer. The Kirby didn't even flinch.,2015-05-29 08:06:18,four-sixty,1
"Rambo cartridge for the Sega.  Three lives, no continues.  

https://www.youtube.com/watch?v=vo6mLfCrzhg

It died by hammer.  I still get crap from my friends about this game lol",2015-05-29 08:07:51,jfrat71,1
"almost ftl

when your one jump from the crystal cruiser and you die words cant describe the **RAGE**",2015-05-29 08:09:54,Lemerney2,1
"My baby's body.

Hey! You said not living !",2015-05-29 08:13:13,viper_polo,1
[A fig tree](http://en.wikipedia.org/wiki/Cursing_the_fig_tree),2015-05-29 08:13:25,revengeofthedodobird,1
My sense of self-worth?  At one point or another.,2015-05-29 08:14:44,John_Q_Deist,1
A spatula got so frustrated while burning and breaking pancakes that I threw it on the floor so hard that it snapped in half. never cooked pancakes since I fucking hate pancakes.,2015-05-29 08:15:37,femstora,1
My controllers on 16bit gamestation.,2015-05-29 08:20:01,Pinktail,1
ITT: people with anger issues,2015-05-29 08:21:31,jealkeja,1
"The cabinet door that I opened up like 2 minutes before and forgot to close that I hit my head on. I hit my head, looked at it like it just said it fucked my mom and punched it. It broke, I realized I rent and have to fix it now, then I realized I was mad at it because I left it open",2015-05-29 08:23:44,its_not_brian,1
"My neighbor thought I was crazy when he pulled into his driveway a few years ago and I was out in mine smashing a plastic riffle. But in my defense, it was SO loud and my kids wouldn't stop fighting over it.",2015-05-29 08:24:19,Macandthecowboys,1
"A laptop. I was working a lot of hours at a store near where I lived (road a bike to work) and was taking a lot of online courses through a local community college. The only way to get to a computer other than my laptop was to ride my bike pretty far to a library. It was late and I was taking a test that was due that night. My laptop decided to not work. Screen issues. The library was closed. I grew angrier and angrier as I tried to get it to work as the deadline grew closer and closer. It was one of the big tests that was requried to pass the course. 

And I watched the deadline pass by...And I threw that fucking laptop at the wall so hard it went to pieces. And yes, I failed the course. I would have (should have) done it earlier than the night it was due, but it was an easy test that I shouldn't have had issues with. It was that fucking laptop. That laptop died for good that night. 

And now anytime one of its replacements gives me trouble I threaten it. My laptops work out of fear....",2015-05-29 08:24:36,VikingHedgehog,1
Comcast.,2015-05-29 08:25:15,gtownbingo100,1
Love,2015-05-29 08:26:02,liquidxtension,1
"Not me but my best friend. Sophomore year of college, we played a ton of Mortal Kombat for the Xbox 360. We were pretty evenly matched, but we both had our pet characters. I loooooooved Cyber Sub-Zero, his Jump Down+B was spammable and I had no shame. We got drunk one night and decided to play a game before we went out. I beat him by the barest sliver of life, and he proceeded to squeeze his controller till it cracked, then threw it down and left the room. We were done with drinking for the night, and two player video games for a few weeks.",2015-05-29 08:26:20,Maestro_Lama,1
"My laptop. I died while playing WoW (Drunk raiding), and slammed my hand down in anger. I happened to crack my laptop's hard drive in half.",2015-05-29 08:26:54,vwboubw,1
My anger.,2015-05-29 08:28:08,evidencefirst,1
The bathroom door was right next to my bedroom and it would always make this creaking sound and wake me up. So annoying and i was so tired I CBF getting up and closing it. So one morning I got up and slammed the door repeatedly as hard as I could until the door came off the hinges. Well that was one way to fix the problem,2015-05-29 08:30:05,Humanguy287,1
My copy machine,2015-05-29 08:30:06,BenEHunt,1
A couch. The damn thing was so heavy trying to drag it upstairs so I let the damn thing fly down the stairs. Ended up splitting a few particle board panels and breaking a bunch of the metal frame.,2015-05-29 08:30:40,assblister,1
"Lawn mower, every time I used the damn thing it would randomly shut off, one day I took it to the roof and threw it across the back yard",2015-05-29 08:30:53,Resgenta,1
I was having a bad day and was at my pantry for food when I stubbed my toe - icing on the cake for the day. At that moment I had a large jar of peanut butter in my hand... it met the floor with considerable force and exploded. I found peanut butter for days...everywhere. 2/10 would not recommend introducing a peanut butter jar to the floor.,2015-05-29 08:31:06,Coup_Soup,1
Ikea,2015-05-29 08:31:34,fredryk,1
"Street Fighter II

Fuck you, M. Bison.",2015-05-29 08:31:37,Notoriously_Infamous,1
"Flappy bird on my old iPod touch, I got so pissed off when playing that I physically bent the iPod to a 90* angle",2015-05-29 08:31:40,Deego_Beego,1
"Didn't learn much about the Romans until I came to a western country. But the Greeks though, Greek mythology is pretty well like in China and many great Greek politicians and philosophers are often discussed and referenced compared to other non-Chinese philosophers and politicians.",2015-05-28 18:41:31,lucidsleeper,390
"In Russia, I remember reading Greek myths and stories since I could read. Pictures of Greek philosophers lined the walls of my classroom; history, literature and of course geometry and physics all featured them prominently. Examples of Greek art could easily be found in just about any museum.     

Rome received significantly less attention. Like way, way less. I didn't even know Rome was *important* and more than just a Greek-culture hanger-on until high school. Not sure why that was.",2015-05-28 19:39:28,grumpy_hedgehog,473
"Well, it's treated basically as a part of Western history that happened and then our textbooks will show the ancient ruins but we don't go in depth. Nothing beyond, at certain date these people existed, they made these buildings, now let's get back to Islamic Civilisation, the Prophet Muhammad and how the Malacca Sultanate came to being.

Basically an important footnote.",2015-05-28 20:35:52,Nixconvie,135
"We had to read a translation of the Iliad and the Odyssey, and took a semester to study both the literature and the culture at the time they were written. We also took a quarter to study ancient Roman history. 

This was my experience in a Philippine public high school.",2015-05-28 22:02:14,misterman0101,55
Aren't the Greeks just as fundamental for Middle Eastern history as they are for European history?,2015-05-28 17:35:34,Protag-oras,306
Indian here. The Greeks were mentioned a lot more than the Romans but here is the interesting part - most Indians know about Alexander the Great and his battles in India but most have no clue about the Indo-Greek kingdoms that actually reigned in the Indian subcontinent for a long period of time.,2015-05-28 23:27:59,weirdnamedindian,46
We never actually learn anything about them. We do learn about Apartheid for about 7 years.,2015-05-28 17:22:17,Zumoari,71
"Praised, you don't really learn of anything bad from them prior to college, if you ever end up taking classes about it in college anyway, just how great they were and shit.",2015-05-28 17:16:52,thissiteisawful,92
"They were one of the **many** great ancient civilizations in the world, rather than the **only** one. They got their fair share of coverage among Indians, Mesopotamians and Egyptians. Chinese history is a separate topic because, well, it's national history.",2015-05-28 18:00:44,SarcasticCynicist,769
"I'm not a westerner as I'm Belarusian, but I'm still in Europe, do I count? We learnt about Ancient Greece. Not anything on the Romans but I moved to the UK part way through school, so it might have been much later I suppose but I doubt it. We focused more heavily on Greece- philosophers, theatre, Sparta, the gods etc. I remember learning about the mythology from picture books and up.",2015-05-29 01:08:28,TheFairyGuineaPig,15
"Indian here. I remember we were taught about Alexander the Great and his invasion into India and how he was stopped by King Porus, making it the end of his expansion all over the world.

Most of Indian history otherwise covers the dynasties that ruled India before the British Invasion like the Mauryan or the Mughals. Some of the stories there are Game of Thrones worthy, but definitely interesting.",2015-05-28 21:20:08,do_usernames_matter,75
"In Turkey, Ancient Greece is mostly praised because they mention them later at the not so Dark Ages. Rome is almost never mentioned as Turks were mostly around Asia by then, and they really didnt do anything significant to Turks in general. Byzantium is generally trashed to the ground, considering the many wars they lost.",2015-05-28 23:53:20,Loukoumia,26
"If it weren't for movies from Hollywood, I doubt I would've ever heard of Ancient Greeks and Romans( ima malaysia dude)",2015-05-28 23:04:33,shunrencyber,14
"As a Greek, my heart is melting :3",2015-05-28 23:47:06,Evagelos,26
Australian here. We didn't learn history apart from the last hundred years (ww1 and ww2).,2015-05-28 23:02:33,nielsman,34
They taught us nothing. I believe this is the case for most of East Asian countries.,2015-05-28 22:27:11,ohirony,11
This is my favorite askreddit in a while!,2015-05-28 21:32:59,bigjilm1275,44
Almost non existent. Don't recall learning anything about them here from the Singapore education system.,2015-05-28 21:25:46,STUPEFY999,13
"One chapter each in 8th grade social studies. 
But i was interested in mythologies, so I read up on Greek and Roman mythology from Encarta Encyclopedia. 
-from Nepal",2015-05-29 00:48:46,lookingforaminion,6
"I'm glad OP brought this up. Because it gives lie to the claim that Western history is so Eurocentric and Western kids are the only ones suposedly who never learn about all the other great civilisations of history.
Well guess what? Its the same everywhere.
East Asians learn pretty much nothing about Greece and Rome in history class. They learn about China mostly.
The Chinese hardly learn about Rome and Greece either.
Indians and Persians learn about Alexander and his conquests but there hardly any mention of Rome or Greece before Alexander.
Middle Easterners learn mostly, if nothing else, Islamic history.
And nobody seems to give a flying fuck about African history, sadly.
Thw truth is every culture studies the history that which it is closely connected to.
Your average Western kid couldn't tell you much about the Song Dynasty anymore than the average Chinese kid could tell you about the Byzantine Empire.",2015-05-28 23:53:24,weirdnamedindian,25
We never learn about it in my school. The only way to study about Greek mythology in my country is to get your own books.,2015-05-28 20:59:56,Naz13,5
"In India we touch on them briefly as ""another ancient culture"" but we mostly just focus on our own ancient civilization. 

We did however spend some time on ancient Egypt, I'm not sure why though. We didn't explore any other ancient civilization in much detail.",2015-05-29 00:45:38,theroyalalastor,6
"From PH here. Our world history class did not even mention them :( I've learned about Greeks from TLC and the movie 300... 

This is madness....",2015-05-28 23:16:47,raffy56,8
"I don't really remember learning much about them in Malaysia, but that might be more of my poor memory due to it being so long ago.

I remember learning about Mesopotamia and Egypt and those other places though. 

The history books were almost entirely ""History of Malaysia and Islam"". I highly doubt things have changed since I was in school.

Additionally, I fucking hated Sejarah. Also Pendidikan Moral. So fucking stupid. I actually love history now, but none of it was thanks to what I learned back then.",2015-05-29 00:17:59,umiman,5
"South African here (we're kind of ""westerners"" but whatever). The Romans especially get a lot of coverage in our history classes. Not so much the Greeks, beyond Alexander the Great and the birth of democracy.

We learn more about the ancient African empires and kingdoms - Great Zimbabwe, Ghana, Mali, and *especially* the East African trading cities like Mombasa.",2015-05-29 01:38:18,Paradigm240,4
"At least on my experience, we didn't discuss about them until high school and my teacher skipped the chapter.

So let's go again talking about how the Dutch were very cruel, 1610 never forget, Daendels, etc. etc. VOC.",2015-05-29 00:33:59,rimarua,4
"Indian here. Hmm we touch on Greeks with Alexander and some scientific and civilisational achievements but not heavily. Romans, ehhh we don't really cover that. We cover more of our history. It's as exciting as the European one.",2015-05-29 07:38:03,ameya2693,3
"**Attention!** Please keep in mind that the OP of this thread has chosen to mark this post with the **[Serious] replies only** tag, therefore [any replies that are jokes, puns, off-topic, or are otherwise non-contributory will be removed](http://www.reddit.com/r/AskReddit/wiki/index#wiki_--.5Bserious.5D_tags--).

If you don't fall within the scope the question is directed to, please do not reply to the question as your comment will be removed. If the question is ""Bakers of reddit..."" and you're not a baker, your comment will be removed. All top-level replies need to be from someone who is in the group the question was asked to.

If you see others posting comments that violate this tag, please report them to the mods! 

Thanks for your cooperation and enjoy the discussion!


*I am a bot, and this action was performed automatically. Please [contact the moderators of this subreddit](/message/compose/?to=/r/AskReddit) if you have any questions or concerns.*",2015-05-28 16:15:58,AutoModerator,10
"In western classrooms the regard the ancient Chinese as the greatest civilization when they built the treasure ship fleet. I dont think that they are the only ones covered, its just that the Greeks and Romans had a much larger influence on literally everything. Architecture, art, science, language, culture, and even the way that we think.",2015-05-28 20:55:34,pxrking11,6
"It isn't taught at all, ever. I majored in English in university, so I learned about it in western history and lit. I'm sure there are special paths in high school that sort of cover it somewhere, though...",2015-05-28 21:55:32,Neptune9825,3
They are both a huge topic in history class. And as both of them are just a few hours away (Rome 6-7 hours per car) they are a great vacation place as well,2015-05-28 23:49:24,MondRubberduck,3
Militarized by Disney,2015-05-28 20:10:28,Lumberzack1,554
SEARS NOT WILLIS,2015-05-28 19:42:43,WhatUpMyNinjas,290
"coca-cola, aquarium, rappers",2015-05-28 20:59:26,catpupy,242
Boring as fuck.,2015-05-28 20:22:05,CashCop,114
"Weed, Beer, Mountains",2015-05-28 19:42:28,SoYoung_SoHigh,405
Bourbon fueled horseracing,2015-05-28 20:14:07,OddQuasi,110
Flooded as fuck,2015-05-28 20:47:41,GatorAIDS1013,361
"Alcohol, Crawfish, Jazz",2015-05-28 21:18:24,satchmo_brees,173
A Whale's Vagina,2015-05-28 19:31:21,GetInTheVanKid,586
Windy Capital Hobbits,2015-05-28 20:35:09,SafariNZ,76
"French, Poutine, Strippers

Edit: defs Montreal, but New Orleans is the home of my people! Or... Some of them anyways.",2015-05-28 20:31:11,beebee224,273
It's Los Angeles,2015-05-28 19:37:45,twixtogo,1344
"Beer, bridges, hipsters.",2015-05-28 19:20:50,Flowsephine,457
Bagels. Impatience. Superlatives.,2015-05-28 19:21:11,boobieaficionado,317
Remember the Alamo,2015-05-28 20:49:08,HereBeBeer,117
"Pahk my cah.

Edit: alternatively, ""You like apples?""",2015-05-28 20:19:56,ExpatJundi,346
Chili on spaghetti,2015-05-28 22:04:22,ChristmasSleep,51
River on fire,2015-05-28 19:45:41,RunninOnStalin,113
Melodic death metal,2015-05-28 20:15:55,Randomswedishdude,41
"Lakes, Hipsters, Theatres",2015-05-28 20:42:14,CivEZ,35
Pillaging - Burning - Anarchy,2015-05-28 19:20:57,naturelover7777,217
Read my username.,2015-05-28 19:56:00,thatguyfromnewyork,237
Rob Ford's playground.,2015-05-28 19:31:35,I_r_cabose,138
"Toasted Ravioli 

Less than three words but those from here know what I'm talking about.",2015-05-28 19:22:19,geoffisblind,80
"A shitty town.

Edit: Can't this get you banned somehow?

Edit: Guess not.  Thanks /u/Im-Emotive",2015-05-28 19:19:57,snow_yoshi,87
ITT The U.S,2015-05-29 02:41:54,Kuchendieb23,245
"Floods, flooding, flood.",2015-05-28 20:16:17,MyOtherActGotBanned,23
"Royals, nuff said.",2015-05-28 19:34:15,nightcrawler84,67
Butthole of California,2015-05-28 20:20:25,Tits_McGillicutty,58
Cold. Expensive. Tech.,2015-05-28 19:35:28,Ifette,72
"Republican, Southern, Beaches",2015-05-28 20:16:54,doinmyownthing,12
"Celtic, Tenants, Irn-Bru",2015-05-29 03:58:25,PapaFern,13
"Speedies, Depression, University",2015-05-28 19:23:23,writetaildeer,31
"Don't need three: ""Mile High""",2015-05-28 19:21:03,mojobytes,41
"Traffic, Music, Blackpeople

That's three words, I promise.",2015-05-28 20:18:10,TryMeLater,49
"Strippers, Gambling, Drugs",2015-05-28 19:27:17,TheTenthRegen,20
Meth capital candidate,2015-05-28 19:50:21,icecreamlove,19
Phil A Delphia,2015-05-28 20:14:39,GrossoGGO,46
Fancy Texan pegasus,2015-05-28 21:16:37,papercranium,15
"Banks, DuPont, crime",2015-05-28 20:16:47,watson107,5
"Coffee, Beer, Rain",2015-05-28 20:41:01,thequietone710,7
"Title town, bitches.",2015-05-28 19:34:28,B_Y-_-V_W_L,55
Lots of colleges,2015-05-28 19:25:59,soccergirl13,11
Bayou City,2015-05-28 19:23:00,Casty_McBoozer,15
"Riots, baseball, toasted ravioli",2015-05-28 19:48:46,jkduca,17
"I would say the evolutionary trait most associated with human success is intelligence (with an argument for thumbs to utilise tools) but thumbs are probably much easier to evolve than human level intelligence. This weights it towards other mammals as they are the closest to getting there already

In addition to intelligence its pretty important to possess social skills so i'd suggest a pack animalsmy first instinct is towards something canine or feline but their efficiency as hunters might actually deter selection for intelligence (a less efficient hunter might have to be more intelligent to survive)

therefore i suggest some sort of rodent, preferably something social, i don't know enough about rodents to select one

also as a curveball ignoring all my previous arguments crows are scarily intelligent - fear our new crow overlords",2015-05-29 05:41:41,crowleftofthemurder,47
"Raccoons, duh",2015-05-29 06:47:21,oubrew,12
"Jellyfish, they evolve to walk on land and will shock those who disobey.",2015-05-29 07:01:44,kyle8998,10
Dolphins.,2015-05-29 05:29:19,PrayingForJetpacks,35
"Octopuses

Edit: spelling",2015-05-29 05:46:02,SamwiseTheOppressed,17
Birds are underrated.,2015-05-29 07:08:05,210pa,5
Cats already dominate Earth.,2015-05-29 05:45:45,db82,11
