"I kinda did this. Woke up knowing how much of a mistake going to art school in san francisco was, called a friend who came to the city later that day and helped me pack my shit and left. I moved in with a different friend, got a job the next day, and went from there.  I told my roomate when they called a few days later (I was in school housing, so I didn't dick them over), and a friend from work the day I left when she called wanting to get some dinner.  Never regretted it, because eventually it lead to my spouse and kids.
Edit- no, guys, this is not from HIMYM. I am realizing I should have sued the shit out of the writers for stealing my story, though.",2015-05-28 19:57:21,katikaboom,157
"Well this isn't me, but a friend of my Dad's. Friend or drinking buddy, they're both pretty bad alcoholics. Anyways...


We'll call him Derek, Derek and my Dad met when I was around 10-12 years old, they became best friends/drinking buds, he would spend everyday there. Derek was also Scottish and immigrated sometime around 2003 I think.

Derek owned the local corner store, had to declare bankruptcy, moved to the city. Fast forward about 8 years, Derek is unhappy with his life and has gotten in touch with an ex-girlfriend in Scotland. 

Derek leaves his wife of 25ish years, son and daughter, 3 grandchildren all behind. But didn't actually leave them formally, no he went to work and just never came back. Sent an email a week later. 

I don't like Derek. 

According to him, he's happier than ever.

TL;DR Scottish drunkard goes to work, leaves family behind...is a dick.",2015-05-28 21:46:49,peroxwhyLUSH,117
"Not first hand experience but this happened to my mom when she was like 14 (45 years ago)

Her uncle went out for a pack of smokes when she was 14 and they never saw him again.. it was like an urban legend in our family... until my grandfather (his brother) found him 40 years later...

He's now living in the US (we're from Canada) and has had a completely new family (they didn't know about us and we didn't know about them. Refuses to come back to Canada (we don't think he's allowed back...) and doesn't want to talk about any of the circumstances on why he left :/  

We're still trying to adjust to it but it's still really weird",2015-05-28 21:47:30,Aldren84,20
People that only talk about themselves and think you care enough to listen to a one-sided conversation for an hour.,2015-05-29 05:44:44,WilloWallo,193
"Chewing with your mouth open. I know those of you who do it don't hear it, but it's louder than you realize, and it sounds really fucking gross to the rest of us.",2015-05-29 04:44:46,schniggens,370
"People who speak with confidence on a subject they have no fucking clue, confident idiots are just the worst kind, spreading stupidity",2015-05-29 05:55:11,Feathalise,312
Not respecting your turn in a line and trying to take someone else's turn. The worst behavior I can think of!,2015-05-29 04:52:07,GluteusMaximus90,77
"Compulsive lying. 

Oh, you know six languages? Okay. 

You work out 2 hours a day? All right.

You've had twelve girlfriends? That's nice, I guess.

You always stop to play with kids at the park? That's...weird.

You're with your fifth girlfriend now? Didn't you tell me you've had twelve?

Lots of fun watching them backtrack when you call them out, though.",2015-05-29 04:46:45,ZoomJet,253
Littering. Wait the fuck up and find a trash can.,2015-05-29 06:19:05,keysharpener,98
"People entering lift/ train before letting people exit. Seriously, there's only as much space. You aren't creating any more.",2015-05-29 04:45:25,aashish2137,171
I hate it when groups of people walk slowly next to each other in a line so you can't pass them.,2015-05-29 04:43:46,GYN-k4H-Q3z-75B,332
"People who can't keep their kids in any kind of control and then bring them in shops, restaurants and so forth and completely ignore their spawn trashing the place. Bonus points for going postal when someone kindly asks for them to stop their kid from biting them or something.",2015-05-29 04:38:26,TuxieD,371
"Flaming in video games. Seriously this is the must disgusting thing I put up with in day to day life. I play a lot of League of Legends and the things people say is just crazy. How can you expect a good game from someone if you insult him every minute of it. I always think of the movie God Bless America ""We have lost our decency"".",2015-05-29 05:35:33,MrFromEurope,56
"When someone I just meet calls me,""chief,"" or,""boss.""",2015-05-29 05:15:40,facepuker,47
Playing music on your phone without headphones.,2015-05-29 04:19:00,ScaramouchScaramouch,169
"Being two faced.  I know you don't like me, why do you act like your my best mate every time you see me?",2015-05-29 04:50:28,Presuminged,87
Not signalling to change lanes or turn.,2015-05-29 05:02:58,Waffles_R_Delicious,28
"When people stand in shop doorways yapping, and block the thing totally.",2015-05-29 07:07:35,babyreadsalot,14
Being at a restaurant with your mates and instead of socializing with each other they're all fucking around on their phones.,2015-05-29 06:46:22,ferdinandblue,56
"People that occupy an extra seat on public transportation for their luggage in rush hour, or people who don't give up their seat for elderly folks",2015-05-29 05:23:22,shickabang,26
Oversharing on Facebook. Enough with the clean eating / work out updates already!,2015-05-29 07:22:07,vegemite_ismyjam,12
"One uppers. They've always done better, done more, know more than you. Irritating as hell. Even worse when it comes in Victim Olympics format. *Sir, so you have alcoholism and PTSD? Oh, ma'am, and you have alcoholism, PTSD, and bi-polar? And you sir, you have alcoholism, PTSD, bi-polar, ADHD, schizophrenia, and autism?*

Also habitually sarcastic people. It gets old, people. Real old.",2015-05-29 07:21:11,doesntakethehighroad,31
"Calling criticism ""jealousy"". Downvoting, insulting, reporting people because they have an opinion on something instead of just padding your pathetic shoulder. This more and more becomes a thing with the internet, even here on Reddit i see it every single day.",2015-05-29 05:09:50,Nasyr,48
People eating with their mouth open. It's more common then you would think... and bloody disgusting.,2015-05-29 04:39:24,hektor_magee,28
"Casual conversations in public bathrooms.  It always boggles my mind. One of the participants in the conversation has shit coming out of his asshole *right now*, yet there they are, talking about their commutes like it's nothing.",2015-05-29 06:23:31,PhilosophyOfTheWorld,7
"People who have more children than they can properly care for.  

Whether it involves money or simply not having enough time to spend with them, I find that behavior disgusting.",2015-05-29 07:32:55,lifestop,7
"Spitting... It's just so gross, swallow that shit",2015-05-29 04:30:58,IN_U_Endo,86
[I found /r/childfree's answer](http://i.imgur.com/wwRzvba.png),2015-05-29 07:23:01,notwadely,6
Condescension toward retail or service workers.,2015-05-29 07:57:12,sheilathetank,1
"Pooping. Why do we do such a disgusting thing? I mean, everybody poops and it disgusts me. Ugh.",2015-05-29 05:46:52,Just_That_Kevin,17
"- Spitting on the pavement, it's disgusting, it's unsanitary and it's not a good sight to see your phlegm adhere to the pavement like that. 


- People who think it's appropriate to air extremely intimate details about their sex life for no reason. I don't want to hear that you had cum up your nose and in your eye. SPARE ME! PLEASE! 

- Passing judgement without sufficient knowledge - if you have sufficient information to form a conclusion on something then your judgements are valid - whether I agree with them or not. My main issue is people judging bases on ""face value"" without interacting with what they are judging, whether that be a person or an idea or whatever.",2015-05-29 04:33:21,DestinedToBeAPotato,34
Listen to music in public (on a fucking bus) using speakers instead of headphones.,2015-05-29 06:05:34,0011110000110011,10
"People acting counter-intuitive to their multitude of bumper stickers. I've been cut off on my Vespa by people with ""Share The Road"" and ""Look Twice, Save A Life"" bumper stickers. I've seen people with local (correlated to my city) bumper stickers galore throw cigarette butts and other trash out their car window. And a car covered with hippie, peaceful bumper stickers doesn't mean they won't drive like an aggressive asshole. These actions are frustrating enough, but openly (and redundantly) stating you advocate for certain ideologies/philosophies and blatantly acting in the antithetical sends me to the darkest of timelines in my mind.",2015-05-29 07:10:35,Dan_Halen,5
How people borderline stalk a celebrity. I'm all for loving a celebrity but it gets a little too much when you know what they are doing day in and day out or who their second cousins wife sons best friends daughter is. That shit is just weird.,2015-05-29 07:19:22,WatIsTheInternet,5
"Obesity and overeating in general. Two fucking thirds of the U.S. population fall under  the category of obese or overweight. It's gotten to the point where you can't fucking go outside anymore without seeing at least 2 of these hamplanets porking around on their scootypuffs at any one time. It's gotten so bad that it's made us the laughing stock of the world. 

And now with this ridiculous HAES shit. And it's not even health at every size, it's just the land whales saying ""health at my size"", AKA HAMS. Part of the problem is that everyone blames it on their genetic condishuns, when most likely 80% or more of these walking (barely) garbage disposals have no genetic conditions that contribute to weight gain, it's just that they are bunch of lazy pigs. And for those that do have genetic conditions, they're not going to make you balloon up to 400lbs, at most they only contribute to less than 20lbs of weight gain. Weight gain that can still be controlled.

If that's not bad enough, these butter-huffers are putting a larger strain on our medical system than on the reinforced chairs they have to sit on. They are costing the healthcare system, and by extension the taxpayers, billions of dollars yearly. That's why I get so fucking pissed every time I go out and see some pigs huffing down food like there's no tomorrow, which knowing the average lifespan of a hamplanet, means that it'll be a miracle if they make it to tomorrow.",2015-05-29 08:24:31,Justgoatythings,1
"I don't know necessarily how common it is, or if the people I know are young and stupid, but I can name like 15 people who have cheated on their significant others. I'm relatively young, but I feel like this shit is fucking gross behavior and I've told that to the people who have done this.",2015-05-29 07:48:54,holographic_meatloaf,1
People that judge others based on their occupation or income.,2015-05-29 07:50:53,GeneralTuber,1
"People who stop to have a conversation in the middle of a busy hallway or staircase,  completely oblivious to all the people they are now blocking....  Bonus points for doing it in a busy grocery store,  with shopping carts.",2015-05-29 08:16:51,Dpaterso,1
fennel i hate fennel,2015-05-29 08:20:09,captingeorgie,1
"Stop sneezing directly into your hand, it's gross.",2015-05-29 04:17:57,ProphessorHappy,23
When people shit on the floor and then proceed to throw it at me.,2015-05-29 06:30:42,Testinglorem,11
Just said this on another thread... people biting their toe nails whilst sat in a room with other people.,2015-05-29 04:36:01,high_snobiety,12
"there's something about nose-blowing that really irks me. if you're in close proximity to others, go somewhere else and do it!",2015-05-29 04:31:20,_surligneur,17
"Chewing with your mouth open.  I don't care what you are chewing, I do not want to share the noise or sight of it.  It's disgusting beyond belief and makes me want to leave your presence, immediately.",2015-05-29 06:43:15,gnamyl,8
"Smoking.  It's bad enough that your secondhand smoke stinks, but you stink too.  Badly.  In addition, the cigarette butts you throw everywhere are revolting.",2015-05-29 06:17:44,spook327,22
"Eating ass. 

Idk how common it is, but idk how folks can do that.",2015-05-29 07:15:07,FeedMeSpiders,7
"People who let their dogs lick on and into their mouth. I just don't understand.

Also, showing your dog's genitalia on a photo. It's not that hard to hold your dog differently.",2015-05-29 05:29:06,Metallica964,25
Taking up more space than necessary on public transportation. Fuck you if you give your bag its own seat.,2015-05-29 07:03:33,californicate-,3
"The ""I don't know, let someone else do it"" way of thinking.",2015-05-29 07:52:15,maracusdesu,1
People who dig their noses then proceed to shake everyone's hand,2015-05-29 04:45:49,rockonbro,5
Burping without covering your mouth or saying excuse me. Fucking savages.,2015-05-29 07:14:21,atticusmars_,5
"eating boogers, seriously who came up with that?",2015-05-29 04:32:16,RudegarWithFunnyHat,9
Nail biting. I know some people can't help it but man that is nasty.,2015-05-29 05:09:08,Beexyl,7
People who slurp their soup. Table manners please!,2015-05-29 04:45:08,ennuis,14
"Throwing cigarette buds on the ground. 

When I see people do it when they're waiting for the train/bus, I go up to them pick the bud up and put it in the bin that's usually almost literally in arms reach and I call them out on it with a raised voice. 

Most of them tell me to ""mind my own fucking business"" to which I respond (again, with a raised voice): Bitch, this is my business because I have to stand in that filthy shit every day.",2015-05-29 07:02:15,DaPino,7
"The refusal/inability to clearly communicate one's true feelings towards another person with that person. An isolated occurrence of this is not *disgusting*  - but I am disgusted by how prevalent and accepted it is for people in our society to build interpersonal relationships primarily with psychological manipulation, insincerity, ambiguity, and deceit.",2015-05-29 04:56:39,loan_wolf,8
Clipping fingernails/toenails in public.,2015-05-29 04:22:12,that_looks__great,4
"People who take up more than their fair share of space on public transit. On a busy train or bus when people are standing due to lack of available seating, I can't stand to see people with their bags on a seat beside them.",2015-05-29 06:26:22,sharedstars,4
"Smoking in crowded public areas. 
Like I don't give a damn what you do with your body, but when we have to suffer through it too; that's when we have a problem.",2015-05-29 07:23:50,Nogginess,6
I've been a waiter for a few years. People that snack their lips or just chew with their mouth open.,2015-05-29 05:29:18,Daigi81,2
"Kids allowed to run amok or behave like complete brats. 

Right up there with spitting (wtf).",2015-05-29 07:35:27,rawdatarams,2
"In the UK, I was brought up to think that the first person to a bus stop gets on the bus first unless an elderly person comes along and then they should go on the bus first.

Well the other week I was waiting for a train, the platform is fairly long and so I was waiting right at the very far end of the platform so I could get on at the first carriage. I got there 20 minutes early and literally 2 minute before it came this woman just came and stood right next to me, no one else was there just us. I knew she was trying to get on before me, she did end up barging past me and getting on first. It annoys me so fucking much.",2015-05-29 07:42:39,Camelanus,1
When people think knowing the current talking point on cable news is keeping up with the news.,2015-05-29 07:47:24,findmydays,1
Swearing loudly during casual conversation when I'm out with my kids.,2015-05-29 07:49:30,Sly_R,1
"Our last ball mouse. I remember when optical mouses came out and we replaced our ball mouse with one, i destroyed the ball mouse with an aluminum baseball bat. Those were such terrible mouses.",2015-05-29 06:49:25,roflpwntnoob,103
"I had a pair of shorts with a massive hole in them. I wore them at school without noticing them, and when I got home, I set them on fire.",2015-05-29 07:23:50,Vladimir_Is_Pootin,24
Dark Souls has really helped me chop a lot of fire wood. Nothing helps stress quite like essentially beating the shit out of a piece of wood.,2015-05-29 06:01:38,corvettee01,56
"Years ago I beat the game Ghosts and Goblins!!!   ....with a hammer out of frustration.

Fuck that game",2015-05-29 06:29:11,D00bage,51
"A digital clock that was on my desk, I don't know why but it kept doing a ""tic tac"" noise even though it was digital. So one day, I was really pissed off (I don't remember why), I destroyed it with a hammer and then threw the remainings through the window in the driveway",2015-05-29 07:31:56,CaesarSalads,36
"Not me, but my father. He is a palaeontologist, and once when he was working with highly delicate, teeny tiny fossil sharks' teeth, they kept breaking, so he'd put them in his mouth and eat them",2015-05-29 06:04:35,Sivnips,51
"A car I bought and a necklace I gave a girl.. 

Bit of a story behind this one.. I think when we started dating I was 16 and she was 14, so you still very new to the world of 'love' and relationships. She lived an hour away from me, and was literally the reason I got my license ASAP and saved up a car. Every cent I earned pretty much went into keeping this 15 year old shit fighter alive / full of fuel so I could see her.

One day, she made an off hand comment about how it sucked that I never actually bought her anything.. Which kinda hurt, but I thought fuck it, she is right. So I saved up. I searched. In the end, I settled on what I could only describe as the perfect opal, had all the right colours, was very pleasing on the eye, set into a little gold  pendant on a very fine, gold chain.

When I gave it to her, she literally cried. It was the first gift she'd ever received from anybody. She wore it everywhere. She never took it off. I can't even begin to describe what it used to do to my nearly 17 year old self to see her wearing that, and only that. She was just beautiful.

After I turned 17, I had to move to the other end of the country for a year for study, and being the tender ages of 17 and 15, we believed we could make long distance work, cause you know, them dreams of marriage, right?

Well.. The inevitable happened. We fought the entire year. We made up for the entire year. We broke up. We got back together. I finished my study, and I drove home. I drove that same shitfighter back to our side of the country 4,000km away. She didn't know I was coming back home at this stage.. And when I walked into her work to surprise the now 16 year old girl who I had fallen into that puppy love with, you can't even describe how I felt when I saw her wearing that necklace.

Then came what was mostly 6 months of bliss.. I got a new car, but kept the old shitfighter. She was doing great in school, things seemed great.

But it was shortlasted.. She grew distant.. And then stopped talking to me altogether.. Everytime I visited her, she wouldn't look at me, she wouldn't speak, she wouldn't say a word.. This went on for a month.. In the end, on a Monday, I went over I told her I couldn't do it anymore, couldn't keep talking to myself, and said I was going to give her some space until she sorted her headspace out. On the Friday.. She was dating one of the Army blokes that get stationed here where I live from interstate..

A week later, I received a letter in the mail, with two words - ""I'm Sorry"" and the necklace..

The next few months were hell. The torment of wondering how long it had gone on for drove me insane. At 18, I believed this girl was going to be my life. I gave her everything I could. I was there for her through the depression, through the self harm, through everything.. And I lost it all to some tosser in a uniform and nice car.. I actually went mad trying to reason it all out.

So one night.. I got in that old shitfighter, wearing that necklace, and I lined up the powerpole at the end of the road 3km away.. And then I began accelerating. I hit 190km/h by the time I left the road. But then I missed the power pole, and rolled the car 4 times, and somehow walked away from the wreck.. One week later, I destroyed the necklace. Broke every linkage. Turned the rock to dust.. And put it in an envelope and gave it straight back to her.

They say your soulmate isn't the person you have the most in common with, but the person who feels like home. I felt like our relationship was home. No amount of other relationships of any depth or commitment with completely different girls were the same.

But.. I grew up, and just like real life, when you grow up, you move out of home. My future doesn't lie at what feels like home.

Nicole, I hope you're doing okay. I hope he makes you happy.

TLDR - Wrecked a car and a necklace, both of which I bought because of puppy love for a girl.",2015-05-29 07:53:40,rustlethemjimmies,1
"Two Words.

**Gameboy**


**Tetris**",2015-05-29 06:33:56,Dick_spasm,20
My dad once got so mad at  a vacuum that he  smashed it against the sidewalk. Was interesting to watch,2015-05-29 06:25:21,mrmerrbs,14
"Golf club, because golf.",2015-05-29 06:25:42,ItsDarts,13
"Dark Souls.

But it was just the controller.",2015-05-29 06:26:47,PunkandCannonballer,6
"My husband once took a sledgehammer to a power washer that was useless from the day we bought it, but we couldn't return it and the replacement parts broke immediately too.",2015-05-29 06:37:03,streamstroller,6
"My cellphone. 

It keept turning itself off, sometimes screened calls by itself and didn't send me a notification of new voice message until sometimes 48/h later. Randomly turned off the screen lock and called people from my pocket. 

Got a new phone as a freebie from my service provider. 

Broke old one to scrap with a blunt object....",2015-05-29 06:14:35,Silvfer,11
"My laptop. It kept freezing and I had a very important deadline, and I picked it up and slammed it down... and that was the end of that. I was immediately remorsful, but it was already too late.",2015-05-29 06:12:46,Fruitloops_for_B,14
Keyboard. Got so mad once I smashed it really hard just to pop out some keys. Realizing I just destroyed my only keyboard I got even more mad and threw it out the window. I live in the 5. floor.,2015-05-29 06:28:23,comradeTJH,9
My fKuci/ng kEyb///oardd,2015-05-29 06:35:52,RorariiRS_V2,11
"Multiple DualShock controllers. 


Maybe the next Madden game shouldn't have LB's jumping 20 feet in the air for an interception. 


Maybe the next Dark Souls game shouldn't be filled with a bunch of bullshit that can kill you so easily. This shit is a game, not Australia. 


Maybe The Evil Within should give me more ammo so I can actually fucking progress. 


Maybe Assassin's Creed should have less of those stupid 'Follow and Listen' missions. 


Maybe I should take a break from video games.",2015-05-29 07:39:02,C0812,10
Remote control for the TV.  Absolutely spat it threw it at the wall and bingo lots of little remote control pieces.,2015-05-29 06:52:56,Cycloneozgirl,4
"Around the time the Xbox 360 came out I'm sure a lot of you remember the dreaded ""red ring of death"".

Well I was playing a game (can't remember which one) when I got the red ring of death and as you can imagine, I was platinum mad. Still, I kept my composure and managed to get it swapped for a new one at the local game store. 

A couple of weeks later I was playing Oblivion when all of a sudden, boom, red rings on the NEW console. I was really mad so I grabbed it and shook it while shouting ""YOU PIECE OF SHIT""

Terrible idea. 

Shaking the console while it was turned on made the laser burn up the disk and completely fuck it. That was it, that was the final straw...

I basically ripped the console out of my TV stand and ran downstairs. I then proceeded to open the door to the garden and I threw it as far as I could causing it to bounce off one of the stepping stones in the garden. But it wasn't over... I then ran up up to the pond and grabbed a giant rock that was placed next to it for decoration, from there I smashed the console about 15 times until most of my rage was gone.

After that I just sat there, looking at the pieces scattered everywhere with a big shit-eating grin on my face. I then had to buy another one for like Â£300 which was a lot for me at the time but it was worth it, it needed to be done. It must have served as a spiritual warning to the next one because I never had a problem with it and it's still running perfectly to this day.",2015-05-29 08:07:07,J_R_Taylor,1
"I once punched out the plexiglas front of a Super Mario Bros machine in the arcade of my university campus center. I had gotten way further in the game than ever before, and I had almost completed a really hard level when the jump button stuck and I fell off a platform. Before I knew what I'd done, I reflexively punched the front screen and the plastic shattered everywhere. There must have been forty people there, who just watched as I beat it out of the arcade.",2015-05-29 06:00:25,RoscoePST,7
"Not me, but my husband destroyed our printer because it was being an asshole and wasn't printing.",2015-05-29 07:02:09,zombirific,7
"I heard a funny story about my boss.

He has a short temper and once he bought a brand new pc. He is very knowledgeable when it comes to tech, but for whatever reason this pc just would not work. 

So this particular day he completely lost his rag, took it outside on to his garden and smashed the shit out of it with a sledgehammer, basil fawlty style.

Always makes me giggle when I think of it.",2015-05-29 06:31:14,SomeEnglishLad,6
Shit.,2015-05-29 05:51:18,BlueInventive,10
