"I used to count everything religiously when I was trying to lose weight, but I got to a point where I realised I wasn't fat any more and just enjoyed the exercise, so I stopped. Now I'm lifting, cycling, running and swimming and it's impossible to keep track of all the calories burned; If my lifts stall I'll eat a bit more and if I start getting too fat I'll cut down a bit.  I does help that I don't really care about aesthetics, just enjoy being strong and fit.",2015-05-29 05:25:58,Danwold,2
"I was in pretty much the same situation. A couple months ago when I started my first semester of college I ate like shit for a month and gained 15 pounds. I then became aware of what I was eating and dieted while counting macros. I lost weight at a great rate of about 1 lb per week for 3-4 months and lost all the fat I had gained. Since then I have been on a bulk without counting macros and I have gained 30 pounds in the last 5 months. Thats 1.5 pounds/week, near the upper limit of weight gain. I know that it is not optimal but I also didn't want to be the obsessive person that I had been before, counting macros and getting my diet perfect before I went out with friends. 

I would say my quality of life has improved greatly, I don't look like shit even if I did bulk fast, in fact I look much better, and I no longer obsess over calories like I did before. Eventually, I will probably go back to counting calories when I get closer to my genetic limit, but thats still a long ways away.",2015-05-29 00:38:21,DickButtV2,1
"Yep. It can be doable for a little while. I calculated my intake for a while then got lazy and then just ate similarly for a while after and it all balances out.
But if you get too lazy and start cheating or falling behind it'll bite you in the ass quick",2015-05-29 01:30:58,ryuujinusa,1
"I pretty much eat the meal with the same ingredient every meal, so I know how much I need to eat slowly gain weight (about a lb per week ). Once I stop gaining, I just add like another cup of pasta or an extra chicken breast. After counting for a couple weeks, you get a pretty good idea of how much you need eat.

Now, if I'm trying to get really shredded, maybe for some kind of event (like 7%ish bf), ill pretty much weight and count everything.",2015-05-29 02:03:58,kinganthony3,1
"I've found that counting calories in general just helps you stay on a regimented plan.  Even if you are eating well, it's easy to lose track of what you've had throughout the day and maybe throw back an extra cup of rice putting you over your limit.  I like to count calories pretty consistently just to keep some structure in my diet.",2015-05-29 02:11:54,Scabbies1,1
I cut down to just under 10% BF not measuring or counting calories. I know my TDE so I basically just estimate how many calories I eat at every meal and try and stay around maintenance now. I've found this way easier than painstakingly counting everything. Keep in mind though that you should have a rough idea of how calorie dense the food you're eating is before trying this method. I always overestimate if I don't know. But Ive done the whole chicken rice and veggies thing and I like this method WAYY better. If I want ice cream I eat ice cream and fit it into my TDEE. I really enjoy food so I could never do it any other way,2015-05-29 02:43:47,yahhbsam,1
"It looks like you found a good way to lose your pounds, so why change a winning team?
counting calories is'nt that easy there are two ways : http://www.webmd.com/diet/dos-donts-counting-calories",2015-05-29 04:18:21,JesseMuller,1
This just sounds like you used to count calories and now that you've done that you know what you're doing and how much calories are in things by eyeballing etc. Thing is lots of people who have never tracked calories before will make terrible estimates.,2015-05-29 04:32:41,oramidriven,1
"I have lost 40 pounds in the last year. I could not for the life of me tell you how many calories I'm eating, or what my macros are. I reduced my portion sizes within an already healthy diet, and I lost weight.

It can be done, OP. Keep up regular weigh-ins, or measurements, or whatever you choose to keep yourself accountable, and you should be fine.",2015-05-29 04:36:40,BlueShoeLover,1
"I counted for a while, but i generally eat the same stuff most days, so i stopped because i kind of know what is excessive and what is lackluster now.

I'm not big into the meticulous science behind losing/gaining weight. I probably would be if my goals changed, but for now I am happy just lifting heavy after work, and eating enough good food that i grow steadily.",2015-05-29 04:36:50,OllieGozz,1
"I started counting last summer and successfully dropped about 19kg. I'm sitting comfortably about 94kg without counting and I'm still getting stronger and leaner. The difference now is that I know what a protein rich, fat rich or carb rich meal looks like. I can resist foods I don't 'need' and it's working for me.",2015-05-29 04:43:12,DallassDrake,1
"Depends. If you're someone with strong will power then it's probably simple. In my case, not counting and closely monitoring never got me results...counting since mid-Feb has lost me 16 pounds.

If you can do it successfully...do it...I too can't wait for the day where I feel comfortable just relaxing and being mindful of what I eat!",2015-05-29 05:31:33,Bencousinwater,1
"I am totally on board with the science or whatever of counting calories but it just doesn't work for me. Sorry I should rephrase - I don't care enough to make it work for me. I am firmly on the 'lots of veggies' diet - I figure if 60% of my diet is veggies, imma struggle to eat over my TDEE very often. By doing this i've dropped 15kg. Could it have been faster if I had tracked calories? Yes, definitely. Would I have enjoyed my life as much? I don't think so. I once read a comment on this subreddit where the guy said when he went out to the pub, he would input his alcohol intake whilst at the bar ordering another drink. To me personally this just sounded incredibly said (even if it is the best way to do it for weight loss). **My advice** stop tracking if you its taking too much time or whatever and just be sensible with what you eat **but** bare in mind that your weight loss may be slower.",2015-05-29 05:46:51,Braveheart1297,1
"That's roughly what I do for bulking. I keep track of my calories and macros for a while until this particular meal plan becomes a habit. From there on, I just stop measuring but keep reading the same things. I don't mind having fluctuations of 100 or even 200kcal while bulking.

When cutting on the other hand, I count everything, mostly because I'm afraid of getting too little and losing weight too quickly.",2015-05-29 05:51:19,tsahyt,1
"I gave up on counting calories a long time ago and can still bulk or cut successfully, if not quite optimally. Cutting at 2250 in and 2500 out is easy to measure, but I work a very physical job in addition to lifting and other exercise. When you're trying to cut at 7750/8000, 250 calories is well below the margin of error in your food and exercise measurements. I eat clean when I cut and sort of clean when I bulk and let my body tell me how much to eat and it works. A lot of people probably couldn't do it my way, but it's not impossible.",2015-05-29 06:06:58,ChillinWithMyDog,1
"Yes, and I regained 25+ pounds.

Don't let it happen to you",2015-05-29 06:21:59,morbidlyobese1234,1
"That is what I do, for the most part. I fire up MFP when I feel like my diet has gone off the rails, and it rends to reel me back in. It's like a reset button for not eating like an asshole.

That said, I'm not sure how it affects my progress. I certainly have made progress over the last couple years, but it's a grind. It feels like I'm in a perpetual lean-gain. Which is OK, I guess, but the fact that if I put more time into counting I'd probably have better progress.",2015-05-29 06:50:02,soomuchcoffee,1
"You said you're hungry from your cut, is this how you should feel? Because I always feel full I don't count calories but I drink a fuck ton of water, an I'm worried I won't see results since I'm feeling pretty full..",2015-05-29 07:04:58,MachinegunPoopy,1
Eating normally will help loose weight and maintain a healthy weight but to lower body fat % you really do have to count because even just eating healthy won't necessarily lower it as far as you want ( if you want something crazy low),2015-05-29 07:06:59,Wroblewski_,1
"I used to count calories, but was to much hassle fr me. Especially when you're on business lunch or visiting family. I am focusing on correct type of foods I put in my mouth (meat and veggies). Cut any sugary drinks and sweets, limited coffee to black, etc. I lost ~45 pounds of fat getting some lean mass. That strategy is just not working when you want to go below 13% of bf I stalled for few months. Then I introduced Intermittent fasting and things started to move again. On the other hand I am more interested in health befits of IF rather than fat loss.",2015-05-29 07:12:07,541474,1
"I'm on a cut and I don't count my calories strictly. I know aproximately how many calories I eat on each meal (for example, if for breakfast I have a banana, a cup of coffee and a cereal bar, I know that I'm going to be eating around 200-250 calories), and that's it for me. I'm losing a fairly good amount of weight too (1-2 lbs per week).",2015-05-29 07:31:52,Benrell,1
"I (44 y/o F) had a 30 lb weight loss quite a few years back and have managed to maintain my weight within about a 3-7 lb variation without counting all the time. Here's what I do:

* during periods of calorie counting I pay attention to my habits and work on developing eating patterns and go-to foods that keep me at a desired intake. For example:  knowing &amp; using correct portion sizes, pouring a snack food into a serving bowl rather than eating from the box/bag, drinking plenty of water, etc.

* I weigh regularly (at least 2-3 times/week so that I will notice if I start to gain weight

* If/when I notice I have put on some extra pounds that aren't attributable to fluctuations in hydration, I calorie count for at least a week (or more if I really need to drop pounds) so I can see what's up with my diet. Usually it's extra alcohol consumption and creeping snack habits, plus winter periods of less sports activity, getting me in a excess calorie state.

This has worked really well for me but I am not *too* stringent about my weight/body composition. In other words, I lift but I don't bulk and cut, so I have a nice muscular trim physique but it's not like you can cut things on my abs.",2015-05-29 07:40:35,b00tler,1
"I stopped counting calories for the past 3 months or so. After a while of doing it you become aware of approximately how many calories / macros something has and it's not hard keeping mental track of it throughout the day. However, I do find it harder to actually stick to dieting without tracking. Even if you are aware of how many you are consuming, my mind is like whatever i don't care, i'll have this snack even if i'm over my limit. 

During this period I wasn't really focusing on dieting, I ended up severely under eating on some days (approx. 800 calories) and over eating other days (approx. 2500+ calories).
My progress was way slower than it had been the prior months.

I've started calorie counting again the past few weeks and I find it so much easier to stay on a healthy path and reduce cravings. If you are over stressing about it i recommend to take a break for a couple of days/weeks and then when you come back to it it will be much less stressful. At least that is what my experience has been like.",2015-05-29 07:53:56,besosjinx,1
"I tracked my calories for a good 6-7 months and got really comfortable knowing how many calories a certain amount of food was. However, my schedule got busy and I haven't been tracking. I prep meals and always calculate the portion size and its calorie amount, but I think I'm struggling because I'm not actually counting my calories throughout the day. I stick to my prepped meals but then I tend to come home later at night and just roam free through different snacks. So I think for me and a lot of other people it actually takes logging throughout the day to see success on a cut.",2015-05-29 08:08:10,mhm33,1
"Yes. I just avoid dairy and grains. I try to eat only from the edges of the grocery - produce, butcher, etc. That helps me gain lean muscle (more protein) and slim down a little.  Going to eat out on the weekends only helps. 

I also use my palms to measure. A serving fits in my palm. That. Is. All!

Counting calories seems like a terrible waste of time and energy. It seems obsessive, and it doesn't ensure that you are eating quality foods with enough nutrients. 

That said, imagine you had to pay $1 per calorie for a week, and that may help evaluate some foods. You *may* come to find that you want the most bang for your buck - better flavor, nutrition, and value.",2015-05-29 08:12:37,leftcoastisbestcoast,1
"If you are just looking to have a healthy, normal physique, then calorie counting shouldn't be necessary. It's when you go for the athletic, fit body that it becomes indispensable. Based on one of your comments, you should be around 25% BF [(145x0.3-10)/135]x100%. This is assuming no loss or increase in muscle mass so could be incorrect. 

At this percentage, you still have some low hanging fruit, and a healthy lifestyle should continue your weight loss. However, to get to your ideal weight of 125, you will be around 19% BF without change in muscle mass [(135x.25-10)/125]x100%, and at that level, maintenance without some form of calorie counting will be very difficult.

Keep in mind that at this level, you will see diminishing returns to your dieting, so you will have to increase your effort to get results.",2015-05-29 08:15:44,feduzzle,1
I probably could at this point but I don't want to lose my 145 day mfp streak :(,2015-05-29 08:24:53,Downside190,1
"The more you track your calories, the more you will retain when it comes to knowing how many calories are in certain foods. I'm at the point where I tracked calories so much I don't really need to count them anymore because I have a general idea of how much is in what I eat. This really only applies to foods you cook since you know the ingredients involved.",2015-05-29 08:33:13,FutureStrongman,1
"Yes. I don't count, I just eat healthy foods and snacks. I also eat more snacks and smaller main meals. I also have each day's food planned out (typically I'll eat the same  meal scheme for weeks at a time).",2015-05-29 08:50:29,nullsignature,1
"Of coarse it would work, I just don't as I'm perhaps overly mindful of gaining muscle through the whole bulk/cut nonsense.",2015-05-29 08:51:21,314253647586970,1
"I counted calories in the beginning, but now I just settled into eating the same types of food items repeatedly so that I do not have to count them.  I pretty much eye-ball everything.  Check out the ""portion size method"", you basically use your palm as a benchmark to estimate the weight of food you take.  It's not super accurate but it's better than nothing.  If you're eating out, counting calories makes no sense because you have no idea how much sugar/oil/other ingredients they put into your chicken (for example).  So yeah.. just don't go crazy and you don't have to count everything.",2015-05-29 08:58:41,Volt52121,1
"I logged everything I ate with MyFitnessPal for about two months.  It was very tedious, and I was almost always under my goal by hundreds, if not thousands of calories.  Using that app for a couple of months gave me a good idea of how many calories are in the foods that I eat, and as long as I don't live on fried food and beer I can eat whatever I want.",2015-05-29 09:01:01,DrWhoisOverRated,1
I track and I don't track...just really depends. I did it for over 3 years straight and honestly it just gets old since I know what I eat. Once you have a better understanding of your body and what you put in it the tracking part becomes somewhat less useful. I find the best thing to do is use tracking to get yourself back into the right mindset. Sometimes we slip away and binge more than we expect or we go on a streak of low protein days on a cut because we were to busy with work/school/life.,2015-05-29 09:12:18,Gingervitice,1
"I stopped for a while and maintained.  The trick is to stay borderline hungry and eat just alittle more than that.  If I eat a huge lunch and I'm not hungry for dinner, I don't force it.  I might jsut skip it that day, then I'll wake up hungry and I'll eat a big breakfast, small lunch and medium dinner, then the next day medium breakfast, medium lunch, medium dinner.  Etc.  And of course, no sweets or junk food.",2015-05-29 09:16:53,MyManGotEm,1
"Today is day 763 of my MyFitnessPal streak. I lost 15lbs over 4 months or so when I first downloaded the app and since then I've been fluctuating from ~163-~168.  
  What happens to me is that I will get down to 163, which is a great weight for me, but then I will stop stressing about putting everything in and slowly, fish and chips, alcohol, not counting tortilla chips, etc. catches up to me and I'm near 168 again. I've honestly never been able to eat at maintenance for very long, I'm constantly cycling between gaining and losing weight (which i guess is fine, consider my 5lb gain a mini bulk).  
What I suggest is you keep putting in breakfast and lunch so that you know how many calories you have for dinner, and then just eyeball dinner. Not measuring anything has never worked for me. But there are a couple hundred days out of my 763 streak where I add breakfast (coffee and a quest bar) and lunch but leave everything consumed after 2pm out of my diary.  
  Considering you're getting to your goal weight, if you start eyeballing things and gain a few pounds, you will know. My abs look way way different with just a 5lb difference in my bodyweight. Congrats on nearing the end of your cut!",2015-05-29 09:38:06,MinimumWage1,1
"In February of 2014 I decided to get healthy by overhauling my diet and biking to work. I researched healthy food and started eating out less, avoiding processed foods, cooking with whole foods and eating more fruits and vegetables. I've never counted calories, but weigh myself every day to track progress. I'm down from 235 to 187lbs.

Counting calories wasn't something I felt I could maintain forever in my life. I'm still trying to lose weight and my GW is 165. Now if I start lifting and trying to gain muscle, counting macros and calories will probably be necessary. I'm sure I could lose weight faster by counting calories, but it's a personal choice not to. 

As for your personal situation, I think you could stop counting if you just want to maintain where you're at. But if you have really specific goals, you probably need very specific tools like calorie counting.",2015-05-29 09:41:33,brndnzlda,1
"I used mfp for a year to lose the weight. Now that I am maintaining, I just sort of keep track in my head, so I don't overeat. I'm not that overly concerned with it. If I eat a lot one day, I might go back and log it, so I can mentally adjust for the rest of the week.",2015-05-29 09:48:57,bdhw,1
Yes. I just stay away from sugar and unnecessary saturated fat. I also stay away from foods with a high glycemic index. I never count calories. You can do it!,2015-05-29 09:49:03,myopicview,1
This is exactly what I do (even when I'm on a cut) because it helps me focus on my self-control and not get overwhelmed. For me it's worked wonders since I operate better when I can focus intensely on a few goals really well rather than getting lost in the details.,2015-05-29 09:50:19,stoodder,1
Almost no one in the history of humans have counted calories.,2015-05-29 09:55:13,BaboonRockFighter,1
"I only counted calories and weighted food for a few months till I got a general idea about quantities and macros, after that I've never counted again.",2015-05-29 09:58:42,HerrXRDS,1
"What I do is use myfitness pal app to ruffly guess my calories. If you eat healthy enough your cravings will actually make sense, also eating different meals every day will give you a more balanced diet. There is no such thing as diets that work. Only a lifestyle change.",2015-05-29 10:03:07,yuriboyka1066,1
"Yes - what I have a very boring diet by most standards almost every day; I will change it up here and there. I will, however, count my calories at least once a week in MFP to see where I am - I usually average afterwards for the week if needed.",2015-05-29 10:04:32,MelinaJenkins,1
"Just learn how to eyeball sizes correctly. Like know what a 6 oz piece of meat looks like. What a cup of rice/noodles/pasta/etc. looks like. 

You don't need to be obsessive about tracking calories. If you notice yourself fluctuating from whatever goal weight you want, then adjust accordingly.",2015-05-29 02:07:52,ShareHappyness,1
"Me. I eat like one pack of chips every week but I balance that out with eating salads, quiona ocasionaly",2015-05-29 00:24:18,throwawayfromhk,0
"I'm 5'11"" (M) 165 pounds at 9% BF, sitting at about 108 pounds of muscle, and I've never counted calories (other than 3 or 4 times where I just wanted to see how much I normally eat in a day). I just don't eat shit that comes in a box.  It's pretty simple.  Don't eat fast food, don't eat processed foods, and only eat lean meats.  Don't eat cereal that's half sugar, and get bread without added sugar (but don't eat more than 2 slices a day).  No chips, no chocolate/candy unless it's 80% or higher dark chocolate made from cocoa.  You need to stay away from sugars.  Even things like greek yogurt, which people swear is some miracle food, actually isn't good for you considering a serving has 15-20 grams of sugar. 

The things you should be eating are vegetables for sustenance, brown rice and sweet potato for carbohydrates.  Protein should come from fish like Cod or Sole, Turkey or lean chicken breasts.  Stay away from crap like soy and flax seed.  I'm assuming you are a woman, so you should look to avoid things that contain aromatase.  Healthy fats will come from the fish you eat (but not the cod) and you can add SMALL amounts of nuts like almonds or brazil nuts.  BAM that's all your macros without adding any significant amount of calories to your day. 

Drink water, never juice.  No pop, no gatorade or sports drinks.  WATER. 

I'm not a nutritionist or a dietitian or anything, but counting calories is absolutely retarded.  Use your common sense and eat healthy food.  A calorie **IS NOT** a calorie, as much as the marketing people want to make you believe.  Don't count your calories, just eat the right foods. 

As Michael Pollan wrote: ""Eat food. Not too much. Mostly plants.""

Good luck. 

EDIT: I should say, counting calories isn't retarded for someone with an eating disorder, say someone who is 400+ pounds.  They need to understand that they are eating way too freaking much, and counting calories might be the only way to show them.  But for a female under 150 pounds or a male under 200 pounds, they have absolutely NO REASON to be counting calories.  They just need to be mindful of the processed junk they are putting into their bodies.  I've tracked calories for a day or two, and I'm actually in the 3500-4000 per day range.  Take it as anecdotal or whatever you want, but I maintain a sub 10% BF and I always eat the same way.  (I eat a metric shit-ton of healthy foods everyday).  Food for thought",2015-05-29 07:12:28,PL_AllDay_ErryDay,0
I don't see any good reason not to track your calories except lazyness.,2015-05-29 03:39:20,Greenei,-3
"&gt; I know diet is not necessarily a core /r/fitness topic

Since when?",2015-05-28 15:20:14,phrakture,69
"Not long ago, my boss was doing a ""chocolate based diet for weight loss"". Now I know where it came from. XD",2015-05-28 15:54:38,Hraklea,10
"&gt;diet is not necessarily a core /r/fitness topic

When every fucking thread is ""Help me lose weight, I only eat 600 calories a day and I'm not losing weight!"" it becomes a topic.

It's like those 8 buttons on the front page linking to the Wiki are fucking invisible...

Sorry, missed Wednesday.",2015-05-28 14:35:36,haunter12,39
"Wait...so this is not true? I cannot lose weight eating more chocolate?

MY ENTIRE WORLD HAS JUST CRUMBLED UNDER MY FEET.

(yeah...my username is very relevant to the subject in question...)",2015-05-28 15:17:02,chokkolate,7
"in my post i gave people a couple of resources if they don't have the time and/or training to review industry research: 



If you don't have the time or training to pour through all of the studies out there to form your own opinion, there are people who do have the time and training to do that.  I figure that if the New York Times (or any other highly respected newspaper) isn't writing about it, it's probably not a good study.  



I also love this registered dietitian with iron-clad ethics, [The Nutrition Diva](http://www.quickanddirtytips.com/nutrition-diva).  She has the formal training and time to pour through all of the studies out there and give you her take on all of the data.  They are also in podcast form, and great to listen to during workout! [Here's a great piece about bias in research](http://www.quickanddirtytips.com/health-fitness/healthy-eating/can-we-trust-industry-funded-research), [and here's a good piece showing how she reviews the myriad research on the Mediterranean diet and summarizes her findings for you](http://www.quickanddirtytips.com/health-fitness/healthy-eating/the-mediterranean-diet-not-as-healthy-as-they-say).",2015-05-28 15:50:01,zbplot,5
