"Same with Personal Trainer, Fitness Coach, Strength Coach, etc... and landscaper, fence installer, sandwich artist, cobbler, leather craftsman, bicycle mechanic, and in fact the vast majority of professions.

Just because the federal government doesn't require you to pay a fee to take a piddly exam doesn't mean your profession is bunk.

That said, yeah, many nutritionists are biased morons",2015-05-28 11:09:43,HaughtPockets,162
"As an RD once told me:

Nutritionists are people with no specific training who you pay a bunch of money to in exchange for a mediocre plan you'll probably follow because you paid a bunch of money for it. Dieticians have a bunch of specialized education that they'll use to design a high-quality plan that you'll never use or think of again because insurance paid for it and eating broccoli is gross.",2015-05-28 14:15:22,Stewthulhu,22
"This is true. Registered Dietitians - Nutritionists (RDN) obtain their credentials after obtaining a bachelor's degree in dietetics, a year-long internship, and passing an incredibly difficult exam. Only then are they eligible to be registered. They are the only regulated nutrition experts in the world. In my state there is a battle in the legislature to protect the term ""nutritionist"" from being used by anyone, and dietitian associations are active in ensuring the title is not a free-for-all.",2015-05-28 13:28:36,MiyamotoFn,18
"Yeah, you need a lot of school to officially be a registered dietitian/nutritionist (RDN). Need to be accepted into an accredited program and then do a 1200 hour medical internship and then complete a national exam. No easy feat.",2015-05-28 15:22:12,strikefitLA,8
A nutritionist once told me that lie about how the average person has 5 lbs of undigested meat in their gut.,2015-05-28 14:54:06,ivebeenhereallsummer,7
"Great post. My significant other is a registered &amp; licensed dietitian in the state of texas and the amount of education, training and internships she had to go through to get that license is staggering. 

She deals with complex cases in the hospital environment where she has to give patients set meal plans based on their iron levels or any other deficiencies they are facing. Especially people with diabetes. With an awesome dietitian, you can live a wonderful and comfortable life and tackle some of your health issues with an all out assault on what kind of foods you are putting into your body.",2015-05-28 13:28:50,iamevilbear,13
"Can confirm

Source: Am nutritionist",2015-05-28 09:41:24,squak_more,26
Can confirm. Am dietitian.,2015-05-28 13:21:18,Saemika,8
TIL I'm a nutritionist,2015-05-28 17:33:21,tempaccountONLY,5
TIL I am a 'nutritionist'.,2015-05-28 10:33:12,chasing_the_cool,7
"I can confirm this. 

Source: I'm a nutritionist",2015-05-28 21:07:17,germinik,4
"Qualified Nutritionist from the UK here (Registered with the AFN, currently work with high performance sports and start a sports nutrition post graduate research position in September).

The Title of this post is correct, the term Nutritionist in NOT legally protected (in the UK at least). However, I don't think we should tar everyone with the same brush.

I'm a member of the Association for Nutrition, a voluntary register which is attempting to legally protect the term nutritionist. You can only become a member of the AFN if you have at least a BSc in a recognised degree (Human Nutrition, Dietetics, Nutrition and Health etc.). For anyone who isn't from the UK, we study the same subject for 4 years at University, we do not major and minor etc.

Making Nutritionist a legally protected title is something I'm REALLY passionate about. I studied for 4 years, covering subjects such as advanced physiology, nutritional biochemistry, food chemistry, food microbiology, sports nutrition and clinical dietetics. At the end of my degree I decided to go into sports nutrition, rather than do my post graduate diploma which would make me a Dietitian.

I have a four year, evidence based degree with a great understanding of various sciences that come together to make 'nutrition science'. It infuriates me that someone can do a 6 week course (or just read a book at home) and call themselves a nutritionist. Most of the time these practitioners are not evidence based and are preaching pretty dangerous stuff (think the Food Babe).

Clinical settings are NOT the only place where bad nutrition advice can be dangerous/lethal. A UK woman (about 10 years ago? Cannot verify) was told by a nutritional therapist to reduce her salt intake (to almost zero) and drink a shit load of water. On top of that she was exercising on a regular basis to lose weight - she ended up in a hyponatremic coma and died. A Nutritionist from the AFN, with a recognised degree would NEVER make such a recommendation. 

I am begging people to please not tar people with the same brush, Dara O'Brien is a prick for making that statement, even in a comedic setting.

This brings me on to my next point. Nutritionists, Dietitians, Physiologists etc. can be up-to-date, evidence based practitioners or they can be lazy quacks pushing out-of-date guidelines which have been based on terrible scientific research.

Being a dietitian or nutritionist doesn't actually mean anything in terms of your practice, it just means you were able to jump through some hoops (AKA pass the exam).

It is very rare that you will find a dietitian 'high up' in the field of sports nutrition, typically the leaders in that field are exercise physiologists, who have a much greater understanding of physiology and nutrition in that context. There are RD's however, who learn all the exercis physiology AFTER their clinical training and do quite well.

To be honest the world of Nutrition is a fucking mess. The government, dietitians, nutritionists, doctors and physiologists have all got a lot to learn. Please bear with us and we'll try and fix things. We are sorry for all the confusion in the field!",2015-05-29 04:00:11,podgey88,3
"Also, naturopathic doctors don't practice real medicine.",2015-05-28 12:39:28,ADonkAgain,6
"PSA: [Professional regulation] (http://imgur.com/uovLIBw) does not equate to competence, especially in the field of nutrition. Do your research and find someone who knows what they're talking.",2015-05-28 12:34:56,Sevencer,15
"If you are in the US, this is subject to state law. In some states, the titles are equivalent and subject to the same regulations. [for example, TN state law](http://www.state.tn.us/sos/rules/0470/0470-01.pdf). Furthermore, some states have very loose regulations for who can professionally give nutrition counseling and who cannot (ie, no license or degree needed....). Even if this is highly regulated in your state, giving nutrition advice legally is not equal to giving good nutrition advice. 

**TLDR;** check your state's laws regarding who can and cannot legally give nutrition advice as their profession.",2015-05-28 12:54:55,jaytee15,4
LPT: Do NOT call a dietitian a nutritionist specifically for this reason. She will BE MAD.,2015-05-28 14:22:36,ensignlee,5
That's why I only go to Foodologists.,2015-05-28 13:48:48,deccanlo,2
This comes up all too often. If you're in the UK there **is** a regulatory body for nutritionists: [Association for Nutrition](http://associationfornutrition.org/). You can search the register for professionals deemed adequately qualified for certification.,2015-05-28 14:31:50,ClownWatch,2
"You are correct. My sister is interning now to become a dietitian and she gets annoyed at ""nutritionists"".",2015-05-28 14:47:42,zdazz14,2
"You should be weary of anyone recommending a product that rids the body of ""toxins"" too.",2015-05-28 17:32:11,sarrafian,2
rome burns and ketchup is still not a vegetable,2015-05-28 17:50:51,Mercurial907,2
I get a good laugh out of my friends who say they are Nutritionists. I have a degree in Nutrition and don't dare say it.,2015-05-28 21:14:14,Orangeman440,2
As a person that believes in the existence of nutrition I'd consider myself a strong nutritionist.,2015-05-29 03:14:11,Likely_not_Eric,2
"Yes we get them on the telly all the time, alongside chiropractors, I know very well educated people who think chiropractors are a well respected institute of qualified back specialists and become very defensive when I explain they are dangerous bullshitters of the tenth degree.",2015-05-28 12:30:50,monkeypowah,3
"Ugh, such a sham. Here's a great write-up about a nutritionists' conference that was sponsored/catered by McDonalds: http://www.motherjones.com/environment/2014/05/my-trip-mcdonalds-sponsored-nutritionist-convention",2015-05-28 15:13:00,prbrit,2
"It is so sad that something that can really keep us healthy and provide superior life is taken so lightly by the medical industry.

No money in healthy, happy people. They are in the business of fixing us when we break. Zero motivation to keep us healthy.

Nutrition should really be the first thing they teach in medical school, instead of the occasional class. Doctors know pitifully little about actual nutrition. It would be so wonderful if every doctor was a dietician.",2015-05-28 20:25:37,Terminal-Psychosis,2
"There is a little bit more to it than just the title. The type of services an individual can provide are regulated by each state. There are several states where you cannot give nutrition counseling unless you are an RD, some only require a license that can be acquired without being an RD and some have no laws around it.

http://www.nutritionadvocacy.org/laws-state",2015-05-28 12:31:36,JimmyJay88,1
"So if I claim to be a nutritionist and give someone bad advice that causes health problems, would I be legally responsible for it?",2015-05-28 14:05:10,Tikaal,1
"You can read a book on nutrition and call yourself a nutritionist. A nutritionist's opinion on anything is no more respectable or credible than an ACE-certified trainer's opinion. 

Unless the source is a Registered Dietician or Exercise Physiologist, the info is subject to scrutiny and should be taken with a grain of salt.",2015-05-28 14:59:06,Yggdras1l,1
"Same thing with personal trainer, strength coach, etc. you need no legally recognized certification.",2015-05-28 15:16:18,Bieg,1
Nice. Now I can say I'm a CSCS as well as an nutritionist.,2015-05-28 15:22:47,chadwr85,1
"So, I should quit eating these roof shingles?",2015-05-28 16:08:25,piccini9,1
That's why you go see a dietician. Dieticians are scientists.,2015-05-28 16:50:25,seldor,1
tfw gotta do 2 year masters for my dietician status,2015-05-28 16:57:35,Adambro25,1
"Couple that with lazy journalism and you can spread false hopes with all the best of intentions.

http://io9.com/i-fooled-millions-into-thinking-chocolate-helps-weight-1707251800",2015-05-28 17:07:26,Tyrus84,1
"Along side this - many (US) states require the accreditation of ""Registered Dietician"" (or the like) in order to prescribe dietary help. There's a whole area of ""nutritional therapy"" that can get you in REAL trouble, fast.",2015-05-28 19:18:40,zigzampow,1
"Along similar lines, I get upset when I hear about personal trainers designing meal plans. This is actually illegal in my state (Tennessee), but I see it done on a regular basis -and not always intelligently.",2015-05-28 20:03:39,ShrimShrim,1
"In Australia, the consumer is protected by the TGA, the Therapeutic Goods Association. They dictate what a company can or cannot claim - for instance, you cannot claim that your brand of saline crystals cures cancer. 

I'm sure there's a whole range of products from overseas that escape it though.",2015-05-28 20:18:06,sfacets,2
"Funny enough, in French it's kind of the opposite. Nutritioniste is an MD (8 years) that took special classes about nutrition and micro-nutrients, and diététicien is someone who got the equivalent of an associate degree (2 years).",2015-05-28 20:24:38,frenchness,1
I'm a nutritionist. Can confirm.,2015-05-28 20:30:13,bludgeonerV,1
"What do you know, I'm a nutritionist! And my mom said I'd never amount to anything. I showed her!",2015-05-28 20:33:09,Skizm,1
"Unless you live in Nova Scotia, Canada (Or Quebec). Where I do. I never knew anyone elsewhere could just call themself a nutritionist till I saw this on wiki.",2015-05-28 21:20:16,TurtleGloves,1
"http://imgur.com/wiof37q

I took this picture recently. At my gym there are two bars on the leg press - a top one and a bottom one. I've been putting the weights on the bottom, but I don't know if that's correct. What's the difference between putting the weight on top or bottom?


PS. please don't laugh at my pathetic leg press weight",2015-05-29 07:32:36,yungwerther,17
"If I listen to NPR while lifting, can I still make gainz?",2015-05-29 05:36:03,bortson,42
"Do you guys think I should incorporate a complete rest day in my split?  
Currently, I work out every single day but I'm afraid all the cardio might set me back...

Here is my routine:

* Chest / Biceps
* Back / Triceps
* **Running**
* Shoulders / Leg
* **Running**

... and repeat",2015-05-29 05:26:26,lostick,10
"Those of you that work out twice a day, what do your routines consist of?",2015-05-29 05:45:15,ifulike_pinacolonics,10
"What is the actual science behind why some people gather fat evenly all over their body, while some just get a big butt, and some get a big belly?",2015-05-29 05:49:19,ManWithADildo,9
"Anybody else feel gassy while cutting?

Some context: It's been a couple of weeks into the cut. I am skipping breakfast(intermittent fasting) and all I have in the morning is a cup of coffee. This has resulted in me being very uncomfortable all through the day. Is it the cut? I have heard that not eating food in regular intervals leads to gastric troubles.",2015-05-29 05:10:19,impalans,10
"Summer vacation is coming up; I can dial in my nutrition even more so,I have all the sleep I need, and I want to train. I want to do a PPLPPLx split but feel like I'm still enough of a beginner that I can still train a muscle group 3x a week and still make gains (-in contrast to 2x on the default PPLPPLx).

How feasible is it for me to do both push and pull days together so that I go through the PPL cycle 3 times a week? So basically, (2P)L(2P)L(2P)Lx.",2015-05-29 05:36:08,hamandiali,5
"Am I the only person who comes up with really good questions for these threads from Tuesday to Thursday, then totally forgets what they were when the thread rolls around?",2015-05-29 08:50:25,HumminahHumminah,5
"How much of a difference can microplates really make when a 45 lb plate can be anywhere from 43-47 lbs?

In a similar vein, how likely is it that ""high gravity"" days are just days where I grabbed plates on the heavier side?",2015-05-29 05:30:48,hyperbolical,11
"Tomorrow I have a party with some amazing food, that I want too eat a lot of, but I'm on a cut. Yesterday I ate 700kcals under maintenance while getting 1g protein/lb lean body mass, today I plan on eating 1200 under and getting ~1.8g protein/lb lean body mass. If I eat more than that over maintenance, I plan on reducing my daily intake for next week to compensate.

Will that be enough to maintain my weight and muscle? If not, what should I do?",2015-05-29 05:47:04,PetrusOctavius,5
"So sometimes on squat day, my lower back gets very tired &amp; sore. But I've noticed this is **ONLY** on days when I do less weight &amp; more reps. (I'm doing Wendler's 5/3/1). However on days nearing my 1RM (and less reps obviously), my lower back is fine &amp; my quads are suffiently sore as they should be. My form appears to be good (depth, knees out, not bending forward too much) from various people I've asked. And I don't specifically ""change"" anything about my form (consciously anyway) when squatting lighter vs. heavier.

You'd think the back would hurt more at heavier weight, as it is required more to stabilize the heavier load? At least this is my thought process. But it's clearly wrong!!! Any ideas!?",2015-05-29 06:21:05,tectactoe,4
"If something I eat causes the runs 20 minutes later, do I count the calories?",2015-05-29 07:07:07,wiggly_poof,3
Is it okay to move to a ppl from ICF after only 3 months? Im soon going to have like 2 months off doing nothing and want to go to the gym more than 3 times a week.,2015-05-29 07:24:17,calzoo,3
Why does it seem like the older you get the bigger your forearms are? My forearms aren't super great but any dad has mega forearms. What gives?,2015-05-29 07:26:43,halflife5,4
Why am I finding incline bench press so much more difficult to do than regular bench press?,2015-05-29 08:22:16,mhm33,3
"How long after a gym session is static stretching effective for? Basically if I choose to drive home (~10 minutes) and then stretch whilst watching TV is it still beneficial, or do I have to do it immediately once I've finished?",2015-05-29 08:37:03,jahoolinotkalooni,4
Can anyone suggest some good gym shorts? I've been wearing basketball shorts to the gym/to the park to run for the past three months and now my quads look like marshmallows because they never get any sun.,2015-05-29 09:15:49,TheBeefyDuck,1
"My left trap is more developed than my right one. When using mixed grip to deadlift, which hand should I supinate (palm facing away from me) in order to even them out? Will that even make a difference, or should I do some one-handed farmer's walks? Any other suggestions?",2015-05-29 05:20:25,009InchNails,2
"How do you animals wake up at the crack of dawn for a work out? I did a 4:45 today so I would make my 3x per week lift minimum. It went *ok*. Is it like leg day in that it gets better...and worse?

Also, should I feel silly doing the elliptical at this hour, cranking ""Notorious Thugs"" from the basement of my incredibly suburban middle class house?",2015-05-29 06:46:56,soomuchcoffee,2
"How many different exercises should I be doing for each workout? A friend of mine does 8 but that seems like a lot? For example my chest workout consists of Flat Bench, Decline, Dumbbell Flies and the the Pec Fly Machine, is that enough? Should I add another one or two exercises to that?",2015-05-29 05:30:24,jayman2239,1
"Does MFP know when you're riding a lawn mower? Because I just started my summer job on a grounds crew and it says I am burning calories like crazy. Also, how do you guys like MFP's step tracker in general? Is it even worth using, or should I turn it off?",2015-05-29 05:32:40,Deadhead1972,2
"I do flat bench press whenever its available, but I just realised that ive never done any work on my upper or lower chest specifically (i.e. incline or decline bench).

Is this bad? Is simply flat bench enough or should i target these two parts also? Will it affect the appearance of my chest? 

Thanks.",2015-05-29 05:34:35,xVinyl,1
"Whats more important, hitting protein macro goals daily or weekly? I understand that calories/week &gt; calories/day but what about protein? Currently on a -500 calorie cut.",2015-05-29 05:50:53,OrustVolvo,1
"Had a runner's knee from running on the road. So have to rest the knee for a few days.

Not able to squat atg or deadlift because of this. What can I do (other than running, squatting and deadlifting) to keep my legs exercised?",2015-05-29 06:01:44,throwaway_1821_11111,1
"So I've been doing 3rd world squats and some ankle stretching lately to help improve my balance at the bottom of the squat. Thing is, it really makes my ankle on my left foot hurt! (I have less mobility there). This is compounded with the fact that I'm on my feet for most of my day at work so it doesn't get much rest. It's been bothering me for about 3 days and now it's just a dull pain today. Should I continue doing the ankle stretches and 3rd world squats?


Raising my heels with some plates or something does feel A LOT better, but I do wanna work on my stretching.",2015-05-29 06:18:25,ellimistx99,1
"When I do the [rear hand clasp](http://www.doyogawithme.com/content/posterior-hand-clasp) stretch, it hurts pretty badly on the right shoulder. Left shoulder feels fine. I postulate that this has to do that I work at a computer for 9 hours every day, and this my right hand spends at least 9 hours a day up on the desk.

Are there any other good stretches I can do to loosen up my shoulders and remedy this tightness?

As a rider to this question, can someone please recommend me a good lower back stretch other than third-world squat?",2015-05-29 06:18:48,minorsecond,1
Been on a trip for 4 days during which I stopped taking my daily 5g of creatine. On my return the scales read 2.5-3 lbs lighter. Is it possible to lose that much water weight from only 4 days without creatine?,2015-05-29 06:21:34,FishAreVegetables,1
"Why is my progress with dips so much better than with chin ups?

I started out with 0x0 chin ups and 0x0 dips. I train both twice a week. A few months in (I literally started at zero), I was up to 3x6 chin ups and 3x6 dips.

Now, a few months later, I'm at 3x12 dips but can't for the life of me do 3x7 chin ups. Any ideas?",2015-05-29 06:25:33,gez555,1
You don't have visible abs. How do you know if it's that you just haven't cut enough or that your abs are shit and they aren't big enough?,2015-05-29 06:28:22,DefencelessDependant,1
"After just having started lifting [SL 5x5] (or exercising in general) for the first time ever, I've found my flexibility/mobility to be utter shite. I'm having a lot of problems with certain movements, due to tight muscles and really bad ROM. Should I stop lifting (I haven't really gotten far anyway, since I feel like I cannot progress safely) and focus exclusively on flexibility/mobility, doing Starting Stretch/Molding Mobility, until I've gotten less tight muscles and a normal, healthy ROM? I'm also thinking about strengthening my core along with that. This should give me a good (re)start on SL, or lifting in general, later on, right?",2015-05-29 06:40:37,Cretcoll,1
"For 5RM Stats, all my lifts fall a little past intermediate, but my Squat. My Squat has always been weak (Untrained to Novice range). I once 1RM'd an Intermediate stat, but that was long ago. I never was able to 5RM past 175lb low bar. Now I'm back to 135lb high bar.

Let's assume my form and understanding of the exercise is perfect for all my lifts. How troubling is it to have a low squat in terms of muscular balance, health, etc.?",2015-05-29 06:43:16,PumpkinLatte,1
"Is it ""important"" to decline press for overall physique?  I love incline and enjoy flat enough to finish my sets but I just can't bring myself to do anything decline.",2015-05-29 06:45:24,TheLazyTurttle,1
Good program to run while focusing my efforts for a 10k in September? Also trying to lose weight. Was thinking PHUL?,2015-05-29 07:00:30,Dkid,1
"When I do bench press I do the usual set up. Shoulder blades together, arch back, feet far back. However I feel like my shoulder blades don't stick together properly once I've done like 2-3 reps. It sort of feels like they're gliding out of position so to say.

Is this normal? Is it just an illusion? Or am I doing something wrong? In that case, what?",2015-05-29 07:07:15,zargnath,1
"Those of you with visible abs, was making them appear a slow gradual process or did they just pop one day?",2015-05-29 07:10:57,Downside190,1
"What kind of doctor should I see for back pain?

Do I go to my regular physician (internal medicine specialist) and see what he recommends?

Or go straight to a physical therapist?

Or a patient first type of place?

It's sort of right in the middle of my back, if that makes any difference - like, right around the level of my sternum. Goes away for weeks, then comes back for a couple days, sometimes just mild discomfort, sometimes crosses over from discomfort to pain.",2015-05-29 07:14:51,monsda,1
How bad is not fitting your fiber everyday ? And actually eating almost none of it,2015-05-29 07:15:17,CUATROJO,1
"When doing single arm dumbell rows, what part of my back is it working? And are different muscles used when lifting to the hip, that say up towards the armpit?",2015-05-29 07:19:11,DallassDrake,1
"when doing one-armed bent over dumbbell rows with the opposite hand and knee on the bench, where should i put most of my body weight? was doing them yesterday and noticed when i got to last few reps of my set the foot i had planted on the ground was on it's toes and most of my bodyweight was on my arm on the bench.",2015-05-29 07:28:52,cannon19,1
Can I put a form check here or is there a better subreddit for it?,2015-05-29 07:32:59,Theaterboy,1
"When you guys calculate your TDEE or figure out how many cals to eat on MFP, what do you put as your activity level?

Even though I do cardio and weight lift 6-7 days a week I usually mark my activity level as sedentary. Do you do the same? 

EDIT: Spelling",2015-05-29 07:34:26,DJBobbyC,1
"I'm currently doing the PHUL Program at the minute and enjoying it. https://www.muscleandstrength.com/workouts/phul-workout I follow it almost exactly with some minor changes. The only part I don't like is the leg hypertrophy day. Would it be ok to split the upper hypertrophy into 2 days and do them on Thursday and Friday instead of 1 upper hypertrophy and 1 lower hypertrophy day. If so what body parts would I work each time. Eg chest tri's Thursday/shoulders,back bi's Friday",2015-05-29 07:35:12,Woody96,1
"This may win for dumbest of the week, but are all seated calf raise machines adjustable? I cannot for the life of me figure out how to change the kneepad height on the one at my gym...",2015-05-29 07:38:42,madoch,1
