[deleted],2014-05-09 11:41:38,,14
"I had the same problem for a while. Look up vacuum exercises, it should work wonders",2015-05-29 00:52:47,_idkidc_,155
Look up (apt) anterior pelvic tilt,2015-05-29 01:07:30,Nicholas_Fehn,63
"I believe it's posture related. Standing up correctly involves permanent use of some ab muscles. If you've spent a long time slouched these muscles weaken, so when you stand, your hips/upper back may over compensate. Try googling how to stand tall, or correct standing postures. Also trimming down a bit wouldn't hurt if you want them to really carve out.",2015-05-29 00:27:10,rukarioz,118
"Former physical therapy aide here. You can do something we call a ""pelvic tilt"" to help this. If you know much about anatomy, your hips can tilt, usually either posteriorly (back) or anteriorly (front). Tilting your hips posteriorly will help. To best understand what I mean, lay flat on a stiff surface, like the floor, and bend your knees so that your feet are on the floor, shoulder width, and legs are roughly 90 degrees. At this point, you can slide your hand under your lower back. Tighten your core and tilt your hips like you're pulling them up to your ribs, which will press your lower back into your hand. This is a posterior tilt. If you do this while standing, you will have better posture and will see the ""resting gut"" decrease, but it may not disappear completely.

The rest of it is probably just some body fat.",2015-05-29 03:31:02,JangaJam,14
"Whenever you grow abdominal muscle, your stomach gets larger. Even If you have large abs and extremely low body fat when you are relaxed your stomach is going to have ""resting gut"" even more so than a person with small abs at a similar body fat percentage.

Your abdominal cavity is full of your internal organs and intestines that exert pressure on your abdominal area due to gravity and push your stomach out when their isn't resistance. That's why you may notice you have worse ""resting gut"" whenever you have just had a big meal.

Don't worry about it man! It's completely normal.

There are 2 ways you can make having this better. I've trained myself to always hold my stomach in a little bit, the same way you  teach yourself to hold your back straight for good posture. Eventually it becomes automatic.

The other option is to do vacuums, this trains the transverse abdominis. The stronger this muscle is the tighter your gut will be held in at a resting state, and the harder your will be able to suck in your stomach.",2015-05-29 01:19:17,aaronis1,46
"Everyone is saying core, vacuum, posture. I think all this will help but I think the real issue is your body fat. You're at a normal healthy % prolly lower teens or so. You want them abs to show up while resting you'll have to drop below 10%. The depth of your belly button indicates that you still have a thin layer of fat wrapped around your waist like a corset. 

Drop about 10 more pounds and report back. And do this slowly; an aggressive diet at your size will likely cost you muscle and your abs will stay hidden.",2015-05-29 03:45:50,edelboy,33
"Lots of good ideas here. 

Work your intercostal abs with stomach vacuums and planks. They keep your core tight and tucked. 

Correct postural imbalances by strengthening lower back and abs and stretching hip flexors. Tilt your pelvis forward/up and then relax your glutes so that your core is holding the position. Practice this! 

Strengthen core using standing exercises to help your mind and brain engage the core while standing upright. 

Pelvic floor exercises are good too, do some kegals. Think of the muscle to stop the flow of urinating, but don't practice while actually urinating because it can be unhealthy.",2015-05-29 01:42:37,NotSureIfFunnyOrSad,16
It's called having a normal body. If you're comparing against photo shoots and cinemas they are always tensed.,2015-05-29 02:54:47,JimmyD101,18
I just flex my stomach slightly 100% of the time. I guess you get used to it.,2015-05-29 08:05:33,EinsteinRidesShotgun,3
"For me it came from a weak back. Do a little more back workouts it improves your posture.

I'm guessing when you ""flex"" you are just standing taller",2015-05-29 00:28:10,defult06,6
"If you have APT fix that, then work on fixing thoracic mobility.

I use to have exactly the same thing, and still suffer to it from some extent, but since I started a serious stretching routine of those two areas the lower back and abs followed suite without having to directly target them.",2015-05-29 04:41:56,YourMumIsAVirgin,1
Anterior Pelvic Tilt.  100%.,2015-05-29 08:56:41,Tony_Chu,2
"An issue that I haven't seen mentioned here is visceral fat vs. subcutaneous fat. People tend to think of fat as all being right under your skin, padding the outside of your body, but there is also fat which accumulates around your internal organs or ""viscera.""

I seem to have trouble with this because I appear skinny and have very little fat between my skin and abdominal muscles, but I still have a ""gut"" that sticks out when I relax. I think that part of my problem is APT which has been mentioned a lot in this thread, but I still have a rounded gut that sticks out when I relax and no amount of posture change is going to make it completely flat. 

Aside from looking bad, high visceral abdominal fat is also concerning because it's correlated with increased risk for heart disease. From what I can tell there's no specific way to fight it, only fat reduction through exercising more and reducing caloric intake. I also read one article finding that high abdominal fat is associated with binge drinking (consuming a large number of drinks in a short amount of time.)

[Here is an article about abdominal fat I found with a quick google search.](http://www.health.harvard.edu/staying-healthy/abdominal-fat-and-what-to-do-about-it)",2015-05-29 08:57:24,foxsix,2
"Training theMTA (m. Transversus Abdominus) could solve some of the issue. 
Source: PT",2015-05-29 08:13:35,oldskoolpleb,1
I am your same weight and height... Same problem. Your abs aren't apparent in the lower half (like mine) and it leads me to think its body fat issue. If you get to 165 or so things may look different,2015-05-29 08:22:02,5rc8t,1
glad this thread came along. OP worded it better than I could.,2015-05-29 08:31:06,DefendWaifuWithRaifu,1
"On a totally unrelated note, a relaxed belly is very valued by Taoists. A soft and supple diaphragm makes for easier energy practices. I think this applies to people who practice pranayama too.",2015-05-29 08:34:09,unanimity1d,1
"You should cut down to 155 if you want no gut. It really is the only way. Put off your bulking dreams until then if the gut is crucial. For me the abs are the most critical feature I want, so I put off any bulking until I get there",2015-05-29 09:08:28,cretins-for-you,1
I am slim and visceral fat around my liver. I have been cutting out most fats from my diet and trying to do more exercise but it seems slow going. I also have high cholesterol that I have to control with medication. If anyone comes up with some miracle solution I am down to try it. It is very frustrating to say the least,2015-05-29 09:17:12,ilovedeep,1
"It's your posture, mate.",2015-05-29 09:23:42,KlausFenrir,1
"A lot of people are trying to give fancy fixes for this but...

Honestly, to an extent this is extremely normal. Your abdominal wall takes up space, and as your abs get bigger, they're going to push out further unless you're actively contracting them.

Combine this with the fact that, unless you're constantly starving yourself, you will normally have a food bolus in your stomach contributing to the effect, this is not abnormal. 

I think our expectations are distorted from pictures of people flexing their abs to perfection for photoshoots and celebrities that suck in their guts all the time. Having a perfectly flat abdomen from a side profile is not particularly normal when relaxed (if anything it probably means you have no abs).",2015-05-29 09:42:51,EqusG,1
"You have a lot of shit in your intestines. 
Take a few laxatives and watch what happens after a day on the toilet. 
Not joking.  
That, and anterior pelvic tilt.",2015-05-29 09:47:49,ImNotJustinBieber,1
"some lot of good info on here, for a while i was thinking all abs are a conspiracy and that every fitness guru had a gut if they werent flexing.",2015-05-29 09:50:19,foslforever,1
"wear flatter shoes as well, heels on shoes will make your spine bend forward so you have the appearance of a gut",2015-05-29 09:52:55,catrapeisfunny,1
[Here](https://www.youtube.com/watch?v=dQw4w9WgXcQ) is a good exercise to help with that... I'm so sorry,2015-05-29 09:56:54,Wittleftover,1
"You didn't show your full side profile, but a sway back can also contribute to how your belly looks when resting because of the curvature of your spine (if you have a sway back).",2015-05-29 10:00:43,hapital_hump,1
"&gt; I don't know what my body fat is

I'm afraid ""resting gut"" is a factor of body fat %.  Unless you're down very close to or at single digit BF%, you're not likely going to see your abs without flexing.

That being said, core/ab workouts to increase the size of your abs may help a bit.",2015-05-29 00:37:26,Clever_Unused_Name,0
"IIRC it has a couple of key components to it. I, a long time beer-gut sufferer, had a similar issue. Core strength, both front abs, and lower back, help to pull in your gut while resting, but along with that comes posture, because no amount of muscle, can make you have good posture. Dieting does considerably help, since the fat that is causing the issue, is the outer fat, which can be burned off, and avoided by eating more fruits and veggies. I recommend having a fresh smoothie to start your day. It's easy, you can get in both fruit and veggies, and you'll see the resting gut disappear (almost all the way)",2015-05-29 02:46:10,SitNshitN,0
"This is just bloating, which is a problem with bacterial composition of the gut. It's funny seeing the variety of answers here.",2015-05-29 06:29:37,Ajmhardy,1
"Yea I get that too. Sure, fixing your posture is important but I get bloated from protein. If I flex I can see my abs at the top and can see where the last bit of belly fat is on me. I'm also doing intermittent fasting so I'm bloated in the morning most of the time.

I'm 5'9"" and weigh more than you by just a little. The only way is to make a healthy clean diet plan and stick to it. Only drink water and green tea. That plus working out should help bring your bodyfat percentage down enough where you'll burn off that belly fat. I fucking hope so because I hate it.",2015-05-29 06:53:59,TatdGreaser,1
"You have to go really really lean, like 150 to have a nice flat stomach.",2015-05-29 01:10:20,buscemi100mm,-9
"I don't see any mention of the possibility of it being the inside of your gut. I've got a huge resting gut, my intestines just seem to produce extra air when they're processing food. (went to the doctor and she told me i definitely had a lot of air ""stuck"") eating healthy makes that even worse, as fibres produce more air during digestion. Adding to that, I have a stupid posture. I can't really do much about it, tried the tightest diet ever, next to no results though. But posture would help, which I'm working on",2015-05-29 05:07:41,Sobro-DK,0
What is your favorite lift and why is it deadlifting?,2015-05-29 09:32:30,Aldothe_Apache,1
What are your recommendations for beard gainz?,2015-05-29 09:32:06,Tesal,1
"In your opinion, how important is building muscle mass for power lifting?

Do you have volume days where you focus on certain muscles to grow?",2015-05-29 09:34:17,limbo2007,1
What is your opinion on lifting speed? I read in an article by t-nation that lifting more explosively recruits more motor units so not only will it get you stronger but also bigger than if you were lifting slowly.,2015-05-29 09:38:59,coniect,1
"Goodmorning Alan. Thanks for stopping by again!

1) If you needed an entry song for when you get announced at Strongman competitions just like fighters have walkdown music,  what song would you choose?

2) If you got to create a new event for Strongman what kind of unique or crazy object would you want to lift/carry/throw?

3) What's your opinion on alcohol consumption and fitness level? Do you think 2 drinks a day has a positive effect on health like most studies seem to say and would you think it's better to have a glass of wine than not for people who are focussing on gaining strength and size?

Have a great weekend!",2015-05-29 09:40:02,batman1285,1
"What are your thoughts on calisthenics and body weight exercises? It may just be me getting more into exercise over the past year but it seems like it has become a lot more mainstream too. 

In relation, how do you integrate pull ups/dips/other bodyweight movements in your training if you do?",2015-05-29 09:41:52,MATTtheSEAHAWK,1
"what do you do for a living?

Do you make money from youtube?",2015-05-29 09:31:25,Bentumbo,1
"During training, which lifts do strongmen do that powerlifters typically don't do? Which of those should powerlifters consider adding?",2015-05-29 09:42:21,d0s4gw,1
Favorite youtube channels!,2015-05-29 09:31:35,Bropeth914,1
"Is there a picture of you without a beard? How long have you've been lifting for?
What are you're best numbers?(I know this one can be found out through your videos but for convenience)
I know you eat a lot so does your shit smell? How big is it?
Tyvm for AMA",2015-05-29 09:37:52,dragontouch,1
"Recently started training again after a year's break (though I wasn't very principled about it last time). Your videos have been great (especially your squat and bench videos) and I'm spending a lot of time working on my form, so thanks for that!    
    
My question: For whatever reason, a lot of gyms don't have a squat/power rack (mine included). Aside from finding a new gym, do you have any recommendations for substitute exercises? I've been looking into clean -&gt; front squat and hack squats, but I can only clean so much weight (and I have some serious mobility issues when it comes to front squats) and with hack squats you're kind of limited to parallel as the barbell hits the ground around parallel.    
    
Thanks again for your videos!",2015-05-29 09:39:12,geebr,1
"Alan, I found your squat-depth rant inspiring, and promptly knocked myself out of the gym for three weeks by trying to get my ass to grass when the fact is that I just don't have the hip/knee/ankle mobility to get there yet. If someone isn't flexible enough to squat with proper form, are there any specific mobility programs you recommend? And what can they be doing in the meantime to get stronger?",2015-05-29 09:40:19,GoldenReggie,1
"Hey man,

Quick question about your gym and programming: do you think there's any future in group fitness classes but related to strength/powerlifting?  

There are so many boot camps and such for women (and men if you include crossfit), but I don't feel like there is anything like that (group setting) for guys looking to get strong but don't know the proper form/exercises/training and don't want to fuck around like they do in crossfit.

Any thoughts on something like this?",2015-05-29 09:40:29,ballenbd,1
Can I learn to do Olympic lifts safely from your videos or should I find a coach?,2015-05-29 09:44:11,elitist_haggis,1
In a previous thread you said you hit a plateau for almost 2 years.  Can you expand on this more?,2015-05-29 09:44:56,educatedwithoutclass,1
What is one piece of lifting advice that has helped you the most throughout your life?,2015-05-29 09:46:13,PM_ME_TACO,1
"No question here. Just wanted to say thank you for the good information on mobility, and for sharing your own issues. But primarily, I want to thank you for putting me onto short-shorts.

It's a liberating way to display the haunches. Ladies love the haunches. 

Now I can truly train untamed.",2015-05-29 09:51:53,strang3dream,1
Favorite lifting music?,2015-05-29 09:54:14,ManWithADildo,1
"Not a question but a thank you.

Thanks for creating great informative videos. You don't plug anything, you don't try to force humour, you don't go off on tangents and you don't have any unnecessary video editing involved. 

You keep your videos simple and informative. Please don't change this formula.",2015-05-29 09:38:04,Analtoast,1
What are some of the most common mistakes you see trainers/coaches make?,2015-05-29 09:35:22,6-8_Yes_Size15,1
"Hi Alan. I have been dealing with tight hips especially my right adductor and a popping or maybe impinging right hip for a while now. Do you have any good advice for these problems? I've been doing various stretches but nothing so far that has helped very much. I especially feel it in my hips when doing stiff leg Deadlift,  as if tipping my hips so far with a straight  leg and back is pulling something a bit too far.  

Sorry if this isn't what the ama is about but I'd appreciate any input you have. Thanks!",2015-05-29 09:42:25,Poopskien,1
any workout suggestions for hardgainers? I eat 6 meals a day with a good split. Just wanted to understand what would be a good workout routine for a hardgainer.,2015-05-29 09:43:00,venkat8141,1
"Work has got me stuck for a couple of years in a pretty remote location with no real access to a squatting rack. I have never really lifted or squatted but have done the usual stuff at the gym (leg press, dumbells, machines, etc).

Would it be a terrible idea to buy some basic equipment and try out doing SL 5x5 or something of the like? Would I be able to do it properly or am I bound to hurt myself without a trainer?",2015-05-29 09:48:57,ciderath,1
I want to improve my bench 1RM from 230lb to 265lb before 2016. Do you have any advice on how to achieve this goal?,2015-05-29 09:50:30,PersonalSunshine,1
"Have you ever had any injuries that have put you out of action for any amount of time?


I'm currently in rehab for my knees and am missing squats beyond words.",2015-05-29 09:50:40,outline01,1
Is there a guiding philosophy that you use when training or coaching? Is there a governing rule/principle you abide by to stay disciplined?,2015-05-29 09:50:45,pavlovandhisbitches,1
Hey Alan! What's your favourite metal band?,2015-05-29 09:51:14,rikrolls,1
"What's your favorite ab exercise and how do you feel about sit-ups (particularly weighted ones)? I've been told that I should be doing L-Sits or other ab exercises instead as sit-ups are ""bad for your back"".",2015-05-29 09:51:54,FALCON_ACCOUNT,1
Should I stick with any given program untill I stall completely? Or how do I know when to switch things up and get on a new routine?,2015-05-29 09:52:11,PersonalSunshine,1
"Can you go into a bit of detail around your diet? ie calories daily, do you follow any particular diet, etc.

Thanks for all you do - very rare to find videos like yours that are not the very very basics but at the same time not the super technical advanced 30 min video about bouncing out of the hole.

Lastly, when can we buy DAT 1 INCH RUBBER BRACELET?",2015-05-29 09:52:17,terminator3456,1
"Hi Alan!

I've been a lurker here at /r/fitness, and saw your videos.  You're really great to watch, and enthusiastic which bleeds over wire.

For a while now, I've been changing the way I eat, and I've lost over 70 pounds since the beginning just from diet change alone.  I now have been looking for a bodyweight program that maybe you can suggest for someone who hasn't done much exercise in over 10 years.

I look for a lot of sets but I was hoping to have someone that really knows what they're doing (and live here, of course) to maybe put me in the right direction--starting-wise.

I'm female, if this changes anything.  I'm really looking to increase upper body strength (I have none), and tone the lower half of my body.  I don't have access to a gym (Vermont middle of nowhere) hence resorting to bodyweight.  I do have a set of 5 pound dumbbells, and a pull-up bar that I can wedge on a door frame... but way too weak for lifting still.

Overall, what kind of schedule would you suggest?  If you need any other information, please let me know.  Again, I appreciate your AMA, and glad you are doing yet another!",2015-05-29 09:54:03,jetillian,1
"What do you think is the next big thing in training? THere are always advancements in the fields of tech, medicine, and even food; but is there anything that might be able to revolutionize the whole system of training?",2015-05-29 09:54:10,stefanhof,1
"Hi Allan, I was thinking on doing a post but since I noticed your AMA here, I figured asking a professional would be more beneficial.

So I'm a beginner and I was following the Starting Strength program the last two weeks, until I hurt something in my right hip joint, nothing dramatic, it only hurts while squatting.

While I'm waiting for my doc's appointment mid next week, I was wondering if I could/should do some exercises for my upper body in the meantime, if yes could you recommend some? Or should I skip all my workout until it all heals up?

Looking forward to your answer :)",2015-05-29 09:56:04,JohnJohnster,1
"First off, thank you for your videos; they've helped me tremendously! Anyways, what's your diet like? Are you a believer of iifym or clean eating or....?",2015-05-29 09:59:04,jfk_sabb,1
"Hey Alan , i really like all of your videos, especially squats and deadlifts ones. My squats suck ass vs my other lifts. I can do 130lbx5 but not ATG , i do squats 3/week and i try to stretch a lot before i start. What is your advice ?",2015-05-29 09:59:29,BitCY,1
Some dude at my gym keeps telling me to widen my deadlift grip beyond my shoulder width so it 'extends my pull' and I get the 'full benefit of the exercise'. What should I tell him to make him go away?,2015-05-29 10:02:04,coldcoal,1
"I have been doing SL 5x5 since mid February and have seen a lot of improvements from it. The last month or so, however, I have been experiencing pain in my hip flexors when squatting. Even while warming up.

Any tips as to how to improve/avoid this?",2015-05-29 10:03:26,saucyribs,1
I noticed you play video games in some of your videos (at least one). What video games get you most pumped and are there any games or characters that inspire you to work out?,2015-05-29 10:03:48,akiradice,1
"When did you start lifting?  Have you had time periods where you mentally weren't into it anymore?  If so, how did you push through?",2015-05-29 10:03:57,HITMAN616,1
"You look like you workout, what do you bench?",2015-05-29 09:48:04,rontonamoebay,1
"You looked, as a 16 year old, better than most grown men who dedicate a lot of their time to lifting.

Holy shit man, you are (and have always been) huge. Awesome stuff.",2015-05-29 07:47:49,gots2geo,13
"Your shoulders on the back double bicep look insane, strong work",2015-05-29 07:11:38,CanIHaveAGoodName,4
"Regarding your diet, were you more conerned about eating reaching your target calories? Or just eat a ton? Were you tracking your macros?

Good job btw :)",2015-05-29 07:39:07,Analtoast,2
Bicycle routine?,2015-05-29 07:50:17,northtexasbb,2
Holy fuck dude,2015-05-29 07:51:51,CuntyMcFagNuts69,1
"I'm 23, been working out on and off since HS. Your before pic is my goal. Hoooly shit man, you're en-route to professional.",2015-05-29 07:52:21,feduzzle,1
"I won't post your real name, but I know you in real life. You went from Rugby to American football right, and you're from Leeds, England? Correct me if I'm wrong, but I'm pretty sure I'm not. 


P.S Well done.",2015-05-29 08:23:58,KurzWebber,1
What's your actual measurements? Arms look savage in the 3rd pic.,2015-05-29 08:28:04,FutureStrongman,1
Nice V-shape.,2015-05-29 08:31:39,Centralredditfan,1
Deadlift and Squats on one day? You cray? Nice Progression!,2015-05-29 09:43:33,AtTheg4tes,1
"Dat cleft chin. No homo. 


Seriously, impressive as fuck, especially those shoulders. Which was your favorite shoulder exercise? I see you did a variety of presses, but was just wondering if you had a preference when you felt like really killing those shoulders.",2015-05-29 10:00:54,coldcoal,1
"Jesus, great work, but I have a feeling a lot of people would love to look like your teenage self!",2015-05-29 10:01:55,SwanOfAvon22,1
"Hey man i`ve been told and seen results from non weighted calf raises trying to get to 20 and do them a few times throughout the day. might be something to consider, they love volume. But jesus looking well.",2015-05-29 10:02:14,egoemt,1
"Nice work man. Funny that your starting weight and build is a goal for a lot of people. Never settle for ""good enough.""",2015-05-29 07:58:57,Roldanis,0
"As Dara Ó Briain said, a dietitian and a nutritionist have about as much in common as a dentist and someone who calls himself a ""toothiologist.""",2015-05-28 08:29:38,Marko_Ramiush,465
"So, print up business cards promoting myself as a nutritionist? Excellent.",2015-05-28 08:18:20,Mr_Evil_MSc,103
This is the biggest battle my wife (a Registered Dietitian) faces. All these 'nutritionists' giving out incorrect nutrition advice because you don't actually need any education to label yourself as a Nutritionist.,2015-05-28 12:15:29,squar3pants,90
"Asked a college nutrition student why pomegranates were so great.

""It's got antioxidants""

""Well, what does an antioxidant do?""

""...""",2015-05-28 10:17:39,Duendes,119
"As an aside, it's also important to know that dietitians get pissy if you spell it dietician.  

Source - I work with dietitians that have been kind enough to correct my spelling",2015-05-28 12:59:24,IlliterateJedi,13
