"I would hire people and pay them well, to take care of all the things I need. They would do all of my shopping, driving, entertaining etc.",2015-05-29 08:53:00,demonh8,1039
Can I commission a building firm to build me a $10M mansion on the understanding that they do $20k worth of work each day for the next 500 days ?,2015-05-29 08:20:14,willbir,3943
"You could gamble that much in Vegas in 10 minutes if you want to.  Just make outrageous bets -- the chances of winning are very small.  If you do win, just up the stakes.  If you win a lot, screw it -- who needs $20,000 any more?",2015-05-29 08:28:28,Meunderwears,3648
[deleted],2015-05-29 10:27:10,,2337
Tip a hot dog stand guy $19996 after buying a four dollar hot dog.,2015-05-29 10:23:16,superslimeboy,2121
"Buy a Gold brick worth 20,000 every day.",2015-05-29 08:20:45,ExProxy,2179
"I'd buy 2,000 copies of Brewster's Millions every day.",2015-05-29 08:20:44,Sporkfortuna,731
"I buy the things I need every day. I have a running contract with a company that builds and installs solar panels. Every day I buy solar panels for them to install on people's houses. Every day I buy the balance of what I didn't spend on myself buying solar panels.

This is not a donation: I want to personally own more solar panels than anyone else on the planet. It is not a loan because I don't expect to be paid back. It is not an investment because I don't want any return on it.

I live well, as a consequence other people live well too. It's a side effect.",2015-05-29 10:22:37,Mythiees,1375
"You go about your life, and buy all the stuff of your dreams that's is under 20k, then every night you go out for dinner and tip the waitress the remaining amount.",2015-05-29 10:49:58,pjmlez,555
[deleted],2015-05-29 09:04:04,,1079
"I'd buy 20,000 worth of costco gift cards every day.
You can get anything you want from Costco.
You want a cell phone? Costco.
Foods? Costco.
Need a new car? Costco.
Furniture? Costco.
Everything can be bought from Costco.

Since you're buying a physical gift card this meets all of the above requirements.",2015-05-29 09:20:03,mkomaha,586
Man...my clash of clans base would be decked out....,2015-05-29 09:29:31,JJK1107,1987
"Go purchase a house.  Pay $20k every day until the house is paid off.  Purchase another house.  Pay 20k until the house is paid off.  Do this until I own a ton of properties.

E* As for this being ""investing"" - I believe the OP meant stocks and bonds.  And if purchasing real property is considered ""investing"" so would any of the top answers: someone said they'd buy gold bars, and another said cars to trade in.  They're ""investing"" in worldly goods they can easily resell to recoup the money.  Houses are no more ""investing"" than cars or gold bars.",2015-05-29 09:02:20,tahlyn,1138
Can I buy land and property? Does that count?,2015-05-29 08:02:37,tengolacamisanegra,219
"Reddit gold for everyone. 

All of you would worship me.",2015-05-29 08:38:08,FeedMeSpiders,754
"I'd buy lots and lots of lottery tickets. That way, I can get money with no strings attached.",2015-05-29 08:39:20,rmaster446,724
"I'll tell you what I'd do, man.  Two chicks at the same time.",2015-05-29 09:19:26,Chazwozel,1948
"Buy $20,000 worth of pickles. Over time,  I'll become the pickle overlord. We'll see who's laughing then.",2015-05-29 08:54:35,Wally4410,1070
"After I'd taken care of all my necessities, I'd start going to the store and purchasing shit that looks cool. Or I'd seriously bulk up my wardrobe.",2015-05-29 08:02:17,zenlittleplatypus,403
ask about it on reddit and pick the best answer,2015-05-29 08:43:56,missmyrix,328
"I would pay off my student loans $20k at a time over the next three days, pay grad school in advance, buy myself a new car, pay my landlord in advance for my housing, and not spend the last day's $20k and stick that in my account. I'd be debt free and happy as a clam.",2015-05-29 08:52:35,EnolAngus,690
You should look up the Lemp family out of St Louis Missouri. In the late 1800s he hated his wife so much he forced her to spend $1000 dollars a day or she would never see another penny. While she was gone he was at home having massive parties. So this post is not completely unfeasible.,2015-05-29 10:59:31,Seam-Ripper,93
"Super easy, set up a consulting firm, hire myself as a consultant to do jack shit for one hour a day at an hourly rate of 20k.",2015-05-29 09:26:43,L4NGOS,309
Do whatever i want all day. At the end of the day i go eat somewhere and leave whatever is left as a tip. Repeat the next day.,2015-05-29 09:20:10,SixShotSam,184
I would go to car lots and buy a car everyday. Then resell it the next day and combine the money until i had a huge amount,2015-05-29 08:02:21,BlackbirdOfChernobyl,582
"Strippers and cocaine, if you wanna do something, do it properly. If anything $20,000 isn't enough",2015-05-29 08:08:20,I_forgot_your_icon,347
Hire my friends. They hold the money for me. Their services would be to be my friends. And massage my taint.,2015-05-29 08:56:30,kyojeshi,225
Buy whatever I could think of each day and then spend the rest on a bet which equates to whatever was left over.,2015-05-29 08:04:26,TheBeardedBandit94,190
"Buy a new car every day, and give it away the next day. Or sell the first couple so I can buy a really nice one, then start giving them away.

Get college students and people in debt to do some small task for me for $20,000

Remodel my home all the damn time

Do a shitload of drugs",2015-05-29 10:30:38,HanaNotBanana,66
"I would hire contractors to redo my house, making a 20k deposit on the first day. I am talking marble heated flooring, french doors, top of the line appliances, movie theater, home gym. I would buy all new, top of the line furniture, tvs, computers. I would buy a car, and trade it in the next day, and so on so forth, until I have myself a 100k car. I would replace my whole wardrobe with high end shit and the best of the best. After about 2 months, and having everything as perfect as can be, I would start buying more houses, 20k deposits, and 20k payments until they were paid off. 20k into the homes to fix them up and after a year... I have spent $7,300,000 anad have about 15 properties (the are paid off and rented out and/or sold) I would do it all again... for probably about 5 years... until I laugh in the face of 20k a day because it would take at least 50k to get me out of bed in the morning.",2015-05-29 08:37:45,CompulsiveGrl,146
"Magic: The Gathering cards.

I'm not even sure $20k/day would satisfy my lust.",2015-05-29 08:32:42,lurked,326
"Employ ~~1000~~ 100 people at $25/hr, 8hr/day. Or ~~500~~ 50 at $50/hr... or 33 people at a little over $25/hr for a 24 hour shift (sleep time is paid).

Their job? To be my real-life Sims characters.

EDIT: I forgot to math.",2015-05-29 16:34:53,SlapstickMojo,28
"Fine,

I have two principals, Be lazy, and do what I want.  I have yet to determine an order to these principals. 

So I will go and start a corporation which will be a separate taxable entity from myself. 

This corporation will be created with the soul purpose of taking on a clients and managing their finances for them, in their name.  We will have only one client. Me.

I will hire 4 accountants.

2 of the 4 accountants will manage the movement of money out of my account and into the companies. 
This accountant will provide me with a single Invoice Marked Paid, for the dollar amount that was drawn from my bank account daily.
 
This will satisfy the requirements of Op and have something to show for it category. And bring my account to 0.00

And then I will direct the corporation to do my bidding with a wish list of :

* Stuff I want
* Things I want to do
* Charities I want to support
* Etc.

I will then have the company Hire 2 lawyer, and 2 personal assistant, and 2 Assistant Manager.

The Lawyers will protect me from the vindictiveness of Ops Rules, The Assistant Managers will sign off on documents for managing the corporation, and manage the entire team for me. The Personal assistants will manage my affairs for me and my wishlist, and the Managers will report to them.

Why double?

Because the employees need time off, and they can be part time. Maybe they work 1 week and take the next week off, or they alternate. Doesn't really matter, I will let the Managers determine employee Scheduling. I don't want to have to handle that. 

The last 2 accountants will do payroll. Someone's got to handle payment of my corporations employees. 

Each employee is budgeted to receive 1000 a day, inclusive of all payroll costs for taxes and deduction. 

10 employees, 10,000 expense. Still got 10,000 spending power daily through the corporation. 

**In Summary:**

Want to earn a 1000.00 per day, work only half the year, and have little to no work.
Apply At Quazi Inc. Today.",2015-05-29 11:41:12,Quazijoe,142
I might have enough for a large popcorn and a corn dog at the movie theater,2015-05-29 12:00:15,oAkimboTimbo,127
I'd buy metal spoons,2015-05-29 09:04:24,moumouren,154
"I buy a new car every day, negotiated down to exactly $20,000.

Then I open a (barely) used car lot and sell each car for $16,000.",2015-05-29 11:31:59,MrIvysaur,81
Hire Morgan Freeman to narrate my daily activities for a $15000 a day retainer. Blow the rest on frivolous shit and necessities.,2015-05-29 10:45:39,Tefanis,84
"I'd buy a laundromat and launder the shit out of that money.

...

I mean think of the average dollar bill.  Not the new ones you get from the bank, but the ones whose days of crispness is far behind them.  Those limp floppy bills, can you even imagine where they've been and what they have been used for.  Some of those bills may have even been used to do the drugs.  Do you really want those mangy bills in your billfold? So every morning I'd ship in $20,000 of old wimpy bills, and every night ship out $20,000 of clean, freshly starched bills, minus operating expenses.",2015-05-29 10:43:13,WeatherMarch,62
"I buy a REALLY expensive house, and then just throw 20,000 on the mortgage every day.",2015-05-29 08:51:37,xxbearillaxx,80
Microtransactions,2015-05-29 11:21:15,isucklikehell,20
"Reading all of these made me think of something.

So initially I pay everything I need off. Buy property etc. loans and rent are typically monthly so only on one day do I need to account for that. Same with utilities. 

Each day: necessities first, then nice things. I buy cars for myself to collect and then start giving them to my family to bring them in closer. (Not a donation; I've already bought the item, I'd even keep it in my name) 

 I start collecting Coins,  old whiskeys, wines, and scotches and buying expensive jewelry: first for myself and then again, giving it to family. These things gain value over time without being a true ""investment"" because I'm actively using them. 

This is just the first stage. Long term goals is  as such: immediately once I get the money I start traveling to third world countries and buying up arms. It's an expensive trade; but I make deals with warlords, and I'm constantly buying weapons and tech while profiting off of other people's turmoil. 

Tl;dr Lord of War without the conscience",2015-05-29 10:29:02,Thatguy181991,37
2 boxes of HP inkjet ink.,2015-05-29 16:26:22,TheRealGeorge_Kaplan,18
I would go to the tops of buildings and dump 20k in cash in singles off the roofs every single day then I would get famous and start my own ad campaign as I do it which would generate tons more money. Might even get sponsored by redbull base jumping off the skyscraper while throwing cash.,2015-05-29 08:28:27,Novazilla,69
$20k of gold erry day,2015-05-29 08:43:40,LaLongueCarabine,42
Nobody wants their MTV anymore.,2015-05-29 09:35:46,snatchenvy,775
"""I've got thirteen channels of shit on the TV to choose from."" - ""Nobody Home"" by Pink Floyd",2015-05-29 09:11:02,f1-11,842
"""You make me wanna throw my pager out the window"" - Bug A Boo by Destiny's Child.",2015-05-29 08:27:38,karensmatik,1711
"""Now your mom threw away your best porno mag"" (Beastie Boys - Fight For Your Right)",2015-05-29 09:21:30,latdropking,1288
"""As the flames rose, to her roman nose, and her walkman started to melt"" - Morrissey/The Smiths",2015-05-29 08:13:56,zigglezip,783
"""I know a place, where the grass is really greener."" -California Gurls",2015-05-29 10:04:46,cckby2005,2519
"""We ain't ready to see a black President"" (2Pac - Changes)",2015-05-29 08:16:05,pumper911,3191
"The entire song ""Callin' Baton Rouge"" by Garth Brooks",2015-05-29 08:37:26,Redditmorelikereadit,137
"""The Lakers beat the SuperSonics"" (Ice Cube, Today Was A Good Day) 

Seattle SuperSonics are now the OKC Thunder, and the Lakers aren't beating anyone these days.",2015-05-29 09:39:04,tythousand,503
"""I hope I die before I get old""

at least until you become multimillionaires and play at the superbowl halftime show",2015-05-29 08:54:59,flounder19,494
"""Back in the U.S.S.R."" by the Beatles...obviously, the line ""Back in the USSR"", also the line from the same song, ""Honey disconnect the phone"".",2015-05-29 08:48:11,AnAngryBlade,1147
"In 1992, the band Dada released the song ""Dizz Knee Land"", which has the lyric ""I just flipped off President George.""  When Clinton took office, the song sounded outdated. Later, he was replaced by George Jr., and it sounded current again. Then George Jr. was replaced by Obama, which made the song sound outdated again.",2015-05-29 08:51:01,captainmagictrousers,325
"""I called her mom from a payphone"" what's my age again - blink182

In the same song ""what the hell is call ID?""",2015-05-29 09:34:50,shaninegone,413
"""I don't surf the net, no I've never been on MySpace.  Too busy letting my voice vibrate, carving out my space""  Jay-Z",2015-05-29 08:11:25,jeffsaint,915
"The song Happy Together contains the line...

If I should call you up, invest a dime
And you say you belong to me and ease my mind
Imagine how the world could be, so very fine
So happy together

The concept of inserting a dime into a payphone to call someone is long since lost to the dim recesses of the past.",2015-05-29 08:43:58,FalstaffsMind,806
Mama don't take my kodachrome away,2015-05-29 08:51:28,JST1MRE,341
''Free Nelson Mandela'',2015-05-29 09:04:36,Maaaaaarrrrrr,90
Stacy's Mom is now 60 and hasn't aged well.,2015-05-29 08:12:44,DaisyLayz,2082
"""I like big butts and I can not lie.""

Nobody has to lie about liking big butts anymore.",2015-05-29 08:36:45,BiBoFieTo,2056
"Basically the entire premise of Spiderwebs by No Doubt. She has to ""screen"" her phone calls by letting people begin to leave messages on her voice mail to see who they are.
Still a great fucking song though.

Edit: I thought voice mail and using an answering machine were basically synonymous. But yeah, I meant an answering machine. And obviously you can still screen using voice mail for unknown numbers but, whatever, my understanding was that the song was written before caller ID was common.",2015-05-29 08:47:11,kxr02,633
"""Super Nintendo, Sega Genesis / When I w'as dead broke, man, I couldn't picture this"" - Notorious BIG

Still an amazing song though",2015-05-29 08:14:58,Bozzaholic,1281
"""Teach me how to dougie.""

I have already learned adequately how to dougie. Unfortunately, all the bitches do not love me.

^(*I definitely didn't post this earlier and accidentally delete it*)",2015-05-29 09:10:14,IAmTheKarmaHunter,588
"""Wanna be a baller, shot caller 20 inch blades on the Impala...""

20's are considered small nowadays.",2015-05-29 09:28:22,lolligaggins,196
"A lot of Eminem songs from the early 2000s. Too many specific pop culture references. 

""Chris Kirkpatrick you can get your ass kicked worse than them little Limp Bizkit bastards, and Moby you can get stomped by Obie"" 

The non FatOne fat guy from N Sync, a terrible nu metal band, and fucking Moby? Hardly timeless.",2015-05-29 09:15:28,Deenus,313
"&gt;""I'm at a **payphone**, trying to call home, all of my change I spent on you.""

- Maroon 5  -  Payphone, 2012.

It was already out of date when released imo...",2015-05-29 08:29:10,lurked,1844
"""Video killed the radio star.""

Now it should be:

""Internet killed the video star.""",2015-05-29 09:19:43,AvianMinded,243
"""Put another dime in the  jukebox, baby"" - I Love Rock and Roll by Arrows

A dime ain't worth a dime anymore!",2015-05-29 08:57:24,melance,384
"""Oops my CD just skipped, and everybody heard you let one rip"" - Eminem",2015-05-29 09:27:11,bottomofthetop,189
That Prince song 1999. I don't want to party like it's 1999. I like my smartphone and social media.,2015-05-29 08:30:57,cold_in_the_south,508
"""Six billion people, just one name."" (30 Seconds to Mars - Edge of the Earth)",2015-05-29 08:54:57,Deroni76,147
"J Geils Band - Centerfold: Years go by I'm lookin' through a girly magazine, And there's my homeroom angel on the pages in-between. - now he'd just find her on reddit while eating chicken wings",2015-05-29 10:26:12,foozerluck,78
"Billie Jean

Just get a paternity test!",2015-05-29 10:25:24,IPAs_and_rain,39
"""We met at borders."" - Kanye West. It is impossible to meet somebody at Borders now. That line could not happen again.",2015-05-29 09:40:28,Deearewhy,144
"Take your pick from Destiny's Child's ""Bugaboo"":

""You make me wanna throw my pager out the window""

""i wanna put your number on the call block""

""have AOL make my emails stop""

""20 minutes after i gave you my number you already had my mailbox full""",2015-05-29 09:14:03,Gwan_so,74
"""Wanna be in my gang?"" by Gary Glitter.

Cos *nobody* wants to be in that gang any more.",2015-05-29 08:53:00,peon47,187
"""Here's a quarter, call someone who cares.""",2015-05-29 08:44:00,Aerron,85
"&gt;Leave your message on the ansaphone. I'm not trying to be clever but at least we're not still living together. 

 - Pulp, Ansaphone

&gt;Well then I said let's all meet up in the year 2000 / Won't it be strange when we're all fully grown

 - Pulp, Disco 2000",2015-05-29 08:46:21,CollectTheColdWar,62
"""Are you gonna stand around till 2012 A.D.?"" - ""A Certain Shade Of Green"" by Incubus.",2015-05-29 10:08:52,scarlywhit,27
Frank Zappa's 'Who Needs the Peace Corps' is irrelevant because all the 'phony hippies' live in Portland instead of San Francisco.,2015-05-29 09:03:55,IlFactotumDeLaCitta,27
"I'll never fall in line, become another victim of your conformity.

No, you sure won't Deryck, you'll fall much further down than that.",2015-05-29 08:32:34,Sinom,152
"I was gonna say 'Friday', but we'll have to wait untill tomorrow for that.",2015-05-29 08:22:48,Delonyem,195
"""Operator oh can you help me place this call""( Jim Croce- Operator)",2015-05-29 09:08:59,dwalsh15,65
"I love Rock and Roll, so put another dime in the jukebox baby. 

99 Luftballoons? I would think there would be like 150 due to inflation.",2015-05-29 09:37:51,PortableFreakshow,175
I can't drive 55!,2015-05-29 09:39:15,Herbiethelovebug,18
"Tiny Tim - Livin' in the Sunlight, Lovin' in the Moonlight

Haven't got a lot,

I don't need a lot

Coffee's only a dime",2015-05-29 09:11:25,10-10withrice,17
"Elton John's got two fine ladies"":  Everybody's makin' it big but me - Dr Hook",2015-05-29 08:21:47,farawaytoday,73
"""I put ten bucks in just to keep the tank topped up"" - The Tragically Hip",2015-05-29 08:59:36,Cryovenom,104
"Sadly, nobody drinks milkshakes or goes outside anymore.",2015-05-29 08:33:52,DefenestratedEgo,265
"ðŸŽµ ""My baby, she wrote me a letter"" ðŸŽµ

When was the last time anyone sent a letter that wasn't a birthday or  thank you card?",2015-05-29 09:15:21,Mutt1223,28
Almost anything in a slow cooker. Put a whole chicken in on low for 8 hours and come back to tender delicious roast chicken! Pop it under the broiler to brown it up before serving.,2015-05-29 15:01:37,thatbelinda,248
Pizza from scratch can be dead easy and everyone loves pizza,2015-05-29 15:11:58,j-89,147
Curry,2015-05-29 15:00:12,sand_eater,64
"Anything on the grill. Seriously, you barely have to marinate. 

Take a zucchini and slice it in half twice to get 4 spears. Salt and pepper that shit. Grill it. Get the sexy grill marks. Plate it. Eat it. Delicious. You can do this with lots of different veggies. 

Chicken thighs with a tiny drizzle of BBQ sauce. Get the sexy grill marks. Plate it. Eat it. Delicious. You can do this with lots of different types/cuts of meat.",2015-05-29 15:11:47,Flowsephine,137
"Risotto seems difficult, but it's actually pretty damn easy. Just butter a pot, dice up a shallot, add a cup of arborio rice, then add chicken broth and stir for about 20 minutes. Be sure to add broth if need be, and don't forget to stir. I once left the risotto alone for 10 minutes and it burned the hell out of the rice, then my dad made me stand outside in the freezing cold while he beat me senseless with a set of jumper cables. After that, mix in some parmesan cheese and you've got risotto. Pretty simple.",2015-05-29 16:07:55,rogersimon10,522
Dulce De Leche if you consider desert a meal.,2015-05-29 15:57:15,r00kgrist,25
"Alfredo is so ridiculously easy and it takes no time at all. All you do is grate parmesan, boil fettuccine, and heat up a stick of butter with a cup of heavy cream. As soon as the pasta is done, dump it in a dish with your cheese and hot cream, bit of salt, some pepper, possibly nutmeg. Mix it all up. Possibly throw in some pasta water if it's too thick. Shazam.",2015-05-29 15:36:30,tywin_with_tits,61
Fish tacos with homemade slaw and chipotle sauce.,2015-05-29 15:12:45,The_Eagle_Has_Landed,38
"My wife makes a god damned delicious bean soup that is essentially just three cans of various beans, a can of Rotel tomatoes+chili and some browned hamburger or whatever other meat you like.  Stick it in a pot for 30 minutes and enjoy.",2015-05-29 15:27:22,cosmic_potato,16
I wish I knew but I upvoted because I would really like to see what other people have to say. The best I can come up with is bruschetta.,2015-05-29 15:01:11,NickTheGrip,71
lasagna ... just assemble!,2015-05-29 15:03:20,london0800,40
Chilli.,2015-05-29 15:15:32,Reddosaur,11
"Macaroni Cheese is impressive, right?",2015-05-29 15:00:04,Mobius6432,48
"Steak Gorgonzola-Alfredo from Olive Garden. It's delicious and it's really not too difficult to make. The recipe can be found online and if you can follow directions, then you're golden.",2015-05-29 14:59:56,theonlygurl,25
"A steak. It's an easy three step process of prepping, oven cooking and then pan searing.

Video explanation: [link](https://youtu.be/GZ4xl7XJM08)",2015-05-29 15:40:52,spunkyass69,18
"Smoked anything. 

1. Put dry/wet spices on meat/anything smokable. 
2. Put in smoker. 
3. Make sure fire doesn't go out every once in a while. 
4. Delicious smoked food and you look like a bad ass.",2015-05-29 16:44:31,ARRmatey,9
Fresh homemade pasta. Really. It's just flour and eggs.,2015-05-29 15:10:24,PM_ME_UR_PIE_RECIPES,14
baked lemon pepper salmon with roast asparagus and sautÃ©ed mushrooms!,2015-05-29 15:33:35,pamplemus,8
"Salmon. You can cook it ""en papillote"". Just put vegetables in, put in the oven and that's it.",2015-05-29 15:55:56,Alecrin,7
"A platter filled with fine cheeses, dried fruits, and fine nuts is absurdly easy to put together and is almost always a winner, especially if you are looking for an easy romantic dinner. You can also easily add some toasted french bread and olive oil dip. 

Add a side of good wine and some dark chocolate to put it over the top.",2015-05-29 15:47:19,MasterGrok,13
"Chicken broccoli alfredo, or 3 cheese chicken penne",2015-05-29 15:11:15,desmosomes,6
