"I've been out for a little over three years. I'm much more organized. Some say my bedroom looks like a prison cell. Very minimalist and clean. Now I wake up early every day. I exercise 3-4 days a week. Anywhere I go I'm constantly observing my surroundings, like where are the exits in buildings, where/why are crowds gathering, etc. And I never wear flip flops or sandals. When shit goes down, be it in prison or on the streets, earthquake or zombie apocalypse, you don't want to have to fight/run for your life wearing flip flops. 

Edit-Gold! That's awesome, but more importantly, maybe I saved a life!

Edit2-[Pics of me then and now not wearing flip flops](http://imgur.com/gallery/pbj2t/new)",2015-05-30 09:59:59,echoesofsavages,4036
The courtesy flush. I do it all the time now.,2015-05-30 07:51:56,SlavicHavoc,2627
"Was locked up for 17 yrs. couple of habits I still have, I still take one leg completely out of my pants when I shit, and the other habit is in prison they would ring a bell 10 min before they would open the doors for chow so I would get up at 4:45 am so when they popped my door I was standing there ready. Still get up at 4:45am and the first thing I do is put my sneakers on. Kinda sad 10 yrs out. Something's just don't go away.",2015-05-30 09:58:34,Walkinbirds,2357
"I learned not to say anything if it could possibly get me punched in the mouth. I am no longer willing to get punched in the mouth lol. So I offend people a lot less and have learned to use my words wisely.

I have zero need for bathroom privacy now. I spent a year in some dorms. no stalls lol. you would be in there taking a shit right off the day room and someone would be at the sink 3 feet away brushing their teeth and making eye contact with you. talking about fucking your sister or something...just normal conversation lol. 

I sleep lightly. 20 man dorms? Its been 7 years since Ive come home and I still jump out of bed ready to go at any noise thats out of the ordinary.

Another thing that stuck with me is I dont get excited. My outdate changed so many times and I would get so excited just to be crushed. Now if something like I think Im gonna get a call back for a job? I dont invest any emotion in it until it happens. It doesnt exist until it Does...and until that point Im not getting attached to the idea. 

I almost forgot too....I eat fast. No bullshit. No fucking around. Every single meal that I eat is gone in under 6 minutes",2015-05-30 10:34:58,desistcreation,503
"I became much more tidy and clean, which is a good thing. I can't stand mess around the house now, unwashed dishes, unmade beds, etc. 

I am much more organized as a person, I have more self-discipline than before.

I learned to listen to others, think before I say anything. And I have become a very light sleeper. I miss the days when there was construction work outside my window and I slept trough it. Now at the smallest noise or commotion I'm up.

A good habit I picked up is to share stuff with others, be it food, cigarettes, whatever. I am much less selfish now.",2015-05-30 07:19:07,bgdn99,4745
I picked up the unexpected habit of not doing drugs anymore.,2015-05-30 09:11:56,Paleredir,2610
I became a lot more respectful. I went to federal prison a head strong ass hole and when you are sleeping 10 feet from a guy who was a hired hit man..you kinda learn to show respect.,2015-05-30 07:43:12,whytegallo,4401
"I'm a lot more truthful and look for that quality in others. If you lie a lot in the joint someone is going to fuck you up. All you have in there is your word and if your word aint shit then neither are you. I can't stand people who lie or talk out there ass constantly, sure plenty of people glamorized what went down but for the most part when shit got real you know who was going to actually do the shit they said they'd do.",2015-05-30 08:52:41,tkstunts,1190
When to keep my mouth shut. Some things just don't need to be known by the pop.,2015-05-30 04:36:43,sunofthemourning,2729
"I got really, really good at ping pong.",2015-05-30 09:15:53,brainsexual,899
[deleted],2015-05-30 10:36:04,,339
"I treat life like an adventure now and not take anything too seriously. Life on the outside is still like doing time except with a lot more distractions. 

Releasing a lot of attachments to materials things, possessions, and drama. Don't need a whole lot to be happy these days. People come and go, everything can change in an instant.

Time is a man-made construct that limits thought, dreams, imagination.

Using baking soda for deodorant, toothpaste and shampoo.   

Being able to make ramen stew tacos in dehydrated beans packaging. Swore that once I got out I would never eat ramen or peanut butter again. That lasted all of three months. I can make some damn great tasting ramen now. 

Operational awareness - knowing how to watch my back, walk with my shoulders square to exude strength and confidence, intuitive problem solving and resourcefulness.

Slowing down, to observe and listen.

That we are all equal and that ego is so made-up and temporary.

Enjoying every moment that I am NOT in prison.

Just being able to laugh at everything, tell bullshit stories, keep life interesting.",2015-05-30 10:04:49,txprisonthrowaway,616
"I was a resident of the oldest, most well-known prison in my state.  I was there for a relatively harmless crime(I don't want to debate this..but it was drugs).  I was in there with murderers, rapists, and people serving life.  I realized there is so much to learn from these people -- and anyone, really.  Many of these men were filled with so much wisdom -- often regret for the choices that a younger, more impulsive self had made.  When they spoke to me, I recognized it for what it was -- they looked at me and saw themselves, and so they would speak to me gently..patiently..but still assertively..in an almost 'learn from this' way.  What they maybe didn't know?  That when I looked at them, I saw MYSELF too.  What would become of me if I continued doing what I was doing -- acting, talking, and treating other people how I had been.

The impact going to prison had on me was profound, and I still harken back to those days(three years ago).  I'm currently in recovery from addiction -- and I'm blessed to be alive today.  My life is..so much different now than at any point in my life.  I'm so grateful for all of the little things -- and really, just to be able to type this response out and know it comes from a pure, real, yet not-overconfident place.",2015-05-30 09:30:19,no_okaymaybe,2302
How to masturbate over a bit of leg on Emmerdale in total silence.,2015-05-30 10:27:07,m00fire,154
"I worked inside Arizona State prison system for 8 years and it's amazing how close the behavior of the Officers and inmates is. What stuck with me is when I'm walking with somebody and we reach a door, one of us will open the door first and hold it open while looking around. The other person walks in behind them and continues to scan while the first person watches behind them until the door is closed. I've been assaulted 3 times and once was entering a building.

Another thing about spending a lot of time in prison is a fear of silence. Prisons are noisy. Very noisy. Nothing I have ever experienced was more frightening than a dead quiet chow hall.

Also, don't try to game me. I was gullible when I started. I'm not anymore.",2015-05-30 06:00:43,worksafemonkey,3374
[deleted],2015-05-30 08:33:32,,473
"For me, prison made me read other people much better. You know, the ""street smarts"". Nothing really bothers me anymore, I mean I get emotions like everyone else but at the end of the day nothing will be worse than prison. I never really have bad days anymore compared to prison. People complain about this and that and I'm just like ""Welp, it's better than sitting in a cell all day"". Made me appreciate freedom much more.",2015-05-30 09:50:32,sheepherdingninnymuf,409
I will never reach over someone's food plate to get something.,2015-05-30 09:07:20,frizzaks,279
"Prison has taught me that everybody makes mistakes. I met a lot of smart guys in there believe it or not. I also realized just when you think your situation is bad, there will ALWAYS be someone else who's going through worst. I'm more humble today",2015-05-30 09:37:42,Iwindaily86,176
Unfortunately I started going to the local woman's prison in Ontario very shortly after my 18th birthday and it became my home away from home. I developed a few habits. I know how to conduct myself when entering a new group of people and learned to humble myself. I don't reach a cross people's food or plates. I still sleep with a light on. No matter what even if I think it's the right thing to do I stick to the code of silence. It's hard to get rid of street and jail mentality.,2015-05-30 11:01:11,dazed-n-confused-,57
"Getting up around 2-3am to poop. You know, so you can do it in private.",2015-05-30 09:35:43,rtillaree,161
[deleted],2015-05-30 09:02:30,,381
"Self exposition. Statements which are just about yourself or your personal habits or preferences. 

 Don't do it in prison. Don't do it in your public life. Recently I've learned it's even good to not do it in your private life. Keep your shit to yourself",2015-05-30 07:49:59,WoodyHarrlesonsAgent,1314
[deleted],2015-05-30 07:58:55,,430
[deleted],2015-05-30 08:33:15,,371
"Wiping off water before drying off. In jail, they give you a little bitty towel. If you don't wipe off water first, it won't dry you all the way off",2015-05-30 10:43:12,Th3End,42
"I became fucking MacGyver... Seriously, I can fix anything with anything now or throw together some random shit to achieve what I need.

Also, I still hear ""12!"" in my head when I see a cop :(






Edit: ""12"" is explained in a reply below.






Edit 2:

A few things about doing DOC time that a lot of people seem to be bewildered by, just because I'm bored.

- Most people think of cell blocks when they think of jail. [Dorms like this](http://imgur.com/dZJ0jta) are more typical unless you're maximum-security... at least here in Louisiana, the prison capital of the world (yes, we have the highest incarceration rate in the world)

- The things people get in jail is bewildering... Actual knives are common (real knives, not shanks) in many jails - I've seen dudes fighting with big ass kitchen knives. Some jails will have a gun or two in them. At a DOC camp in Bunkie (I believe? Maybe it was East Carroll), items found during a huge shakedown included a pistol and a bulletproof vest. Drugs are everywhere. Cell phones are everywhere.

- Anything illicit is bought with ""dots"" (well, in camps that don't allow cash) - you get your people to go to the store and get a Green Dot Moneypak and give you the number, you give the number to the person you're buying from, they call and ""run the numbers"", you get your shit, then they either load the dot onto their prepaid card or have someone do it for them. If paying with stuff from commissary, you may pay as high as 200% sometimes. Typically, a Suboxone strip in jail would go for $50-80 cash/dot and $140 commissary.
If you borrow something from someone you're not cool with, it's an unspoken rule that you pay them back double (i.e. 2 packs of cigarettes when ""store day"" comes in exchange for 1 now)


- COs (guards) won't hesitate to spray you with mace or beat the ever living fuck out of you for simply looking at them a certain way (or it being perceived that you're looking at them a certain way). This will NEVER change and the guards rarely ever get in trouble for it.

- A lot of guards do more dirt than the prisoners. Bringing drugs in, accepting bribes to let an inmate escape for a little while (just be back before head count), arranging ass-beatings, etc.

- Prisons have something called the ""goon squad"" - a stormtrooper unit that officially doesn't exist, yet is the warden's personal ass-beating administration unit. Inmate been causing problems or cutting up too bad? The goon squad will be sent to beat the fuck out of him... Broken bones and worse are pretty much expected in some prisons if the goon squad comes.

- Medical care? ROFL. They'll literally watch you die and not give two shits.

- EVERYTHING is done via a form. Inmate request forms, grievance forms / ARPs, medical request forms, shave pass request forms, etc. If you ever need something, the answer will be ""fill this form out"". Half of the time you won't get a response, and when you do it'll be days or months before you hear anything back.

- Inmates will often sew a pouch or pocket in the crotch area of their sweatpants or boxers - usually this pocket is made out of the material from old boxers - to tuck phones or drugs in if they get run up on by the guards. We used to call these pants ""tuckers"".

- The simplest tool / weapon to get? A razor blade. All you do is take the cheap disposable razor they give you and crack the tip in half and pull the blade out - it's a thin flexible super sharp razor. I cut my pinky to the bone one time trying to get one out when I didn't know what I was doing.


- **If you find a honey bun on your bed** you may want to think twice about eating it. Because someone is going to come to you wanting it back... And not just any honey bun, that same exact honey bun. Well, that or your butt.",2015-05-30 09:22:10,SoEntrepreneurial,528
"I got indicted at 18 and turned 20 and 21 inside of a federal prison. I was in on a gun charge and not drugs or anything else.   All in all it wasn't bad, the food sucked but for prison food it wasn't bad,  there wasn't really shit to do but it was prison and we had a movie theater that played recently released to pg13 dvd movies, there were good people and bad just like anywhere else just the contrast was more severe.  

Some of the things that i learned in there and have kept are...


Be a stand up guy and keep your word,  basically just say what you mean and do what you say. But i did this before i went.  


You find a group who do the above and you stick with them.  This is what's known as your car or the group of people that you hangout with. I thought that i did this before but being told on by my best friend dictates that i did not.  


Everyone in prison is an innocent philosopher. 


Good roommates make your time go fast, bad roommates make your time drag and ends with them in the hospital and you in the hole. 


I'm perfectly willing to fuck wiling to fuck off a few months of good time when the rat that they put into your room who refuses to take a shower starts to act tough.  See above.  


Don't talk about it be about it.  Or in other words,  when your actions speak for themselves you don't feel the need to run your mouth.  But i did this before i went also. 


He who hits first hits last and the fair fight is the one you lose.  


You can be friends with whoever you want but when shit goes down know where you stand.  


Burritos and nachos are awesome.  


When you tell the truth you skin it,  tap your forearm witch means that your telling the truth on your skin.  I still do this when people accuse me of lying reflexively and it makes funny conversations because no one believes me about being in prison. 


I love reading.  


Pay your debts and don't gamble more than you can afford.  


I still call child molesters chomos. 


The halfway house in downtown KC is worse than prison. You take all of the few good qualities prison puts in people and remove the threat of violence if they don't follow that because no one in a halfway house wants to fight and it's all gone. You're left with nothing but chomos and bitches that will do anything for a cigarett. 


I don't care how many cigarettes you can sneak into the halfway house when you try to brag about raping a twelve year-old girl and almost killing her. 


I will not let a chomo ride in the elevator with me and force him to take the stairs.


I know I'm late and no one will ever see this but there it is.  I'm 24 now and off of parole tomorrow and am two years into a business degree.",2015-05-30 10:31:46,rustede30,1034
"I always assess situations  and ""size people"" up now.  I was excitable before but now I lay back and size everything up. Sounds like a small thing but it's helped me immensely in the real world.

I talk 60% less than I used to and listen more rather than talk.  This small thing has actually made people open up to me since they think you are interested. It's part of the human rapport issue and how it works. I don't give a shit about you, I just learned in prison the less you say to people, the better.

I eat three meals a day like in prison and no eating after 5pm . No snacking in between. I was the healthiest and lowest bf in prison eating three small, shitty meals a day. I noticed I don't need all that garbage protein shakes and such in between to get huge. I am massive now that the three meals are nutritious type meals and I don't eat after 5-6pm.

I am neat and tidy , almost OCD. This is VERY important in prison as a messy fuck will get you a beating, sometimes a very ,very bad beating.

Oh yeah and the one that has basically been true in prison and has helped me outside- TRUST NO FUCKING ONE!!!! . Especially the ones that say ""trust me"".",2015-05-30 09:30:35,tessholliday218,441
[deleted],2015-05-30 09:28:36,,71
[deleted],2015-05-30 12:44:12,,34
"Well let's see:

I got very fucking good at reading people. I know a surprisingly lot about a person after I first meet them. How they talk, what they say, what they do with their eyes, etc - it all goes into a database in my brain which spits out a likely profile of the person.

I always sit with my back to the wall when I'm in restaurants or other places where people might be walking behind. I also keep a very close on the exits and I pay very close attention to who is in the place. Also, I've finally gotten out of the habit of sitting with my legs on the outside of the chair legs in case I need to jump up quickly. 

I learned this growing up, but one thing that is very fucking important in prison is to not fucking talk about people or anything they may or may not be doing behind their back. Also, don't ask questions, and if you're asked a question about someone else, you don't know the answer.

**As far as what to do if you find yourself going to prison, here's a few tips:**

Don't join a gang. I saw so many young kids go in and think they were getting protection and respect, but what they were getting was used. The best way not to find yourself in a fucked up situation is if you, and you alone, or responsible for your own actions, and not for the actions of any other knucklehead. 

Don't mess with the sissies. Seriously, they bring out the predators and you don't want to be involved in that shit. Even if you're gay as 3 boys fucking, just go jerk off in the bathroom like everyone else. You do not want to find yourself in a love triangle with a triple murderer and a boy that thinks koolaid is makeup.

Don't gamble. Just don't. Yes, it's boring as fuck, and yes it makes the time go by, but you are opening yourself up to a few different problems if you do it, so don't. 

Keep your word, don't break it for nothing.",2015-05-30 11:36:31,ApprovalNet,121
"U ever been to public chess tables? you'll never beat anyone with 5+ years in prison. seriously. I did a couple months in county, and I went from knowing nothing to being serious competition online.",2015-05-30 10:01:32,michyum,60
"I can't sleep in silence. Quiet spaces make me paranoid. I started my bid at Polk Youth Center in 1990, finished at Caledonia farm in '98 and my most powerful memory is how quiet it would get right before shit blew up. Every time.",2015-05-30 10:50:58,Shamus-McNasty,31
[deleted],2015-05-30 07:26:25,,427
[deleted],2015-05-30 09:29:53,,79
"2 years in juvenile secure and non secure. Even though it might seem like a kitty jail it is not. Many of my friends have been with me in juvenile and ""graduated"" to the next level of incarceration and they have all told me that juvi is just as bad or even worse as kids are younger, stupider, and more energetic.

Either case I seen some shit and been through the good and bad.


So I took a couple things with me fron my expierence.

I learned to believe in hard work pays off. Actually stepping up and being proactive for yourself and others will bring in positive results.

I learned to be super alert in a public environment. I tend to analyze every person with or with out interacting with them. This is also very useful when driving looking out for cops. 

I learned to respect everyone I meet regardless of their size, color, beliefs, sex and sexual preference. Seriously this really changes your perspective on life. You become a family with everyone going against one bigger enemy versus going against each other.

You learn to be independant. You go to jail alone to do your time and not to make friends. I came out with the same mentality.. I do things and things get done for myself and all by myself.
(However I these days I do try and drag my new good and postive friends along just to talk to and stuff during downtime)

Not everyone who goes to jail comes out with these type of lessons though..

Some are just in crazy situations where they become to point of crazy and paranoia. This can easily happen to absolutely anyone in jail. I consider myself very lucky. I also had a lot compared to my fellow inmates where some may have had no parents since they were able to speak or some have been homeless for years. These are some examples but again I consider myself very lucky and grateful.

Speakinf abour grateful, the biggest thing I think every ex inmate here can relate to is being grateful....

Grateful for ice.. ice in our god dam cups.. holy shit I have ice in my cup... ice....",2015-05-30 14:45:25,get_touched,25
[deleted],2015-05-30 10:54:41,,26
[deleted],2015-05-30 14:54:24,,87
"CO here... I say yes sir and no sir to everyone. It doesn't matter inmate or officer. It's respect and if you expect to last in that world you learn to give it and to get it. And never walk with my hands in my pockets. It's bad weak posture and a gaurenteed way to get knocked the fuck out, backs to the walls, have an escape route. And no matter the custody level... the color of skin... or how big or small... an inmate is an inmate and a person is a person, they are all capable of being horrible and all capable of being alright",2015-05-30 09:45:12,TheBestAndrewEver,47
[deleted],2015-05-30 08:47:09,,143
"Almost 3 years later, I forget it even happened.  I come off paper in a few months, but I have to mark my calender or else I'll forget to report.

Every now and then I'll remember my PO doesn't like the idea of me drinking again, but what he doesn't find out, and I'm not telling, doesn't hurt him or me.

Nice enough guy.  Overloaded as fuck, though.

Enough people going through the system on their first time alone to overload probations without repeat offenders.

Once you've learned the workings of the legal system from actually being in the system, it's much easier not to get caught a second time, and I've done some things this month alone that would probably get me revoked.

I wasn't exactly not a criminal before I officially became one, but complete the motion if you stumble, you know.  What does a convicted felon have to lose, honestly?  Talk about starting life again at the absolute bottom of the pile, with a college degree, and always being near the last choice for menial labor behind people who have been fired 3 times in the past.

I'm not surprised at all that a good portion of the people I met in there were back for more.  A record has a very real gravity to it.",2015-05-30 07:57:27,ThrowAwayTeamGoGoGo,629
"I was in jail when I was 17. Our pants did not have pockets. To compensate, we would stick our hands down the sides of our pants like they were our pockets.",2015-05-30 09:11:00,eveofwar518,128
"Ortolan

Source: http://en.wikipedia.org/wiki/Ortolan_bunting#Gastronomy",2015-05-30 08:26:46,Mark725,383
World Cup stadiums,2015-05-30 10:48:40,spoonybard326,3957
"Most types of figs are pollinated by a wasp flying inside them and dying. Then the wasp gets digested by the fig. So, you can think of that next time you eat Fig Newtons.

Source: http://animals.howstuffworks.com/insects/fig-wasp2.htm

Edit: Apparently not *all* types of figs are pollinated this way, only some. Dried figs come from a fig species that is pollinated by wasps, but commercially produced fresh figs, which are the ones in Fig Newtons, do not.",2015-05-30 08:00:17,Sgt_Pepper42,2272
A bill being made into a law.,2015-05-30 10:51:37,PompeyMagnus1,1320
"Kittens are cute and cuddly, but [the process of creating them is an eldritch horror devised by an angry god](http://knowledgenuts.com/2013/10/15/cat-sex-is-effectively-torture/). Many believe this is evidence for why evil must exist in the world, in order to balance out the cute things like kittens.",2015-05-30 09:19:31,Dear_Occupant,1031
My American flag was made in China. I don't even know what's real anymore.,2015-05-30 10:05:28,abCEEdeeznuts,1542
"Head Cheese.

Head cheese is not a dairy cheese, but a terrine or meat jelly made with flesh from the head of a calf or pig, or less commonly a sheep or cow, and often set in aspic. Check out this brief youtube vid:

www.youtube.com/watch?v=lC8qnOXchpI",2015-05-30 07:18:22,Back2Bach,410
"Nike shoes.

EDIT: I've seen some posts with articles and info about how Nike is working to eliminate the sweatshop conditions of its factories. Hurray!",2015-05-30 09:00:03,ThatOneFaggotFromUSH,733
