though your watermark was stitches for a second. dick almost retracted,2015-05-29 11:50:35,SystemFailure,6
Adore x,2015-05-29 11:39:08,Hung_S0l0,2
It's gorgeous!,2015-05-29 11:40:09,bigtitlover89fuckit,2
Beautiful pussy!,2015-05-29 11:40:59,_AlphaMail_,2
Buen provecho,2015-05-29 11:41:14,Agamemnon2012,2
"Oh, and I would in an instant! Damn that looks good!",2015-05-29 11:46:09,charlznchrg,3
*lick* yum our pleasure,2015-05-29 11:49:51,thebeastandhisdoe,3
Damn!!!  You got me so hard!! Okay if I eat some ass too?,2015-05-29 11:41:46,sissyboi333,2
In nibbles or bites?,2015-05-29 11:50:32,me_bein_naughty,2
I'd love to. :P,2015-05-29 11:51:30,only5pennies,2
"The entree looks delicious, as does the tasty side dishes.",2015-05-29 11:54:27,impskin,2
Looks yummy,2015-05-29 12:10:16,sausy610,2
I'd eat it!!,2015-05-29 12:10:43,hellwhynott,2
Classic as pb&amp;j!,2015-05-29 13:22:44,SlimTwisted,1
A pussy a day keeps the doctor away.... Errr not sure  if that's how that one goes...,2015-05-29 14:28:02,Rustygut,1
"Voices in my head: ""Go toward the light!""",2015-05-29 14:29:14,ILikeThePrettyOnes,1
god damn,2015-05-29 14:31:11,PM_ME_UR_SIMP,1
im ready if u are,2015-05-29 14:53:41,boytoy4545,1
When and where LOL,2015-05-29 15:05:55,Renman1605,1
I'll have the all you can eat portion please,2015-05-29 15:40:40,lonelyknight1668,1
when and where,2015-05-29 16:35:43,Renman1605,1
Yes please,2015-05-29 17:57:03,bearisdriving9,1
"Mmmm I just want my hands on those tits, my lips on your lips, and my tongue on your clit! I could stay down there for hours",2015-05-29 18:55:22,curiouscat09,1
I'm going to be a tease and only kiss where your watermark is.,2015-05-29 16:30:07,comradedongington,0
"What's with the ""6789"" shit along the crotch crease? Are you a robot with a cunt?",2015-05-29 16:58:14,barfly_dreams,-3
"**@_@** fattest little pussy on GW, *I LOVE IT*!!",2015-05-29 07:34:31,Beardedly,6
Absolutely beautiful..,2015-05-29 07:34:46,FunkyMonk24,3
What a beautiful set! I love the tiny panties :),2015-05-29 07:38:31,dklesswndr,3
Killer body.,2015-05-29 07:47:53,Titty_PMs_Please,3
I want your feet all over my face!,2015-05-29 10:27:10,soundguise,3
Good morning gorgeous!! Always love seeing your albums!!,2015-05-29 07:33:45,hellwhynott,2
"Love the album , but I am surprised you missed another thing to do with a little thong like that",2015-05-29 07:36:32,SecondSonOfDavid,2
"Oh my ! You're so hot, that I barely passed out ... You're really great !!",2015-05-29 07:38:31,FrenchTouchBaby,2
first picture would fit nicely in [/r/WtSSTaDaMiT](http://www.reddit.com/r/WtSSTaDaMiT),2015-05-29 07:39:53,Ninjadada,2
Dolofapititis. It's a real condition...,2015-05-29 07:40:35,ILikeThePrettyOnes,2
Your posts are always a pleasure.,2015-05-29 07:41:50,only5pennies,2
Sexy post as always :) xo,2015-05-29 07:55:11,Mach1_85,2
That thong just needs to be torn from your body,2015-05-29 07:55:11,birocock,2
Gosh darn it!! I was gonna wear the same things!,2015-05-29 08:07:50,sissyboi333,2
My imagination will be running wild all day now! Thank you so .much ;),2015-05-29 08:09:48,FineglinBill,2
I like your face.,2015-05-29 08:13:14,PM_ME_UR_SIMP,2
Have to say....absolutely stunning!,2015-05-29 08:13:34,WiseMagus,2
Goddamn woman! #7 is the stuff of dreams,2015-05-29 08:22:48,derevocsid,3
Absolutely gorgeous! Happy Friday!,2015-05-29 08:24:22,axion_510,2
That title sounds like a Cake song. :),2015-05-29 08:26:10,lotsosmiley,2
Of course YOU are gorgeous as always!!!,2015-05-29 08:27:23,tikibowtiki,2
Lustful! Happy Friday:),2015-05-29 08:30:43,manwithnoname_,2
You are truly delicious,2015-05-29 08:38:37,MenWhoGolf,2
You're quickly becoming my favourite girl/girl fantasy ;),2015-05-29 08:39:15,arcanemaiden,2
you make me sad,2015-05-29 08:55:53,ziguizingue,2
Good morning. Stunning as usual.,2015-05-29 09:01:02,BLKGENT,2
"All these heavy hitters posting on the same day!! 😍💗😍🎉👏

lotioning and oiling, oiling and lotioning, I can't take it anymore!!!!!",2015-05-29 09:19:01,Smack23,2
Amazing as always. Just got my Friday off to a great start.,2015-05-29 09:24:47,ElVatoSuave,2
"&gt; Of course you're supposed to wear something underneath it...

But that's not how you roll. :D",2015-05-29 09:47:19,dyslexicbunny,2
I want to take those panties off with my teeth &lt;3,2015-05-29 10:39:27,ycuzimfly,3
It is an absolutely gorgeous phat pussy though ;),2015-05-29 10:46:59,dfg22,2
That shirt looks beautiful on you.  Would love to see more of that :),2015-05-29 11:17:02,shows_his_cock,2
as usual for you....so fucking stunning!,2015-05-29 11:23:48,firemanxxxphoto,2
Sisqo would be proud...,2015-05-29 11:35:06,JigOhLow,2
I had lunch with Bob Dole while in college...I used to think he was my favorite but your phat pussy changed my mind about that,2015-05-29 12:07:40,zeagle69,2
wow amazing pussy.. even more sexier with the piercing.. love it.. i bet it taste amazing too.,2015-05-29 12:38:44,boytoy4545,2
"That pussy is sexy as hell!!!!!, and so is that ass!",2015-05-29 13:12:38,Charlottezweb,2
"very nice, like your pussy :)",2015-05-29 13:20:28,FloydiaN07,2
What a way to cap off the week! Love it!,2015-05-29 14:11:39,TXBADBOY,2
Nice! I'd love to see you stuff them panties in and slowly pull them out. ;),2015-05-29 08:24:36,DeekDiply,1
"Why, peachy, digity, AND Bob in one morning...  My head is going to explode from awesomeness!  Throw in some E and this could the greatest day of the Internet....",2015-05-29 08:26:47,tikibowtiki,1
I see your pictures and screen name and hear Norm McDonald's voice in my head.  Such complete opposites it's very confusing.,2015-05-29 08:36:48,hansie68,1
Your hot little body drives me wild. You need to be fucked silly.,2015-05-29 09:58:25,DjCyric,1
Amazing as always. Would you be able to post a pic of your pussy eating the panties? A fat pussy with panties tucked in is one of the hottest things to me,2015-05-29 10:33:33,NoThanksJustLooking1,1
I want to put my face to your ass and pull that thong off with my teeth.......among other things,2015-05-29 16:30:11,howardtheduck126,1
"Goodness!!!! You are what My Dreams are made of!!!! Yeah, hands DOWN all around Beautiful! Props :)",2015-05-29 16:38:41,cl6409,1
"Damn!
Would love to see the last few less blurry, but still, Damn!",2015-05-29 16:52:32,Sshakeweights,1
Ahh amazing pics beautiful!  It's a good thing to have a fat pussy :),2015-05-29 16:57:23,Instinct617,1
"So sexy, nice to see your pretty feet again.  Not to mention that fat pussy",2015-05-29 17:22:27,dan_loves_feet,1
great jeezy pete i want to devour that,2015-05-29 18:18:29,fade_7,1
Always hot BobDole. Pic 5 of 20 might be my fav of the set.,2015-05-29 18:32:33,GuidoJoe,1
Gorgeous,2015-05-29 13:13:53,Agamemnon2012,1
Damn girl... lovely. But thanks for getting that song stuck in my head.,2015-05-29 13:14:25,bobbyishere104,1
Wow your stunning!,2015-05-29 13:16:11,gonewildlover84,1
Need some help with that?,2015-05-29 13:17:33,Geasslord,1
Put the phone down and sit on my face already,2015-05-29 13:18:09,__throwaways00n,1
Holy fuck you're sexy! Would love to see more from you!,2015-05-29 13:20:11,tit_addict,1
"I like how you're squeezing your boobs together for the picture. ""Come on girls! Get closer together! I'm taking a selfie!""",2015-05-29 13:20:22,impskin,1
Moar!,2015-05-29 13:27:11,Guy914,1
A very good Look friday :-),2015-05-29 13:31:55,Misterrossi,1
No matter how many times I see those perfect tits popping out of your shirt I never get tired of it. Any chance you'd make a gift of taking your shirt off?,2015-05-29 13:33:01,JustAnotherGuy94,1
I wanna fuck your mouth and make black tears run down your beautiful face.,2015-05-29 13:39:24,lanedgar,1
You get more beautiful with every single post,2015-05-29 13:40:09,therealjt13,1
Well this is lovely.,2015-05-29 13:42:17,MikeyLikesIt2010,1
We so excited! Excited!,2015-05-29 13:55:45,crazylegs15,1
"Sittin in the front seat, Sittin in the back seat, gotta make up my mind, what seat should I takeeeeeeee!",2015-05-29 14:38:03,Rustygut,1
So gorgeous,2015-05-29 15:09:55,MenWhoGolf,1
"almost got head on a Friday because of those lyrics. I say almost because I was most defiantly going to get one before I sang them.

Nice tits though!",2015-05-29 15:16:36,Majesticlymagical,1
"I don't know about getting down, but something just came up.",2015-05-29 15:19:26,Takahiro_Shinobu,1
"If I had to choose between you or Mr. Rogers, it would be you.",2015-05-29 15:36:43,PM_ME_UR_SIMP,1
You a stunning!!!!,2015-05-29 15:39:07,bblvr,1
Why so serious!?,2015-05-29 16:36:06,Nuclearfroyo,1
And how will you be getting down this friday? ;),2015-05-29 17:15:51,crane105,1
I was watching a bound girl getting gang banged and having both of her holes filled. I was playing with my toy and came twice. The second one was the bigger of the two squirts ;),2015-05-29 12:35:42,RedHot_Mama,4
I would do your taxes any day.,2015-05-29 15:51:59,PM_ME_UR_SIMP,3
So hot,2015-05-29 12:24:11,KJ13116,1
Awesome!,2015-05-29 12:28:18,_AlphaMail_,1
I wish I knew what was on your mind to get you to do that.,2015-05-29 12:29:45,impskin,1
Increnible hot,2015-05-29 12:36:40,blade_997,1
Amazing body love the tan,2015-05-29 12:47:28,pinnheadm50,1
Beautiful.,2015-05-29 12:53:15,doorkicker00,1
Does not get much hotter than that! Unless you were squirting on me that is lol,2015-05-29 12:54:30,gonewildlover84,1
"So, hot! I would love to see this! ;)",2015-05-29 13:30:02,cshbc,1
So proud of you,2015-05-29 13:36:59,itscochino,1
Well done. Love your username btw. Sho looks good to me!,2015-05-29 14:01:26,Anglerman,1
"Story Time: My first time making a girl squirt. 

I was 22 living in a student flat. A girl I just met a week before. She told a friend of mine she is into me and is just waiting for me to make the step. Easy game, asked her to come over. Talked and teased her a little without body contact. Staying a little distant. Like to play like that. And I like to do my first move to kiss unexpectetly. Got a phone call. While talking on the phone I saw her face which was saying ""are you seriously having a smalltalk like conversation on the phone while I am here"". I thought that is the perfect face to lean forward to and kiss. So we started making out, undressed and got in my bed. She had the sexiest pussy I saw. Fat lips, goreously shaped and wet like a rain forrest. While eating her out I fingered her. I noticed her screaming very loud while pushing my fingers up and down. I remebered that video I watched about a professionel masseur. I stoped licking her, got up and continued only with my fingers. After just about 30 seconds I felt pressure on my hand and she squirting all over the mattress. I knew what squirting is but I was not expecting such a big wet spot on the mattress. I was very suprised, but she was more. It was the first time squirting for her and had no idea what was going on. I changed the sheets and everything but the wet spot was very big. It was a expensive mattress and I did not had the money to change it. I turned the mattress and slept 3 years over the glory of a big load of squirted juice. Today, 6 years later she still asks me to do it with her even though she had boyfriends in between. Dirty girl, dirty pussy and a lot of fun :)",2015-05-29 19:57:34,DammHaare,1
"Cleanup on isle 4, I repeat clean up on isle 4",2015-05-29 14:36:38,Rustygut,0
"Glad to hear (read) that! I want you to be happy, you know!",2015-05-29 16:41:29,nom-dah-plume,0
"Damn, and I was so thirsty. I would have caught every drop.",2015-05-29 17:00:34,1Moskillz,0
"Sure, just come to London!",2015-05-29 12:30:22,myfapacc,2
Cool. They suit your body x,2015-05-29 12:33:08,giveas,2
Nipple piercings are a huge turn on for me! Very sexy,2015-05-29 12:34:38,tit_addict,2
Id like to gice you a piercing!,2015-05-29 13:16:17,BlackFox1987,2
I'd kiss and lick them! Would you want then bitten a little too?,2015-05-29 12:33:27,bytechocolate,1
Would love to nibble on them right over the shirt!,2015-05-29 12:34:59,someonez2,1
they look great!,2015-05-29 12:35:18,teedabbleyou,1
I'll kiss em gently unless you say otherwise ;),2015-05-29 12:35:32,Voltage_14,1
We would love too!,2015-05-29 12:39:11,thebeastandhisdoe,1
I'll lick them till they're better,2015-05-29 12:40:37,quietshyguy94,1
Ouch!  Glasgow?,2015-05-29 12:56:18,Agamemnon2012,1
nice,2015-05-29 13:20:50,james_ace22,1
How'd you get those bruises on your boob?,2015-05-29 13:40:13,lanedgar,1
I'd recommend putting some ice in my mouth as I kiss them. Helps with the swelling.,2015-05-29 16:06:14,randyjacksoff,1
Well done!,2015-05-29 16:58:48,Sshakeweights,1
A+ Boobies,2015-05-29 08:59:56,bbp929,3
True story.,2015-05-29 08:55:55,_AlphaMail_,2
Your title describes my reaction perfectly.,2015-05-29 08:57:11,strangerh99,2
more like damn damn damn,2015-05-29 08:59:32,techphobia,2
"My shorts feel tight.  
Please do not turn toward the camera they are old and  the elastic won't hold up to the strain, the fallout could be devastating...",2015-05-29 09:03:28,ErectAtWork,2
*WOW* is right! Great titties!,2015-05-29 09:03:42,Beardedly,2
That is a nice tit,2015-05-29 09:35:48,MidwestGuy03,2
Holy fuck! Can't wait to see more from you!,2015-05-29 10:22:19,tit_addict,2
perfect globes!,2015-05-29 10:26:20,hairycracker,2
"Holy shit D: you have a lovely simpson! Please, more!",2015-05-29 12:04:59,PM_ME_UR_SIMP,2
"taco,
Now that's what I call a remarkable tit.",2015-05-29 12:49:09,windyriver,2
holy fuck.  I don't want to live anymore...,2015-05-29 14:09:42,jeosuteen,2
MoAr please!!,2015-05-29 15:02:10,Mclov3n,2
Holy crap those things are amazing. Id love to just feel their perfect natural weight in my hands and then kiss em!,2015-05-29 15:16:00,BoredomStartsTrouble,2
Emma some big damn titties!!,2015-05-29 15:21:26,DeekDiply,2
That's some nice side boob,2015-05-29 15:49:57,SoBeMIAho,2
Very Nice. Thanks for sharing.,2015-05-29 17:18:45,furraira,2
that's some serious equipment right there,2015-05-29 17:25:21,quagmire82,2
Thank you for making my day.. Wow boobies and lovely bush,2015-05-29 09:15:49,elviejoepu,1
Is it the light playing tricks or a natural ginger to boot? Ps that is not a bad thing. :),2015-05-29 17:38:41,Banquo08,1
Most men will spend their entire lives dreaming about such a night.,2015-05-30 12:24:54,particlesix,185
I would love to see more.,2015-05-30 09:58:08,tehloxely,25
The rare Oreo threesome.,2015-05-30 15:41:58,Oilfan94,44
"I literally just said ""you lucky motherfucker"" out loud at work.",2015-05-30 13:36:14,Devil_Dog_,51
"Unreal, and two different colors. It's like getting the swirl from the ice cream machine.",2015-05-30 10:33:13,LadiesLoveItThick,103
Wow. That looks to be a fantastic time. I'd probably just embarrass myself in that situation. :-/,2015-05-30 10:03:15,nsfwcommentor,18
"You are eating her ass, right? You better have been.",2015-05-30 14:02:44,mike3904,8
Where are the rest of the pics?,2015-05-30 16:55:21,makemeking706,8
"So who's taking the first picture? Lol did you just ring up room service and be like ""Thanks for the food guy, by the way could you do me a solid and snap a few pics of this awsomess on my phone?"".",2015-05-30 16:46:44,caindarkmoon,4
"Hell yes. 

This is what MLK fought for!",2015-05-30 16:55:19,Ms_Ellie_Jelly,13
Good job on the edit,2015-05-30 09:49:41,crystalhavokk,5
This was a great night!,2015-05-30 09:51:06,tenaciousthrowaway,7
That black girl is a goddess,2015-05-30 18:28:08,vibeshive,6
does this ebony godess have her own reddit account?  I would love to see more ;p,2015-05-30 17:51:33,montreuil1,3
Beautiful asses who wants it first,2015-05-30 12:39:02,Leafsfan62,4
Some guys have all the luck :O,2015-05-30 16:06:00,rhunter99,2
Jealous much??,2015-05-30 16:08:10,Honestmoi,2
"Santa, can I have friends like this for Christmas please?",2015-05-30 16:11:37,slideforlife,2
She's eating the booty like groceries,2015-05-30 16:54:50,Whereyoursisterwent,3
Oh damn.  We need more of this!  &lt;3,2015-05-30 18:11:44,SkinnySweaty,2
Would love to see the  rest of this,2015-05-30 18:42:31,neadien,2
God damn that's one fine ass black booty. Jesus Christ.,2015-05-30 19:04:33,arnoldrichard,1
The white girl has more ass... What have we come to?,2015-05-30 17:42:12,DryWeightSmoosh,3
This is probably the hottest pair of pics I've ever seen. Post more!,2015-05-30 11:11:36,ImSuchaHugeFan,4
"Well, this is just very amazing.  That's all there is to it.",2015-05-30 11:43:47,Munichaise,1
Totally freaking hot!!,2015-05-30 12:38:25,sissyboi333,1
That looks like some good fun,2015-05-30 12:41:30,ThatDarnMushroom,1
Wow...more please!,2015-05-30 13:37:09,stryder66,1
Love the way you're eating her. Well done,2015-05-30 14:20:21,yeomanwinter,1
"Fuck you man, you and your awesome life.",2015-05-30 14:24:35,blanketpunch,1
FFM taps aff is the best kind of taps aff.,2015-05-30 14:26:16,exquisitefilth,1
That first picture is so cool,2015-05-30 14:57:07,comradedongington,1
You should have friends over more often!,2015-05-30 15:12:51,mj66044,1
Very nice. I'd like to see more.,2015-05-30 15:20:11,Sucka-foo,1
"So who did better?  You, or your friend?",2015-05-30 15:29:05,ColonelCustard45,1
That guy is gonna remember this for the rest of his life.,2015-05-30 15:37:43,bigphil2695,1
more?,2015-05-30 15:54:24,extremegamer,1
Fan-fucking-tastic,2015-05-30 15:57:31,Eyehearshapes,1
Yeah so it doesn't take much to know that you need to post more,2015-05-30 16:02:32,Dontbjelly,1
"Yes, please!",2015-05-30 16:02:47,DingusMacLeod,1
looks like a blast! invite me next time!,2015-05-30 17:08:01,Laurens-here,1
"My kick-stand out \ I'm parked on my side.

Thank You and all who made this happen, You wonderful beautiful kinky assed Lass.",2015-05-30 17:15:53,badbubby,1
Nice butts,2015-05-30 17:20:06,dragonwhale,1
"I'm so hot for lithe black girls.  Damn!  (sorry not sorry)  [edit]  Really, tho, you are all so hot!  Fun times!",2015-05-30 17:41:58,cdbgj,1
Stunning. Amazing. Speechless. Dreams do come true.,2015-05-30 17:48:57,BLKGENT,1
My oh my.,2015-05-30 17:52:30,nvr_ndr21_13,1
Does your friend have a GW account? Both are amazing,2015-05-30 18:30:42,naoacredito,1
"There's not many of us round these parts, cheers hen",2015-05-30 18:38:30,foldoutfish,1
Why can't this happen to me,2015-05-30 18:49:03,AthleticGeek,1
Jesus... I think that's the most jealous I've ever been of one guy.,2015-05-30 18:51:19,DevilsLittleChicken,1
"Your friend needs to create an account, immediatly!",2015-05-30 18:59:46,Mxdem,1
Goddamn that black girl tho. I need to move to Scotland if they look like this there!,2015-05-30 19:01:46,ILikeToPM,1
Just beautiful. Please do make a gonewild album with your freind!,2015-05-30 19:17:31,mrplow29,0
There have to be more pics! maybe even video?,2015-05-30 19:18:49,suicidebylifestyle,1
Dirty Dogs. :),2015-05-30 19:32:39,Bemuzed,1
How did this happen?,2015-05-30 19:35:00,lucidchild,1
Looks like an AWESOME evening!!,2015-05-30 19:49:46,Shavedman60,1
"'Don't stare at it, eat it!'",2015-05-30 19:50:15,HilltoperTA,1
"Wow, outstanding. looks like an incredible time was had by all.",2015-05-30 19:59:43,popeye44,1
No way are you from Scotland haha. My guess Edinburgh area?,2015-05-30 20:07:13,LittleLionMan7,1
"You must be from somewhere decent, things like this never happen in Fife :-(",2015-05-30 20:12:31,weefred,1
way to go man! Internet high five,2015-05-30 20:32:15,Loves-The-Skooma,1
Something about the combination of the two skin tones is incredibly beautiful to me.,2015-05-30 20:42:42,Nam_Erehwon,1
Damn that is some dark chocolate!,2015-05-30 14:21:39,horny-boytoy,1
"I love the juxtaposition of a white girl with the bigger booty.  Good job, jealous....",2015-05-30 16:15:00,motorbike-t,0
"Great! I can imagine that it was an amazing sweet, wet and wild night",2015-05-30 09:53:32,Tedped,1
Gorgeous.,2015-05-30 10:12:32,dubhri,1
"Please keep posting, you've just gained a follower, you're gorgeous to look at and a damn treat ;)",2015-05-30 12:34:49,Anonw0lf,1
"Wow, both of these girls look amazing. He is one lucky guy to be screwing even one of them, but both is just greedy. I am very jealous right now.",2015-05-30 16:17:12,marjonaise,1
Is it hot in here?  Or did I just get jungle fever?,2015-05-30 16:02:13,lifecouldbeadream333,-2
[deleted],2015-05-30 10:07:28,,-4
daaaayum that ebony goddess,2015-05-30 20:16:51,airin209,0
Damn I wish I could have been there with my girl!,2015-05-30 10:08:12,nakedtimeinCLT,-3
[deleted],2015-05-30 13:51:28,,-14
[deleted],2015-05-30 17:25:31,,-25
"as a man married to a sexy black woman, good luck going back to the white folk",2015-05-30 17:46:14,beefnuts12,-8
I would check out Tropic of Cancer. Let it get so overdue you have to come to my home to collect it. Then we would read our favorite parts and reenact them.,2015-05-30 13:14:41,verga_grande,14
"*opens up book of terrible sex jokes*

Yeah, I'd like to put my bookmark in your novel.",2015-05-30 12:43:57,nsfwcommentor,4
So is the dewey decimal system relevant any more?,2015-05-30 12:41:12,numbfuqr,3
I hope you do conference with no panties on. Would make annual a lot more exciting to know you are out there in sessions like this,2015-05-30 13:24:26,samurailibrarian,3
"that is so hot, I want you to sit on my face",2015-05-30 13:36:24,davapp,3
I thank you and your bush for your service!,2015-05-30 16:13:22,cb_james5,3
"Great title, great directional arrow, nothing fancy, except for those lips. This is awesome.",2015-05-30 16:33:38,MidwestGuy03,3
"Gawd damn.... Love hair, never get to see it anymore.",2015-05-30 17:04:49,Billfuclinton,3
Such inviting pussy lips,2015-05-30 17:32:46,coprax84,3
Wow that was some naughty photo. Would you put a finger inside your pussy like that? That would be so sexy and naughty,2015-05-30 12:40:21,luckyjames05,2
Off to the local library! :),2015-05-30 12:40:23,nevermoar007,2
So so hot!!,2015-05-30 12:40:30,Hotrode73,2
I'd open your book!,2015-05-30 12:40:48,_AlphaMail_,2
"I'd love to be under that desk right now, eating you out...",2015-05-30 12:41:33,Thunderbanger,2
Looks like it's time to take Braille lessons...,2015-05-30 12:43:07,ILikeThePrettyOnes,2
"woow, I'm glad to know you're there :)",2015-05-30 12:43:29,_e_v_o_l_,2
I always wanted to eat a librarians pussy while at work! And yours looks extra sweet,2015-05-30 12:45:10,a-rech-0,2
Why are there no librarians like this around my house,2015-05-30 12:47:22,bedrock18,2
By digital do you mean fingers?,2015-05-30 12:54:56,sissyboi333,2
That's an award winning novel,2015-05-30 13:03:53,mrlassiter,2
Love hot librarians,2015-05-30 13:08:26,Leafsfan62,2
More please.  I want to bury my face in that.,2015-05-30 13:08:43,SMF14,2
Thank you!,2015-05-30 13:10:03,hand2king,2
"And to think: the library is where I learned the word ""cunnilingus!""",2015-05-30 13:19:04,nom-dah-plume,2
What a patriot!!!,2015-05-30 13:33:23,Anonus,2
Thank you for your service.,2015-05-30 13:38:32,thelife100,2
"Seems like we have the stacks, access to storage, and a wide selection of digital content all wrapped up in one librarian there. ;)",2015-05-30 13:52:01,dweeb_hunter,2
Yes. I want it all.,2015-05-30 14:04:14,obyetah,2
"Thank you for protecting my digital freedom ;) 

If the ""average"" librarian had a pussy like that, I'd spend more time at the library, even though it would probably just make me a more well-read pervert!",2015-05-30 14:27:32,Soupknife,2
"“And on the subject of burning books: I want to congratulate librarians, not famous for their physical strength or their powerful political connections or their great wealth, who, all over this country, have staunchly resisted anti-democratic bullies who have tried to remove certain books from their shelves, and have refused to reveal to thought police the names of persons who have checked out those titles.

So the America I loved still exists, if not in the White House or the Supreme Court or the Senate or the House of Representatives or the media. The America I love still exists at the front desks of our public libraries.”  - K. Vonnegut",2015-05-30 14:37:51,comradedongington,2
Thanks for all you do! ;),2015-05-30 14:47:25,TommyEagleMi,2
"""If this sign isn't posted here, someone from the government has been""

Also, really? No one? *I'd love to check you out!*",2015-05-30 14:56:32,Beardedly,2
I returned my books late. I am happy to go down on you to avoid the late fees.,2015-05-30 15:16:54,MXRNate77,2
Just another reason to love libraries!!!,2015-05-30 15:37:37,Dirtypenpal4567,2
Can't stop staring,2015-05-30 15:38:16,binarydivision,2
"Huge fantasy of mine, like I'm sure many others. Bang a hot librarian in the library. You wouldn't have to live in SoCal and be available?",2015-05-30 16:00:17,NoThanksJustLooking1,2
Looks delicious,2015-05-30 16:02:50,evillgrimm,2
I love your wet hot Dewey decimal system,2015-05-30 16:10:51,rhunter99,2
Awesome shot.,2015-05-30 16:12:53,theclimberclimbs,2
I love checking you out (had to),2015-05-30 16:38:14,Broadstreet83,2
"I too am a librarian. If you want a dick pick from my desk, I can provide that.",2015-05-30 17:42:46,nzime,2
thats hot as hell,2015-05-30 17:49:31,schizokid,2
What a lovely pussy!,2015-05-30 18:06:07,varanone,2
Would that my digits had the freedom to access my intrepid local librarian!,2015-05-30 18:13:36,georgeo,2
I would love a taste of that freedom!,2015-05-30 18:14:07,lover_of_snusnu1,2
So fucking sexy,2015-05-30 18:28:08,GZcuddles,2
I'd go to my local library more often if they had sights like this.,2015-05-30 18:32:41,Shivasama,2
"What does my ""digital freedom"" look like and can it fit inside your asshole?",2015-05-30 18:35:39,DryWeightSmoosh,2
Does that mean that my digits are free to do what they want?  Because I have some thoughts......,2015-05-30 18:53:14,kakmandan,2
