I should really start going to the library more often.,2015-05-30 19:10:37,ficklefeather,2
"So, is it true that librarians tend to be the kinkiest?",2015-05-30 19:12:23,echisholm,2
Will I get in trouble if my GF returns my books for me? She is even more captivated by you than I am!,2015-05-30 20:32:41,AnvilRockguy,2
That's like a perfect pussy...you could model that shit!,2015-05-30 13:45:41,stryder66,3
Oh my god those lips...,2015-05-30 13:50:57,Haparnicus,3
"Oh labia, we love you labia! 

*~ National Anthem of Labiuania. Google it...*",2015-05-30 12:40:25,ILikeThePrettyOnes,2
great upskirt!  you have a gorgeous pussy!,2015-05-30 12:48:42,Michigan_Cock,2
"Your pussy is perfect.  Upskirts just fucking slay me.  If you are truly a librarian, well that's the trifecta.  &lt;3",2015-05-30 13:01:30,SkinnySweaty,2
love those sexy pussy lips..,2015-05-30 13:31:08,boytoy4545,2
"lovely triangle .
looks super hot",2015-05-30 14:08:33,eigenvektor,2
Looks like a feast!  Love the bush...please more posts!!,2015-05-30 15:39:54,Awake987,2
p=,2015-05-30 20:31:58,arnoldrichard,1
"That is perfection, love the bush!",2015-05-30 20:46:31,Wiingman,1
Oh my word. I looked at your post history and this isnt even the first time youve been in public without panties!! Holy shit is this hot.,2015-05-30 12:51:19,Lusting4AnOlderLady,1
Uhm no,2015-05-30 19:55:19,nastybutler69,-1
"Just knocked on my neighbours door with my cock out, been arrested.",2015-05-30 12:24:39,Heelslover80,20
aha! get it cus you're next to a door.,2015-05-30 17:43:57,Orreomega,2
Your boobs are perfect ;),2015-05-30 11:20:00,luckyjames05,1
"Don't have to tell me twice, I'm ready too ;)",2015-05-30 11:20:04,quietshyguy94,1
"Here's hoping when I knock on my neighbors doors after work, you answer in that... A guy can dream right?",2015-05-30 11:20:45,Sportsguy098,1
Come over for coffee and fuck,2015-05-30 11:20:49,SteveMcQweef,1
I know my neighbors and you're not them but I'd sure like to fuck you! ;),2015-05-30 11:21:03,ILikeThePrettyOnes,1
*knocks on door*,2015-05-30 11:21:34,nsfwcommentor,1
Well cum knock on my door. You have a perfect body,2015-05-30 11:21:43,phenomenon7,1
I'm pretty sure I wold have noticed you. It isn't polite to tease.,2015-05-30 11:23:01,Tommycoaster,1
I'll fuck you hard and deep,2015-05-30 11:27:13,Michigan_Cock,1
You are sexy as fuck,2015-05-30 11:32:21,Mr_Wyld,1
First spontaneous erection today. Well done. ;),2015-05-30 11:34:55,justdoit893,0
C'mon over! I'm ready for you!,2015-05-30 11:36:12,nom-dah-plume,1
I just went and knocked on my neighbors door... Sadly you did not answer,2015-05-30 11:38:25,man437,1
I wish you were my neighbor!!,2015-05-30 11:48:59,Boredsecretguy,1
That title is so sexy!,2015-05-30 11:59:54,DjCyric,1
Can I borrow a cup of sugar? ;),2015-05-30 12:06:41,fire_crutch,1
Why don't you live next door to me? We'd get along very well,2015-05-30 12:10:08,Quadbrahhh,1
"God damn, you are pretty!",2015-05-30 12:10:22,disasterevolved,1
Sadly not next door to me!,2015-05-30 12:40:42,sissyboi333,1
Me too,2015-05-30 12:41:58,Leafsfan62,1
And we'd love to fuck u,2015-05-30 12:45:32,thebeastandhisdoe,1
sure wish you were the girl next door to me...would spin you all over the place,2015-05-30 13:31:42,zeagle69,1
Man I'm in the wrong neighborhood :-[,2015-05-30 13:54:17,sin_city69,1
False.  You do not live next door.,2015-05-30 14:21:32,shrubberynights,1
"Quickly! Come over, then! We have a LOT of Netflix to catch up on and plenty of bed space to share while we marathon some show in the background.",2015-05-30 14:42:02,theshizzlenit,1
I'm the guy next door and ready to bang - what a coincidence ;),2015-05-30 15:22:29,Ntwadumella,1
I want to be your neighbor. Why the fuck did I buy this house?,2015-05-30 15:25:29,Haparnicus,1
I'm your neighbor.  Let's do this.,2015-05-30 15:38:43,therealjt13,1
"Hi girlnextdoor, I'm theguyyourmomwarnedyouabout! Cheers!",2015-05-30 15:45:39,tony7914,1
I'm the old creep from across the street and I wouldn't mind a free play,2015-05-30 16:10:42,MrFlagg,1
I need to move,2015-05-30 16:11:41,rhunter99,1
My neighbor isn't as appealing. Are you willing to move?,2015-05-30 16:44:44,bitlate,1
Then let's fuck,2015-05-30 17:34:55,coprax84,1
Very sexy,2015-05-30 17:41:17,feet045,1
Perfect sizes and shapes.,2015-05-30 19:35:05,anonguy_1337,1
"I really, really wish you were just next door.",2015-05-30 20:07:55,samurai5625,1
Wow you look much better with your clothes off.,2015-05-30 12:18:57,precisionshooter,1
Where are you door?....,2015-05-30 11:20:18,MarAnt08,-1
That smile will keep me warm all day.,2015-05-30 09:26:38,Yesyesyupyup,3
I can totally sympathise .. it is freezing haha,2015-05-30 09:14:51,ozblueyes,1
"Can't feel bad for you.  Firstly you are stunning and secondly, if I was to wish for you to be somewhere else that would make you further away from me. :/",2015-05-30 09:17:50,AussieRobz,1
You look so cute and soo damn sexy!,2015-05-30 09:24:03,strangerh99,1
I believe your smile will make your winter warmer than it it :),2015-05-30 09:24:54,FloydiaN07,1
I'd hate to see you freeze those gorgeous tits off....maybe some rubbing and caressing would make you warmer.,2015-05-30 09:28:19,Photodaddy01,1
I much prefer the winter to the summer. :-),2015-05-30 09:29:58,nsfwcommentor,1
If I found you in my yard I would jump in ya for sure,2015-05-30 09:43:02,jedimasterlip,1
Oh come on it's not that cold here just yet,2015-05-30 09:45:05,Dolphingrey,1
cute smile,2015-05-30 09:48:41,alwaystherenever,1
Love everything about you,2015-05-30 09:51:32,quietshyguy94,1
Delicious,2015-05-30 10:27:53,slimfrenchie,1
Beautiful! Let me warm you right up ;),2015-05-30 10:53:55,redheadmale,1
"With the size of your tits, I don't think you have to worry much. They're magnificent!",2015-05-30 11:00:22,sushipusha,1
Coming down under to keep you warm!,2015-05-30 11:08:15,sl4z3r,1
"Hey Yam, 
I'd put my New York winters up against your Australian winters any day! However, we are frolicking in the meadows of a very warm and sunny spring. Beyond that, your photos inspire the most lascivious fantasies you can imagine. Good grief, what eyes, what a smile, what a luscious, voluptuous body. I wish I could show you a film of what goes on in my imaginings!",2015-05-30 11:19:00,tropicalpirate,1
Beautiful.,2015-05-30 11:35:41,pacopendico,1
Curves for dayssss.,2015-05-30 11:37:46,LemmeEatThat,1
"Don't let them freeze they spectacular.

Wait, exactly how COLD does it get there?  In north US winter can get very cold.  it can get to -35 c here.....",2015-05-30 11:48:15,aguy2013,1
Damn! Dem titties is nice yo!,2015-05-30 11:59:48,lanedgar,1
Please sit on my face,2015-05-30 12:01:09,eatcookie,1
Spend your winters with me,2015-05-30 12:40:06,Leafsfan62,1
Please tell me how cold Australian winters are again? It's almost June here and 55 f for a high in western NY,2015-05-30 12:45:10,RdDrgb,1
You got a PHAT  ASS ASS ASS ASS!,2015-05-30 13:03:10,McCrackerFDA,1
Come to Texas! Nice and warm.,2015-05-30 13:23:43,TexasToast-Jam,1
"I'm moving to New Zealand in a year, so enticing.",2015-05-30 13:25:16,CapnSheffield,1
1. A ginger. Fucking love gingers. 2. Australian. Fucking love women with Australian accent. Basically your sexyness level is at a 10.,2015-05-30 13:29:20,Gharrrrrr,2
Your 1000w work light is showing.,2015-05-30 14:19:45,Thickandthinn,1
Love your posts. Such a beautiful bod.,2015-05-30 14:33:32,kano0905,1
"Love the red hair, tits and ass.  Send more pix.",2015-05-30 14:35:04,windyriver,1
that couch looks comfortable,2015-05-30 15:01:04,elramic,1
Love you hair.,2015-05-30 15:07:04,Sttie,1
Please stay warm. Would be such a shame were those tits to freeze off. Do it for your fellow man.,2015-05-30 15:23:42,Haparnicus,1
you are absolutely gorgeous,2015-05-30 15:42:40,thisguyfromFL,1
Those are some nice halogens.,2015-05-30 15:45:53,SpaceVik1ng,1
I love autumn. Wish I had a house in both hemispheres. I'd spend my autumn in both places.,2015-05-30 15:48:34,MajorAndre,1
I would make love to you,2015-05-30 15:51:07,binarydivision,1
"It was almost 30 c earlier last week and now it's 9.

But seeing you makes me warm up just fine.

At first I didn't notice your hair was two tones

Your beatific face and gorgeous figure puts an aching in my bones",2015-05-30 16:00:04,yeahimeanitsokaysure,1
You're amazing,2015-05-30 16:10:36,mywankbankacct,1
"Something something plunder your down under.. 

Good to see more Aussies getting in on it though, I feel we're under represented",2015-05-30 16:14:18,siloxanedreams,1
How often your hair falls? It might be a problem.,2015-05-30 16:16:21,CitricMessiah,1
"With a body like that you will be keeping plenty of ""things"" warm all winter long! Just don't talk to me or I might fall in love...I love Aussies!!",2015-05-30 16:16:42,cb_james5,1
"well, you've certainly warmed up my winter morning!",2015-05-30 16:33:28,Neophix,1
"If you're free and in Melbourne, I'd certainly be happy to help warm you up...",2015-05-30 16:43:24,anotherfalsename,1
/r/simps,2015-05-30 16:43:27,bigdicksam,1
It's not even cold here harden up Aussie.,2015-05-30 16:50:24,mrwildeyes,1
I'm here in Aus too and perfectly willing to help keep you warm ;),2015-05-30 16:57:51,Zap1pow2bang3,1
I know how you feel. Australian here and it is getting very cold T_T.,2015-05-30 17:03:57,RedShadow007,1
I'm in love!,2015-05-30 17:17:10,therealmrdude,1
Your so hot don't see how you cold be cold,2015-05-30 17:24:09,cntryboypride,1
I'll come keep you warm baby! Especially with the sexy Australian accents.,2015-05-30 17:27:48,PitbossIOMC,1
You have such a sweet smile,2015-05-30 17:34:14,coprax84,1
I will gladly keep you warm if that's what your like.,2015-05-30 17:54:30,theguyuuse2no,1
Dat ass...congrats blessed!,2015-05-30 17:59:22,MuuaadDib,1
Your breasts hanging down are the greatest things I have seen all day. It's probably my favorite pose.,2015-05-30 18:13:08,HereForTheGW,1
You have tim tams bruh. Don't complain,2015-05-30 18:15:39,madfacemendez,1
You could be damn hot. If you would stop grinning,2015-05-30 18:17:29,dp_dan,1
I guarantee its colder here in NZ...,2015-05-30 18:51:20,cantweallbefriends,1
"Aussie winter?! Please. Student housing, NZ winter. Though, uh, thanks for getting the blood to flow at least ;)",2015-05-30 18:58:49,isdts,1
Truly gorgeous pics. Can't see how can't keep you warm these winter months ;),2015-05-30 19:03:29,hoffmeister1985,1
"How can I feel sorry for you with a smile like that?
  Australian man have all the luck!",2015-05-30 19:03:46,kakmandan,1
You can always pet my bunny all winter long!,2015-05-30 19:25:21,caligula_jaxson,1
I'm in love,2015-05-30 19:30:34,zeoranger,1
You are so cute!,2015-05-30 19:37:59,CrazyVertigo,1
completely amazing!  I'd gladly come down to Australia and help keep ya  warm!,2015-05-30 19:56:01,Kosun,1
"Cant feel bad for a soulless ginger.  Sorry, I didnt make the rules.",2015-05-30 11:00:10,KentuckyGentlemen,1
"Gorgeous and such an infectious smile, oh I would have so much fun with you",2015-05-30 09:13:31,daaaave,1
"Your smile is so adorable, your hair is gorgeous and your body is so sexy, you have the perfect combination going. I want to help you warm up so badly.",2015-05-30 09:14:54,raida-kick,1
Those pictures would look better with me behind you in almost everyone of them ;),2015-05-30 09:13:47,Nibi92,-1
Winter came way too early this year. And so did I. :(,2015-05-30 10:56:29,Halo_Redditer,0
Maybe some cloths would help to keep you warm. :P,2015-05-30 09:18:27,Canova65,-1
"Please don't let it be the last, You're absolutely breathtaking!",2015-05-30 14:10:06,TommyTranquility,3
Hello beautiful- glad you came by!,2015-05-30 14:08:51,dppman523,2
Be not afraid- looking yummy!,2015-05-30 14:09:11,SlimTwisted,1
Wow! So glad you finally did ;),2015-05-30 14:09:45,FootloverXOXO,1
Very sexy. I do hope we get to see you again. :),2015-05-30 14:09:46,Evil_N_Sweet,1
Cute!,2015-05-30 14:09:56,H_Peter,1
Hello gorgeous!,2015-05-30 14:11:38,Michigan_Cock,1
Amazing body! Can i see your pussy? ;),2015-05-30 14:16:50,luckyjames05,1
First girl in here I have seen stripping out of RL.  My kind of girl.,2015-05-30 14:30:52,thelife100,1
Great body. I hope you stick around,2015-05-30 14:44:01,Mr_Wyld,1
sexy,2015-05-30 14:45:15,alwaystherenever,1
More please!! Pretty please!,2015-05-30 15:00:23,sissyboi333,1
"The nerve isn't the only thing you're working up with this post. And for that, we thank you!",2015-05-30 15:19:55,slowpoke2013,1
beautiful,2015-05-30 15:20:45,crystalweird99,1
"Wow, your body is sexy",2015-05-30 15:35:14,therealjt13,1
And we're all thankful for it. Would love to see more of you.,2015-05-30 15:41:17,Haparnicus,1
You have a great body. I'm glad you worked up the courage. A body that nice deserves to be shown off,2015-05-30 16:04:24,NoThanksJustLooking1,1
Holy shit! More please!!!,2015-05-30 16:20:09,Venom535,1
Gorgeous! No need to be worried at all.,2015-05-30 17:16:06,Gizmote,1
You have nice hardwood floors,2015-05-30 17:24:54,MiloADonut,1
Really love the cute pose,2015-05-30 18:00:33,Dusty170,1
Wow amazing! Thanks for sharing hope to see more sometime.,2015-05-30 20:17:23,PmMeYourSexyShoulder,1
I might be blind. I see no posts in either one.,2015-05-30 20:33:03,bitlate,1
Those socks are beautiful you should look into posting on /r/ffsocks or /r/feet :),2015-05-30 20:33:13,PM_MeSomethingSexy,1
Stripes and Polo? I think you may be my dream girl.,2015-05-30 20:36:20,MC-Cal,1
I'm glad you did,2015-05-30 20:41:23,Leafsfan62,1
I just got a raise as well...,2015-05-30 14:30:09,liar_rabbit,5
Sit on mah faaaaace,2015-05-30 13:12:40,roosterstroking,1
For showing your body?,2015-05-30 13:14:12,luckyjames05,1
Congratulations!! And as a side note...those *curves!!* MMMMM!,2015-05-30 13:15:09,Boredsecretguy,1
"Congratulations, I bet you deserved it! :)",2015-05-30 13:15:15,Canova65,1
Congrats!! Funny thing is your giving me a raise too....,2015-05-30 13:16:06,sissyboi333,1
"Congratulations! By the way, THAT IS THE MOST BEAUTIFUL GAP I'VE EVER SEEN! I've got to check your other posts for a rear photo right now! I'll be right back :)&gt;",2015-05-30 13:16:51,ILikeThePrettyOnes,1
Congrats!!,2015-05-30 13:17:28,Dirtypenpal4567,1
"Oh yes. My seal:

*~ Certified Pretty*",2015-05-30 13:19:00,ILikeThePrettyOnes,1
Did you use your body to get promoted,2015-05-30 13:41:25,phenomenon7,1
My penis too.,2015-05-30 13:50:15,Ginger_KoolAid,1
Looks very good for Perfect Honeymoon :-) :-D,2015-05-30 13:57:24,Misterrossi,1
"Congratulations, but your view from the top *can't* be as good as my view from underneath ;)",2015-05-30 14:22:53,Soupknife,1
You definitely look to be the best person for the job.  Congrats.,2015-05-30 14:24:14,thelife100,1
Congratulations....and you are LOVELY!!,2015-05-30 14:56:17,Shavedman60,1
I can see why,2015-05-30 15:59:35,evillgrimm,1
Hope you didn't have to sleep with the boss. Unless it's a woman and that would be totally hot',2015-05-30 16:10:18,sushipusha,1
Congrats! What's your new position? ;),2015-05-30 16:37:50,Dapper_chico,1
U da boss,2015-05-30 16:47:57,Bluebuddyman,1
Omg that pussy,2015-05-30 17:21:25,NotReallyThatSecret,1
What an asset to this company :),2015-05-30 18:58:45,NoMoFunny,1
"I would have promoted you a long time ago ;) 

\#1930swomenintheworkplacejoke",2015-05-30 19:43:53,Carduelis_cannabina,1
We should celebrate ... Your place or mine,2015-05-30 19:51:18,MichiganGoneWild,1
Congrats ;) with a body like that I'd promote you too,2015-05-30 13:14:52,quietshyguy94,0
I have to admit I had forgotten about you. The memories are coming back hard and fast though. The only thing sexier than a jeep girl is a jeep girl in a ball cap ;),2015-05-30 09:40:41,ILikeThePrettyOnes,3
Oh My Goodness!,2015-05-30 10:55:37,TulsaOkie7,3
WOW!!!! That little cowgirl getup you have on is such a turn on. You look fucking amazing. Mmmm i would fuck you all day anyday gorgeous yum!!!!,2015-05-30 09:52:58,darkally69,3
You don't know how badly I want you right now :),2015-05-30 11:57:44,kelseylove,2
Straight up your ass too?,2015-05-30 12:39:17,sissyboi333,2
Mmmmm I'd love to wrangle that pussy ;),2015-05-30 12:40:22,Anonw0lf,3
Cowgirls rock,2015-05-30 12:41:21,Leafsfan62,2
"Smoking hot chick and a jeep! You win, great job! ;)",2015-05-30 14:20:33,Scheffboyrdee,2
Id love to see you bent over the hood of my WJ!,2015-05-30 15:51:41,Parruthead,2
"ok, that's the sexiest thing I've seen in awhile.",2015-05-30 15:55:03,blackbeard1991,2
"Love your posts. 

Thanks for sharing!",2015-05-30 15:57:57,K1ng_N0thing,2
Lucky guy! You're incredibly hot,2015-05-30 16:12:45,rhunter99,2
"A woman with a Jeep, in boots, showing off her ass... it is like a trifecta of sexy!",2015-05-30 17:22:01,lick-me-here,2
That's a plus of having a stock height jeep...we could fuck under mine 😛,2015-05-30 10:11:24,selfproclaimed1,1
"Your legs are all red, what happen to them?",2015-05-30 10:41:36,luckyjames05,1
Does the jeep itself enhance the experience?  So many jeep photos.,2015-05-30 11:13:16,msdd2727,1
Can we take turns?,2015-05-30 15:11:54,Daddy-Likes,1
This needs to be crossposted in r/jeep,2015-05-30 18:38:49,Codeblue74,1
"one of the best asses.
I loved the pic in the other thong.
Can you also do some public flashing?
with other people around?
thongs or pussy?",2015-05-30 18:40:51,eigenvektor,1
"Mmm, the things I would do to you... Xx",2015-05-30 09:40:48,MetalNWeed,1
As a fellow Jeep owner I must say this is one of my fantasies.,2015-05-30 10:05:25,Madden_07,1
"Ever tried 4x4

I'll see my way out....",2015-05-30 13:30:54,MattchewTaDerm,0
That looks like a pretty itchy mosquito bite behind your knee.,2015-05-30 14:22:03,Bsrxt8,1
wowzwers thats a nice body... i wanna touch it,2015-05-30 10:40:19,t3xan666,1
Unreal.. Thank you for sharing!!!,2015-05-30 10:49:49,rkane1o1,1
"Wow, 10/10 easily an up vote, much for older guys?",2015-05-30 10:52:08,Sportsguy098,0
Well fuck me! There you are!,2015-05-30 10:52:37,Gnargnar88,1
Mmmmmmm damn :) Now I need a cold shower,2015-05-30 11:02:27,redheadmale,1
gorgeous body!,2015-05-30 11:26:22,Michigan_Cock,1
"Incredible body, thank you for sharing",2015-05-30 11:41:41,Betatrees,1
are you really 19??,2015-05-30 12:06:09,tropicalpirate,1
Incredible!!,2015-05-30 12:45:12,sissyboi333,1
"so awesome, such a beautiful body babe.",2015-05-30 13:32:26,davapp,1
dang girl...rockin' body and to think you are just starting to figure out how to use it,2015-05-30 13:34:38,zeagle69,1
holy guacamole,2015-05-30 15:07:29,kohorevolution,1
Beautiful body,2015-05-30 15:50:41,MajorAndre,1
Damn what a body.,2015-05-30 16:10:38,Tomcat1108,1
Very beautiful body,2015-05-30 16:48:17,omard80,1
Whoazwers,2015-05-30 18:31:42,chiefsa,1
"My body temp just went to 119! Damn, that's a hot picture!",2015-05-30 18:35:34,Driven87,1
This got me hard as fuck. Thank you,2015-05-30 18:43:13,yes1994,1
I hope it's not just a phase,2015-05-30 14:50:44,bickle_,6
"Well, i'd say you aged to perfection. That is a damn rocking body you've got there!",2015-05-30 14:46:02,TommyTranquility,1
Sexy as hell!,2015-05-30 14:46:07,Mr_Wyld,1
Well happy birthday! (Posting here when you're over forty is an act of madness),2015-05-30 14:46:21,Name_is_legion,1
Let me be the first to welcome you!  And please *do* post more.  A lovely start...,2015-05-30 14:46:41,Lucifersmiles,1
Fuuuuuuuuck those fishnets tho,2015-05-30 14:47:52,tit_addict,1
Wish I could help you celebrate your birthday ;),2015-05-30 14:49:28,quietshyguy94,1
Happy Birthday fellow 18years old,2015-05-30 14:51:57,_Raptor,1
So hot ;),2015-05-30 14:52:06,luckyjames05,1
Hopefully many more to come?,2015-05-30 14:58:15,sissyboi333,1
It is.  I bet showing us what appear to be a fantastic pair of titties would be totally liberating for you.,2015-05-30 15:30:43,therealjt13,1
What a hot little body you have. Thanks for sharing.,2015-05-30 15:35:31,DjCyric,1
LOVE the fishnets....HOT!!,2015-05-30 15:44:30,Shavedman60,1
So that everyone can wish to get rite in your passage,2015-05-30 18:15:09,Toxicseagull,1
You have a great body! I love how you celebrated your birthday! And those fishnets DAMN!,2015-05-30 18:19:10,behporn,1
So sexy,2015-05-30 20:42:11,Leafsfan62,1
"Youve finally become a women lol jk

How big are ur tits hun?",2015-05-30 14:46:41,socalfbplaya69,-1
"Well, happy birthday! I also turned 18 (yesterday... but I'm a guy LOL) and I gotta say from what I can see, you got a nice body! :) I'm sure a lot of guys on Reddit (and in person)  will like you.",2015-05-30 15:24:12,Chopperskull,-1
Words cannot adequately describe how sexy that is.  Thank you for sharing.,2015-05-30 11:45:40,dubhri,4
Please don't make me beg :/,2015-05-30 11:45:32,ILikeThePrettyOnes,2
gorgeous pussy I could eat you all day,2015-05-30 11:46:29,Michigan_Cock,2
can i pull them down with my teeth?,2015-05-30 11:50:31,nyarly85,2
Sweet lord almighty. I'll beg,2015-05-30 12:00:02,Gnargnar88,1
Smoooooooth,2015-05-30 12:00:51,big-daddy-j,2
"Few things in life are better than a waxed pussy, thanks for sharing",2015-05-30 12:00:52,sexytruth,2
"You always find a way to take the sexiest, most jaw dropping photos and still have em classy :) love it!",2015-05-30 12:01:17,thatgingerguy88,2
I'll go after that last bit of wax with my tongue! Loved the tag on your deleted post!,2015-05-30 14:32:37,rocktype1,2
Your ass is so sexy! Can i see you spreading? ;),2015-05-30 11:54:33,luckyjames05,1
Open those cheeks a bit further and prepare to blow some minds. Among other things.,2015-05-30 11:54:49,SlimTwisted,1
You ass is incredible. You need a good spanking.,2015-05-30 12:01:15,DjCyric,1
Yum. Please sit on my face,2015-05-30 12:07:45,eatcookie,1
Grr! I'd love to turn your pussy and ass into a sexual meal!,2015-05-30 12:24:18,_AlphaMail_,1
Nom noms!!,2015-05-30 12:43:00,Pappy_McDaniels,1
"Well now that visual is going to stick with me for the rest of today, and you'll get no complaints from me. Your tan line still being somewhat visible is incredibly sexy.",2015-05-30 12:48:39,DeltaFuzz,1
Oh I wish you'd spread those cheeks a bit more!!,2015-05-30 12:56:08,sissyboi333,1
Id love to spank that ass,2015-05-30 13:00:34,quietshyguy94,1
Nice!,2015-05-30 13:22:32,dyslexicbunny,1
please have a seat... on my face ;),2015-05-30 14:12:03,MALW123,1
Wow i would love to bury my face in there! Thats really hot :),2015-05-30 16:00:38,jmadam02,1
Beautiful as always.,2015-05-30 16:14:48,kbeckinsale,1
My tongue just got hard,2015-05-30 17:50:39,mmmofo1,1
"That's it, I'm closing reddit for the night. Can't possibly get any better than your pics.",2015-05-30 19:34:32,bigBastardDude,1
Please please more then a peek. I don't know if I can take it,2015-05-30 19:51:48,GZcuddles,1
"Perfection is a word that comes to mind.....


when looking at that amazing behind. 

(came up with the rhyme just as I started typing the first part lol)",2015-05-30 20:46:55,JHowrd13,1
I'd lick you all over your pretty pussy and ass,2015-05-30 16:32:58,spazzy1886,0
Geez my life sucks.,2015-05-31 09:36:33,Chu9001,201
[That settles it!](http://i.imgur.com/Mj0xj.jpg),2015-05-31 10:31:01,thiscontradiction,34
[This](http://i.imgur.com/EoLdO5D.jpg) is a great photo.,2015-05-31 09:53:20,FartingBob,56
"You are the exact type of awesome, hot, and amazing wife that I want. Your husband hit the jackpot.",2015-05-31 08:20:39,BobsBurgersJoint,57
Msu represent!  Great album!,2015-05-31 09:02:11,Jkylman,21
[For those of you wanting to see more pussy and ass!!!](http://imgur.com/0IvmYjB),2015-05-31 12:32:17,oprime0013,50
"That smile in every picture, I love it!",2015-05-31 09:48:57,Deotri,5
👍,2015-05-31 09:32:18,Jack_Lambert,4
nice collection,2015-05-31 09:33:16,rotworld,5
"Don't get me wrong, you have a smoking body, but you have an incredible smile.  Make sure it doesn't get cut out from the pics.",2015-05-31 11:46:16,rebeild,4
Wow you are the total package and more!,2015-05-31 08:18:38,gonewildlover84,8
Double income and no kids? These people are doing it right.,2015-05-31 10:11:11,ThanksSpanky,8
Well those boobs made me happy.,2015-05-31 09:47:24,CacheInvictus,4
"Your husband took all these pics? I want a husband like this wtfff! :) 
Live happily ever after OP!",2015-05-31 10:43:04,nooes,4
You should show us a pic of your asshole.,2015-05-31 09:40:56,I_jog_in_jeans,6
You are amazing in every single way!,2015-05-31 08:13:01,Canova65,4
Always look forward to your posts. Can't wait until the day you show pictures a little further south.,2015-05-31 09:24:11,Papalegbah,5
I count 59 images in this album. wow! O_o,2015-05-31 09:38:25,tribseer,2
Man your're perfect with that white sandy beach,2015-05-31 09:48:44,BlackMagikz,2
Primo,2015-05-31 09:52:03,ravor21,2
Wow... Fuggin gorgeous! U are one of my favs!!,2015-05-31 10:06:21,DeekDiply,2
"Someone is up early on a Sunday morning!
I'm talking about my weenis.  
Thanks again!",2015-05-31 10:27:52,crazylegs15,2
👏🏼👏🏼👏🏼👏🏼👏🏼👏🏼👏🏼,2015-05-31 10:32:05,g0dzirrakak,2
"There aren't many things I enjoy more than hot nerdy girls. 

Thanks for sharing!",2015-05-31 10:42:45,K1ng_N0thing,2
Mmm those are some great tits.,2015-05-31 10:57:24,DjCyric,2
Speechless,2015-05-31 10:57:37,korndawgisu,2
One lucky husband I envy.,2015-05-31 10:59:02,emman1993,3
"Seeing that 1st pic then the title F,F,F,M I thought....this lucky son of a bitch is getting three girls like this??!",2015-05-31 12:01:38,MuuaadDib,2
Soo...are we butt guys not getting any love? Some pussy would be fantastic too.,2015-05-31 13:20:16,maneaserban,2
I like how you accidentally worked in tentacle porn.,2015-05-31 13:52:05,somedude462,3
Has anyone ever told you that you have very large breasts?,2015-05-31 13:56:02,uncensoredman,3
