Where did you get the rebel alliance neck thingy?,2015-05-31 13:57:41,letsgofightdragons,2
It's nice to see that you are getting the most use out of them as you can....,2015-05-31 14:19:18,rvm98,2
Go Green!,2015-05-31 14:22:10,The_Real_Slack,2
Holy crap this is the most awesome nerd stuff album ever! I love the chief helmet that's awesome as fuck. /r/gwnerdy needs all of this but dear lord you are the perfect women.,2015-05-31 15:32:25,Arnouche,2
Katy Perry ain't got shit on those melons.,2015-05-31 16:04:14,joselp07,2
http://i.imgur.com/Mj0xj.jpg,2015-05-31 17:58:20,Ac1dfreak,2
Oh my god. You are so incredibly sexy. I wish I could upvote again and again,2015-05-31 09:17:25,Nuddd,3
So many attempts at karma. All valiant and sexy. Can't complain.,2015-05-31 09:25:32,KelsoRules,3
Darn rich people and their fun that I'm not allowed to have.,2015-05-31 10:30:33,chrisco83,3
"a lot of fun, wish I can have a lot of fun like this.",2015-05-31 08:18:55,FloydiaN07,2
"Very nice, so when will we be seeing the sexy nurse getting nailed by her hubby ;)",2015-05-31 08:54:34,huxley309,2
You're fantastic!,2015-05-31 09:06:34,Solstic38,2
Blown away. Wow.,2015-05-31 09:31:55,ppcpilot,2
I feel like there's definitely not enough of you in the world.,2015-05-31 09:38:47,liamdpt,2
"Starts stroking aggressively ""THIS IS WHAT WE PLAY FOR!!!""",2015-05-31 09:50:30,vibloonies,2
"gee, nice ablum.

clearly owned by a boob man....",2015-05-31 10:25:59,Dick_Dragon,2
"have to say your lips [in this photo](http://i.imgur.com/Ma4qAm4.jpg?1) are amazing, that lipstick though so snogable it's unreal",2015-05-31 09:16:13,The-Honey_Monster,2
Wow! You are the bees knees.,2015-05-31 09:57:53,negativefucksthought,1
"i like the plastic wrap one. No real reason, but seriously one of my favorite posters on here.",2015-05-31 10:45:20,darkstream81,1
Nobodies life is like this!,2015-05-31 10:51:20,letsgobruins,1
The one with the hanging Christmas tree ball ornaments is just absolutely brilliant! Followed closely by the greenish hued floating boobs. Awesome album! Thanks for sharing.,2015-05-31 11:04:50,boilerdam,1
You are a goddess.  I especially like the saran wrap pics....I am going ask my gf to wear that.  It is far sexier than any lingerie I have ever seen.  You are gorgeous!,2015-05-31 11:29:17,guidedchipmunk,1
incredible...wow,2015-05-31 11:31:35,cleetusawreetus,1
Dear Diary: Acquire fun girlfriend,2015-05-31 11:35:25,Lv16,1
Holy hell that was sexy!,2015-05-31 11:42:32,TheGirlThatWaited,1
Quite the sexy Spartan!,2015-05-31 11:43:44,WulfwoodsSins,2
Me and this guy have the same exact dick.  I kid you not we might be brothers or the same person.,2015-05-31 11:52:52,the_frikin_pope,1
"Dang woman! Fellow woman here. You are hot stuff, darlin'. Damn!",2015-05-31 11:55:53,our_sexy_secret,1
So sexy,2015-05-31 12:02:10,pornXninja,1
"Please volunteer for cloning. You're sexy, beautiful and fun.  What more could any man want?  Thanks for the gallery.",2015-05-31 12:11:41,voyeureader,1
"Wow you look amazing. Not just physically, I mean you look like your having a lot of fun! I bet you guys are super happy! Good for you",2015-05-31 12:22:13,Moreupvote,1
Why is it always the amazing hot women are on here? Just to view could never really speak to or have an opportunity with. You look gorgoues by the way. You seem to be having alot of fun glad you can share. Later.,2015-05-31 12:22:45,RexxJuelz900,1
Your husband is an incredibly fortunate man.. I'll just have to keep holding out hope that there's someone else like you in the world,2015-05-31 12:49:01,Tallquiet1,1
GO GREEN,2015-05-31 13:08:04,Barneysnewwingman,1
"Mega albums usually tend to be great, and yours is no exception. Great to see you enjoying every minute of it.",2015-05-31 13:18:07,DeltaFuzz,1
Best album ever!,2015-05-31 13:20:58,ChingChong_BingBong8,1
I can only hope to have a wife like you one day,2015-05-31 13:23:42,the_dj_zig,1
Sexy boobs,2015-05-31 13:26:19,beebopboobee,1
You are incredible.,2015-05-31 13:26:24,TAprofile,1
"Wow, I want to go to Michigan State now. :) Lol",2015-05-31 13:32:50,Hawkize95,1
Great fucking god! Your man may just be the Most Interesting Man in the world. And you are absolutely gorgeous! Rock on with yo bad selves!,2015-05-31 13:39:30,Haparnicus,1
You guys are lucky to have found each other!,2015-05-31 13:41:09,GotNoGameGuy,1
She is the reason men buy boats,2015-05-31 13:44:41,jack8464,1
Great rack.,2015-05-31 13:52:18,LemmeEatThat,1
love the ones where your tits are bound a little bit ;),2015-05-31 13:53:51,dfg22,1
Go Green!,2015-05-31 14:02:23,brovondoom,1
Wow! That's the kind of album that leaves you speechless.,2015-05-31 14:19:18,GetaBurner,1
Did you go to MSU?,2015-05-31 15:06:34,g0bthemagician,1
Just a Spartans fan or are you alumni?,2015-05-31 15:15:50,StaticBarrage,1
Going BEHIND the ladder? Unacceptable.,2015-05-31 15:44:24,zvvl,1
I like you.,2015-05-31 16:02:41,MeSoloBotPlz,1
Greatest GW account ever!!! Y'all are the best :),2015-05-31 16:17:51,ElfOnTheShelves,1
"Might be the gayest comment you can encounter here but... Awesome Triforce necklace. It makes this whole album and you sexier, if that's even possible.",2015-05-31 16:18:57,Mannyma,1
You are so fucking sexy. Like... God damnnnn haha,2015-05-31 16:34:30,ThunderFuckMountain,1
So much Win!,2015-05-31 17:18:42,Corbinworks,1
"my question is.. in the halo discs pic, it seems like first person shooting the picture, however the hands are occupied :P  how? :D gopro? :D  or there is **3rd party involved** in the photoshooting ? :D",2015-05-31 17:22:18,F33L,1
GO GREEN!,2015-05-31 17:57:19,Anonimo_69,1
The smile. The boobs. The boat. The booze. The friends.The nerdyness. Smh. You guys made my day.,2015-05-31 18:35:33,activ8xp,1
"You remind me of my wife.  Her first gift to me was a Playstation, a driving wheel and some games.  She tends to camp and screen cheat, but he boobs and role play before and after make up for it!

Thanks for sharing!

Edit:  Oh and she fucks like a demon to trance/EDM.  No more searching for screwing music, just surf to that channel on cable and off we go!",2015-05-31 09:53:13,cumslikepeternorth,1
Show some ass!,2015-05-31 11:40:09,Pentemple,1
"Just wanted to point out for the safety of someone in the pic, the first underwater one doesn't have the tattoo covered up. But great album!",2015-05-31 10:15:35,BCkush,1
"I like that Halo ""Remember"" T-Shirt- I think your boobs just sold one to me.

Edit: But, you will need to link me where it came from...  (couldn't find it.)",2015-05-31 09:48:32,Bkeeneme,0
"I like when a girl has a little chub on their tummies, perfect.",2015-05-31 10:13:12,Stoneyhouse,-1
.,2015-05-31 10:49:29,Zeftoodeath,-1
"Remember Reach.

Please tell me you and your husband roleplay as Noble Team.",2015-05-31 11:45:57,OrbitalCrab,0
I like how you accidentally worked in tentacle porn.,2015-05-31 13:52:04,somedude462,0
Ocarina of time is the best,2015-05-31 12:06:01,Heytxn,-1
Look @ my username ... U are my perfect woman,2015-05-31 10:20:23,CH117,-3
"Wow, those are some smooth legs.",2015-05-31 11:46:59,ApertureBear,9
your mouthful really turning me on,2015-05-31 09:21:53,voyeuraddict,2
Nice😀😀,2015-05-31 09:32:08,zombie0721,2
She keeps getting better!,2015-05-31 13:48:25,fire_crutch,1
I would like to visit the same class ^^,2015-05-31 14:25:23,dannysp,1
This is awesome!,2015-05-31 16:39:05,Midwesternboy3,1
Can I join the fun?,2015-05-31 17:40:25,I_am_jack_hartness,1
Id love to look down and see that face looking back at me on my cock.,2015-05-31 08:04:59,SoupOfSomeYoungGuy,1
I could go for some of that right now. Lucky dude.,2015-05-31 13:10:02,bigBastardDude,-1
So fucking hot!! Would you finger your ass too?,2015-05-31 15:52:07,sissyboi333,2
Hot bod,2015-05-31 15:47:45,Send-Me-A-Selfie,1
You fuck face is just too sexy to handle. I'll go wild being inside of you while look at that sexy reaction.,2015-05-31 15:50:51,akumaz69,1
Wow!,2015-05-31 15:54:22,mattefire,1
You are bordering on unreal!,2015-05-31 16:11:48,boink666,1
I'd love to give you a hand next time ;),2015-05-31 16:24:20,Mr_Wyld,1
beautiful,2015-05-31 16:26:26,alwaystherenever,1
Amazing,2015-05-31 16:35:43,tc2005,1
"Can we see you cum? was really hoping to see it here, this video was so hot!",2015-05-31 16:39:29,nuttymusic,1
You have a cute face...and an awesome looking pussy!,2015-05-31 16:41:07,coprax84,1
you are so sexy and cute. id so love to see you stick a finger in your beautiful ass too while u are cumming. keep it up you are wonderful,2015-05-31 17:15:14,icedude1989,1
"Mmmm, that sounds lovely and wet.",2015-05-31 17:35:44,pm_ur_cameltoe_to_me,1
So fucking sexy. Watching your cute face while you go to town on yourself and hearing how wet you are is such a turn-on.,2015-05-31 17:39:12,slrigtoh,1
So fuckin' hot,2015-05-31 17:47:29,beebopboobee,1
"you fucking stunning, half the time i was to distracted enjoying your facial expression, loved this",2015-05-31 18:36:16,SecondSonOfDavid,1
Goddamn that's a beautiful pussy. Looks like you need something a bit bigger.,2015-05-31 15:48:14,FunkyMonk24,0
Your facial expressions alone get me hard. I want to taste you right now!,2015-05-31 17:08:25,lanedgar,0
Can I come join in on your funday? Maybe use something other the my fingers  ;),2015-05-31 15:45:54,Voltage_14,-1
now there's an ass that screams fuck me! amazing tight ass you have!,2015-05-31 08:59:38,motiv999,3
"Happy Sunday to mickie d's
You're perfectly busty petite
Super sexy, when do we get more?",2015-05-31 09:17:03,Sportsguy098,3
Wow! Stunning.... You have a fucking awesome body and that ass is second to none!,2015-05-31 10:17:04,DeekDiply,3
Your curves are awesome.,2015-05-31 09:57:22,nosebleedmaster,2
Wow. :D thank youu!,2015-05-31 08:54:06,JustMeNothingMore,1
More butthole possible?,2015-05-31 13:12:53,sissyboi333,1
you possess such amazing curves,2015-05-31 13:27:42,bigBastardDude,1
;),2015-05-31 13:42:18,PM_ME_UR_GONADS,1
That a nice rump.,2015-05-31 14:26:23,JNapier,1
Don't think anyone could ask for more ass than that...,2015-05-31 14:47:44,Samtaylormaster,1
Now all we need is more butthole... And cowbell.,2015-05-31 14:55:55,Present-Your-Anus,1
Wow!,2015-05-31 15:14:48,ABTechie,1
"First time posting :)
 
http://i.imgur.com/29oXCIN.jpg
http://www.reddit.com/r/MassiveCock/comments/37zxe9/first_time_posting/ 

I will be glad if you look and like what you see. Beacuse i really love what i see :)",2015-05-31 15:41:17,joei3006,0
And you certainly fucking delivered. Oh the things I would do to that tight body...,2015-05-31 16:12:51,Haparnicus,1
God bless you...,2015-05-31 16:33:25,Come_over_for_Kisses,1
Top class,2015-05-31 17:17:29,mrlongwang,1
That gorgeous ass just made my Sunday.,2015-05-31 18:00:27,PM_Your_SweatyFeet,1
"Babababa, I'm love'in it..",2015-05-31 09:41:46,bpeay13,0
"Beautiful tits, and thick legs and an ass for days. I'm sold,",2015-05-31 11:39:07,curiouscat09,0
"Your ass is amazing, but i would love to see your pussy ;)",2015-05-31 09:49:13,luckyjames05,-2
"[1](http://www.gfycat.com/GleefulInsidiousGrouper)

[2](http://www.gfycat.com/LargePinkDore)

[3](http://www.gfycat.com/DistantBlaringFalcon)
 
[4](http://www.gfycat.com/RareSoupyCopperhead)

[5](http://www.gfycat.com/KaleidoscopicPointlessGrayling)

[6](http://www.gfycat.com/ScholarlyLeafyAmericantoad)

[7](http://www.gfycat.com/OptimalClearcutBongo)

[8](http://www.gfycat.com/ThinAbleKoodoo )

[9](http://www.gfycat.com/QualifiedWateryDore)

[10](http://www.gfycat.com/LightheartedSeparateAlpineroadguidetigerbeetle)

[11](http://www.gfycat.com/NippyKaleidoscopicIberianchiffchaff)

[12](http://www.gfycat.com/SolidAnnualCorydorascatfish)",2015-05-31 11:20:02,enantiodromia_,137
Lawd have mercy,2015-05-31 13:30:06,derevocsid,5
"Lust is a wonderful, horrible thing. Hurts so good!",2015-05-31 11:21:43,ILikeThePrettyOnes,3
Oooo oooo oooo oooo,2015-05-31 11:22:48,oooobaby,3
9 the best,2015-05-31 12:48:50,adm1991,3
"One year of pure quality photos and gfys. Happy Cake Day, E! Here's looking forward to year two.",2015-05-31 13:13:41,DeltaFuzz,3
Happy Cake Day pretty lady!!,2015-05-31 11:21:40,Dark9er,2
Zapfino girl!  :) happy cake day!  Absolutely wonderful gifs!,2015-05-31 11:23:49,boilerdam,2
[deleted],2015-05-31 11:26:37,,2
"I'll take a dozen of those, please. ;)  Happy Cake Day!",2015-05-31 11:28:16,lotsosmiley,2
Damn you are a filthy girl today! Love it!!!,2015-05-31 11:30:02,DeekDiply,2
Wow. You just crammed that plug in there without any warmup. My turn?,2015-05-31 11:33:03,my_penis_says_hi,1
Watching you toy is such a turn on! Happy Cake Day darling!,2015-05-31 11:45:53,charlznchrg,2
suction dildo hotness :),2015-05-31 11:56:46,wee-tod-did,2
I'm liking #7 :),2015-05-31 11:58:29,iamshyguy,2
"Happy Cake Day!

You are the GW MVP :)",2015-05-31 12:04:32,sin_city69,2
Wooow absolutely stunning! Would love to see some clips!,2015-05-31 12:08:16,jizzy82,2
Happy cake day sexy lady! Hope you have a great day! MOOYAH,2015-05-31 12:14:03,TommyEagleMi,2
"Shower thought: the old adage: smile and the world smiles with you"" is especially true for you, but so too is the modern twist you've given it: ""masturbate and the world masturbates with you."" ❤️:)",2015-05-31 12:16:53,tikibowtiki,2
"Happy Cake Day, pretty lady! Your title is untrue, though. You can't be broken, I'm certain;)",2015-05-31 12:25:39,manwithnoname_,2
"Fappy birthday!

Number 8 is really hot.",2015-05-31 12:26:19,dyslexicbunny,2
Thought it's your Birthday we are receiving gifts. You're such a giver.,2015-05-31 12:27:23,Naughtj,2
"Happy Cake Day! Not much I can add to that. Thanks, beautiful.",2015-05-31 12:40:46,Checks_Gone_Wild,2
Holy crap. I don't know if it was the gfy action or what but the plug insertion looked pretty rough going. Just sayn'. :| Happy Birthday!,2015-05-31 12:47:49,only5pennies,2
Fapping time!,2015-05-31 12:49:42,blockbuzz,2
"Crikey me! I feel like I've received a wonderful present on your cake day, particularly enjoyed number 7, have a good day.",2015-05-31 12:58:59,W1tty_Username,2
"you deserve a Nobel Prize, any category, doesn't matter.
#8 rules my roost...",2015-05-31 12:59:48,mecrab,1
Happy Birthday! I can give you nothing better than what you just gave us. :),2015-05-31 13:02:05,strangerh99,2
Happy Your Cake Day to us! And number 8....damn!!!,2015-05-31 13:07:54,Deadman76,2
"Its your cake day, yet we are the ones getting gifts :D",2015-05-31 13:12:13,Blathazar01,2
I definitely heart 8!!  I'd love to be licking your clit while you do that,2015-05-31 13:12:37,NOLAfootlover,2
A happy Cake day for us all... Gif 8 is freaking sensational!!,2015-05-31 13:16:59,sissyboi333,2
"wow, is that the biggest toy you've got?",2015-05-31 13:18:24,autohush246,2
"Well my Sunday just got way better.  Happy birthday sexy lady!!!!
Thank you for being born.",2015-05-31 13:27:05,skimaster,2
"Truly amazing, love the way you move in #12. One of the best on GW IMHO",2015-05-31 13:31:53,yeomanwinter,2
Happy happy cake day btw,2015-05-31 13:33:23,yeomanwinter,2
Happy birthday beautiful! I hope your day is as perfect as you've made mine.,2015-05-31 13:36:49,Longryder,2
"Make it count Mrs Moderator, hope you have a really nice (cake) day!",2015-05-31 13:47:19,Tielem,2
It would be amazing if you could juggle pool balls after the dp. What a show that would be!,2015-05-31 13:50:41,swizzulsticks,2
Happy Cake Day! Thank you for the amazing gifs!,2015-05-31 13:53:07,Bibblichib,2
you are magical!,2015-05-31 13:59:51,RockStarCA,2
"I, I, I, have no words. Well, maybe 1.

Unbe-fucking-lievable.",2015-05-31 14:05:42,nsfwcommentor,2
Number 8 for me.  Love to see your lips swallow that thing up.,2015-05-31 14:10:08,nosebleedmaster,2
Happy Cake Day Gorgeous🎂. Strong those wonderful gfys together and You have the hottest video on Reddit💋💖🌹. Incredible post from Incredible You🌷💕😍,2015-05-31 14:25:07,KindDaddy,2
Wow! Is it your cake day or mine?,2015-05-31 14:29:37,Weshouldgetstarbucks,2
Thx for the wonderful gfys. we are very grateful for the effort and time put in to make them.,2015-05-31 14:44:34,Day-ummm,2
Happy cake day you fucking sexy minx,2015-05-31 14:55:22,Mr_Wyld,2
So much for getting work done! Absolutely stunning - happy birthday!,2015-05-31 15:05:28,Reckon_Ball,2
Hope someone baked you a cake today.,2015-05-31 15:13:27,comradedongington,2
This is the greatest thing that has ever happened. Ever.,2015-05-31 15:23:23,calgaryfritz,2
Very hot! You put a lot of time into that. Hope it was satisfying!,2015-05-31 15:42:26,lustyunderthings,2
Happy Cake Day e_! You're a beloved member and mod for this community!! :-),2015-05-31 15:54:33,Beardedly,2
Happy cake day! Thank you for all of your posts!,2015-05-31 16:01:44,PM_ME_4_Music,2
"Wow! Happy cake day, and thank you for the wonderful gyft!",2015-05-31 16:06:50,dklesswndr,2
no. 8 is awesome!,2015-05-31 16:33:49,coprax84,2
I have a felling that i wont be going on porn websites for some time :),2015-05-31 16:34:19,keki1611,2
"i love how you have decorated your boudoir... oh shit, did i type that out loud?",2015-05-31 16:34:21,ImUrCyberBF,2
"Happy Cake Day, beautiful,  fit,  sexy, sweet Ms.  E!   I hope you've had a great day!  Thanks for the fappy gifs.    🎂 🌹",2015-05-31 16:38:53,thanksforthemamaries,2
"Wow!!
Fantastic.. Love all of those and made a dreary Sunday night here in the uk really exciting and hot!!
Thank you",2015-05-31 16:42:43,Gunn3rs,2
epic.  in all ways.,2015-05-31 16:43:11,Dick_Dragon,2
"Well Happy Birthday to you! Thanks for the presents! 
My reaction.....Oh...my .....GAWD! Love that set esp #8",2015-05-31 16:44:27,village_Smythe,2
This is incredible.  Especially number 7.  Please do not delete these!,2015-05-31 17:06:19,reddit201220122012,2
"\#2 is hot, it really shows how deep you can take that thing.",2015-05-31 17:38:18,HEY_SLUTS_PM_ME,2
Holy hell! Its your cake day but I feel like we are the ones getting all of the presents ;),2015-05-31 18:14:17,Gtrwrstlr,2
Happy bday sexyest girl on GW ;) love the dp btw ;),2015-05-31 11:21:20,luckyjames05,1
"Wow, happy cake day, I wish I could do something for you in return! You are very beautiful and smoking hot!",2015-05-31 11:23:01,Canova65,1
Amazing,2015-05-31 14:39:07,Littledforu,1
Beautiful!,2015-05-31 14:42:44,tc2005,1
"I do believe I'll start a ""workout"" of my own now!!",2015-05-31 14:44:31,sissyboi333,1
Nice... Where are you from? You have an exotic look.,2015-05-31 14:45:21,DeekDiply,1
lovely photo set - particularly the last shot:),2015-05-31 14:52:09,hexXxanaut,1
I never get tired of you. :],2015-05-31 15:14:09,Raithed,1
Your albums never disappoint me. The looking back over your shoulder just about did me in. You have such a sexy way about you!,2015-05-31 15:21:04,manmind247,1
I want to slap you with my cock...,2015-05-31 15:21:31,lanedgar,1
You are beautiful..,2015-05-31 15:28:38,Shawn148,1
Can you be my next ex-girlfriend?,2015-05-31 15:38:54,TRPrelevantusername,1
"Careful...

Workouts like that may cause you to gain 30 lbs over nine months....",2015-05-31 15:46:41,jaynes_not_a_girl,1
Would you please do us all a favor and make a vid?!?! PLEASE!!!,2015-05-31 17:07:07,Chef6288,1
Your body looks great. Seems like your workouts are paying off!,2015-05-31 17:11:58,Tyraelxy,1
just looking at you makes me so horny....!!!,2015-05-31 17:17:03,icedude1989,1
"Wow, your whole body is absolutely astounding.",2015-05-31 18:11:02,PM_Your_SweatyFeet,1
Being in That ass is a fantasy of mine;),2015-05-31 10:06:31,Underarmour222,2
How do you like it so far?,2015-05-31 10:05:55,DavesDPPAccount,1
"Love your amazing asa, can you spread it? ;)",2015-05-31 10:06:06,luckyjames05,1
Congrats! job well done!,2015-05-31 10:06:19,numbfuqr,1
"Your pussy is gorgeous, would love to be licking it",2015-05-31 10:08:34,oooobaby,1
"Well ya knocked that off the list, what else ya got that we can help with?",2015-05-31 10:10:46,Tommycoaster,1
Now we share that fantasy! ;),2015-05-31 10:17:06,ILikeThePrettyOnes,1
Motorboating that view is a dream of mine,2015-05-31 10:29:56,SCARSnARs,1
"those lips though, love seeing women who have some nice large lips perfect for some gentle biting",2015-05-31 10:34:58,The-Honey_Monster,1
"And you posting has given me some wonderful fantasies! Oh, yeah!",2015-05-31 11:20:12,nom-dah-plume,1
Perfect! Must. Bang.,2015-05-31 11:34:25,my_penis_says_hi,0
"Keep the fantasy alive.  Keep posting!  Wish I was behind you, yum...",2015-05-31 11:53:41,peterpan65,1
"If you need a place to park that ass, my chin is available",2015-05-31 12:22:29,throwawayfortyou,1
I'm glad you acted upon your fantasy ... You look absolutely stunning ... Gorgeous view. I hope your experience is pleasant and you keep posting your smoking assets!! Thank You,2015-05-31 12:35:31,MichiganGoneWild,1
I love your fantasy. Great view! :P,2015-05-31 12:42:32,only5pennies,1
"...and now, your post is my fantasy. :)",2015-05-31 12:54:36,healthymale,1
Its pretty exciting for me!!,2015-05-31 13:14:06,sissyboi333,1
Wow that ass 😍,2015-05-31 13:22:51,Gardenbear42,1
Your mom has been a fantasy of mine &lt;3,2015-05-31 15:23:37,Rustygut,1
And seeing something as wonderful as that pic has been a fantasy of mine &lt;3,2015-05-31 15:51:14,anon_y,1
And you're now officially a fantasy of mine! Keep the posts coming...,2015-05-31 16:19:30,Haparnicus,1
you have inspired plenty more fantasies with this post,2015-05-31 16:30:32,ImUrCyberBF,1
you have a very attractive butthole,2015-05-31 17:45:38,duckbutt,1
Please sit on my face.,2015-05-31 17:55:23,TurbulentSapiosexual,1
Speed that pussy please. ;),2015-05-31 10:33:44,DeekDiply,0
"You have beautiful boobs

:)

And the prettiest smile",2015-05-31 15:44:20,charliemorning,3
That smile,2015-05-31 15:39:21,Bigjohn66,2
Puffy nips and a pretty smile? You just made everyone's day a little bit better :),2015-05-31 16:03:04,Beardedly,2
Wow ur cute how old are you?,2015-05-31 15:38:51,RayCrochet88,1
"Wow, you have a beautiful smile and I love your cute titties.",2015-05-31 15:39:39,Canova65,1
cute smile and sexy tanlines,2015-05-31 15:40:59,alwaystherenever,1
"Absolutely sweet, perfect tits, nice smile!!!",2015-05-31 15:43:14,redofeye,1
You have perfect nipples! Yum!,2015-05-31 15:54:13,theREALbigO,1
"Beautiful smile,beautiful everything...",2015-05-31 15:58:58,sissyboi333,1
So sexy and just too cute!,2015-05-31 16:51:26,Pauliefinzz,1
Dat vein !,2015-05-31 17:11:08,Warmgunove,1
Well everything I wanted to say has already been said haha... really alluring smile :D,2015-05-31 18:29:04,Fla5hed_,1
/r/grool would appreciate this.  Nothing like a dripping pussy to start my Sunday off right.,2015-05-31 10:32:39,groollover85,3
Omg I would lick that up in a heart beat!,2015-05-31 09:48:51,UseMe_dpp,1
"Christ, what were you thinking about you got this wet.",2015-05-31 09:51:09,Canova65,1
I bet that's slippery,2015-05-31 09:51:26,oooobaby,1
"@_@ that's the sexiest dripping pussy I think I've seen in GW, holy fuck",2015-05-31 09:52:05,Beardedly,1
If that's just getting started id love to see you when you are soaked ;),2015-05-31 09:55:27,blacksportscardriver,1
Are you sure that you haven't been creampied while ago? :),2015-05-31 10:03:32,FistfulOfHippos,1
I wanna lick that grool ;),2015-05-31 10:08:43,luckyjames05,1
So sexy!!,2015-05-31 10:09:04,tc2005,1
"so sexy, wanna eat your pussy ...",2015-05-31 10:17:59,FloydiaN07,1
Wow! Looks amazing and yummy!,2015-05-31 10:55:35,slobberknocker25,1
Thats a beautiful thing,2015-05-31 10:57:52,Shawn148,1
"That is one sexy, beautiful dripping pussy I have ever seen",2015-05-31 11:02:19,jackgronard,1
Come here and sit on my face right now so I can lick it all up!,2015-05-31 11:42:00,strangerh99,1
"I want to test the limits of how wet I can get you.  
  
Then I want to lick you clean.",2015-05-31 12:25:51,Takeitandlikeit,1
This might be the hottest picture I've ever seen. Craving a taste.,2015-05-31 13:13:34,disasterevolved,1
"Oh fuck!! The hottest pic of the day!! Yummy,yummy!!",2015-05-31 13:20:50,sissyboi333,1
Now that's a juice a man will enjoy drinking! I hope there's more?,2015-05-31 14:00:17,PM_ME_FANTASY,1
I can honestly say I don't think I've ever felt more of an urge to stick my dick into something...,2015-05-31 15:59:23,iLoveNakedRedditors,1
Sex honey!,2015-05-31 17:33:28,NovaTxn,1
WOW lots of hungry men out here,2015-05-31 06:25:41,massimo6789,4
Beautiful pussy! I'd lovingly obey that command!,2015-05-31 06:34:07,thesecond,3
No need to tell me twice.,2015-05-31 06:21:31,Tommycoaster,2
I could stay down there for hours!! Beautiful pussy,2015-05-31 06:21:48,Unsatisfied-inmass,2
I wouldn't even come up for air!,2015-05-31 06:22:52,LaughMoar,2
gladly,2015-05-31 06:23:15,The-Honey_Monster,2
Your pussy looks incredible. I'd eat you until you gushed...,2015-05-31 06:23:38,rocktype1,2
What Would i get After a Hour,2015-05-31 06:25:04,Konk67,1
"Don't worry, I'm not going anywhere!",2015-05-31 06:25:08,mecrab,2
Gladly!  ❤️,2015-05-31 06:25:19,Jaymie_74,2
"Hmm, I wouldn't want to go anywhere else, what an amazing view, your pussy looks so tasty.",2015-05-31 06:35:32,Canova65,2
I woudlnt want to be anywhere else,2015-05-31 07:05:45,619jesus,2
Wow I would love lick that fine pussy,2015-05-31 07:06:24,gonewildlover84,2
"I don't keep actually a ranked list of GW favs, but if I was forced to rank you all you would be top 5 with the likes of diggity, natural_red and enantodromia. I think you are that caliber. I dream of being ""down"" there:)&gt;",2015-05-31 07:37:39,ILikeThePrettyOnes,2
As if you'd need to insist. :D You crack me up. btw I'll be leading up to that ;P,2015-05-31 07:39:25,only5pennies,2
Purely my opinion. I call em like I see em :),2015-05-31 07:43:11,ILikeThePrettyOnes,2
