Happy birthday to one of the most beautiful women I've ever seen.,2015-05-29 07:31:00,Chanticleer_,180
"Happy Birthday!  You look amazing, as always!",2015-05-29 07:43:22,Bob_D0le,25
"Happy birthday, I want to suck on your butthole.",2015-05-29 12:34:20,HankHillsTshirt,16
"Winner and still champion...and damn, but that corset is just a perfect color for you.",2015-05-29 08:03:35,MalthusTheMighty,28
You're nicer than a day on the beach.,2015-05-29 07:52:57,PM_ME_UR_SIMP,12
I fap to you as soon as I see your post.  Anticipating your next!  You don't look a day over 25!,2015-05-29 08:06:19,Diggityishot,22
"HBD Diggity! FYI, you're still as sexy as ever and will continue to be for a long time ^keep ^posting ^^as ^^^proof? ;)",2015-05-29 07:31:21,Beardedly,32
"And as always, looks pretty damn good. Happy Birthday. Hope you enjoy your 33 swats from Mr. D. ;-)",2015-05-29 07:32:03,TooOldForThisS,10
"One of my favorite Pumpkins songs. Hope you have a smashing birthday, diggs!",2015-05-29 07:39:06,lotsosmiley,10
Happy Birthday:),2015-05-29 09:51:45,enantiodromia_,9
Happy Birthday. You could have easily said you turned 23 and I would have believed it. You're absolutely gorgeous.,2015-05-29 07:36:59,fortifiedlolz,5
"The best thing to happen to r/Gonewild is turning 33 huh? Well, I won't be needing pants today, happy birthday Diggity!",2015-05-29 08:07:33,Dapper_chico,5
I only fap to you,2015-05-29 09:32:19,i_got_this,6
"Happy birthday, queen diggity! Looking ageless as ever!",2015-05-29 08:21:20,derevocsid,4
"Happy birthday, can't believe you're the same age as me!

I look infinitely clapped out, you look about 10 years younger.",2015-05-29 08:24:11,parray,4
"Well, we share a birthday, so thanks for this present today!",2015-05-29 08:58:58,watyeag,4
"You are hot, but what makes you awesome is quoting the Smashing Pumpkins :)",2015-05-29 17:38:55,gatomercado,3
Happy birthday beautiful lady!! Glad to see you back!!!!,2015-05-29 07:32:43,hellwhynott,3
Happy Birthday!! You wear your age awesome! Love women in suits but I love seeing that suit on the floor even better. Amazing body!!,2015-05-29 07:45:53,5nightstand,3
Looks pretty damn good,2015-05-29 07:49:40,NotReallyThatSecret,2
Happy birthday ! So we are born the same year ? ;) You are really gorgeous !!,2015-05-29 07:50:23,FrenchTouchBaby,2
Happy birthday. Damn you are sexy,2015-05-29 07:51:02,MCskittles1125,2
Happy Birthday!! You look exceptionally sexy and beautiful!!,2015-05-29 07:53:31,sissyboi333,2
"Happy birthday 


Insert sexual comment about cake or ice cream or candles here",2015-05-29 08:10:49,Throwawaypausenot,3
And I feel like I'm the one that received the present! Fantastic album. Cheers birthday girl.,2015-05-29 08:11:22,bigBastardDude,2
Happy birthday fellow Gemini and thanks for posting as always,2015-05-29 08:12:16,itscochino,2
"33 Ain't go nothin on you missy, Hottest spread I've seen in weeks. God Damn!",2015-05-29 08:13:42,Bill039,2
Happy Birthday!  Looking dammm sexy as always!,2015-05-29 08:15:00,misterhappy1969,2
"Happy Birthday beautiful, it is so good to see you again, I've missed your posts terribly!",2015-05-29 08:16:27,charlznchrg,2
so glad we could celebrate together. happy birthday beautiful!,2015-05-29 08:18:08,NUMB69ER,2
it is your birthday and we get the gift? good deal!  happy birthday!,2015-05-29 08:18:11,autohush246,2
Happy Birthday!! I'm glad we share the same birthday because your birthday sets are some of the best birthday gifts I get!!,2015-05-29 08:21:11,weepy93,2
Been wondering where you've been.,2015-05-29 08:21:21,lovethemsluts,2
thank you for your post. Happy birthday as well. you are so fucking beautiful. this is an amazing album. I just think you are so special. you have an awesome body. everything about it is great.,2015-05-29 08:23:16,davapp,2
"Missed you, happy birthday!",2015-05-29 08:23:35,TheDrDetroit,2
"[Happy birthday, Digs](http://www.youtube.com/watch?v=jWTinQZJyJ4)",2015-05-29 08:25:35,splattypus,3
Happy birthday!!!  Words escape from me as I admire all that you posted. Thank you for giving us you as a birthday gift.,2015-05-29 08:39:39,BLKGENT,2
"Happy Birthday, you are fucking incredible!",2015-05-29 08:39:53,justacincinnatiguy,2
Happy Birthday beautiful! :) hope you're having a great day! &lt;3,2015-05-29 08:40:18,NakedKatie,3
"You don't look a day over 29, dank! :-P",2015-05-29 08:57:36,_AlphaMail_,3
YAY! Diggity is back! Thank you for posting again!,2015-05-29 09:49:53,aavenger,2
"Happy Birthday, you beautiful, desirable, fit, rocking, sexy, sweet girl and may you have many more!  Thanks for spending a  bit of your Bday with us, Ms Enan!  🌷 🎂 🍸",2015-05-29 11:16:48,thanksforthemamaries,2
"wow! You're making 33 look easy! We can't stop looking through these photos, geez, those looks over your shoulder...... Thank you for sharing your birthday with us!!!!",2015-05-29 08:54:40,nwlovers,3
Happy birthday gorgeous!,2015-05-29 07:32:15,yinzer1,2
You're fucking HOT lady...happy birthday!,2015-05-29 07:32:20,selfproclaimed1,2
Officialy gorgeous. And you simply couldn't choose clothes who fits you (and occasion) better...,2015-05-29 07:34:39,FistfulOfHippos,2
Happy  b day. You are so sexy ;),2015-05-29 07:35:16,alldayj1,2
"It's your birthday, but we get the presents.

Happy RL cake day!  :)",2015-05-29 07:36:00,iamshyguy,2
"Wow! Happy celebration of the Earth once again attaining its approximate position in its orbit around the sun corresponding with the time of your birth! Oh, and thanks for the sexy pix! I'll be glad to feel you and confirm that you feel ""pretty dam good!""",2015-05-29 07:36:25,nom-dah-plume,2
"Omg, i checked your profile every day and thats it! :)

Happy birthday, glad to see you again.",2015-05-29 07:39:11,buldezir,2
"Very nice and happy birthday! First series of yours we've seen and it won't be the last. Promise!

&lt;3 Ana &amp; Gibson",2015-05-29 07:39:12,Whispering_Dark,2
Happy cake day beautiful.,2015-05-29 07:39:26,only5pennies,2
Happy birthday Sexy lady!,2015-05-29 07:39:45,mr_prism,2
That must be the number of years it takes to perfect the female form! Lust you Diggity :),2015-05-29 07:42:04,ILikeThePrettyOnes,2
Happy birthday beautiful!,2015-05-29 07:43:10,GipsyConspiracy,2
Happy Birthday you look just as exquisite as the first time I saw you on here. Hope you have a great day today!,2015-05-29 07:45:23,dhstlcard,2
Amazing hot. Now I want to go listen to the smashing pumpkins again,2015-05-29 07:54:10,ashyguysthrowaway,2
Wow.. Ten years apart.. and i would love to do things with you.. I'm just speechkless.. Happy Birthday!,2015-05-29 08:01:12,Charismatic-Enigma,2
Happy birthday digg. Still looking beautiful!,2015-05-29 08:03:10,PoopShootMcduck,2
"You may be 33,but you're still a perfect 10! Thanks for posting and Happy Birthday-hope we're all still jerking off to you when you're 69!",2015-05-29 08:05:58,JobaccaWookiee,2
"Happy birthday, gawjus. Please keep posting. Hugs. :)",2015-05-29 08:24:38,sphinxdg,2
Gorgeous as always thanks for giving us a birthday treat,2015-05-29 08:25:54,MenWhoGolf,2
Happy 33!,2015-05-29 08:28:24,ZioPinta,2
"Well then, not only do you have it all you can sell every last bit too.",2015-05-29 08:28:32,langrisser,2
Happy birthday! Love the Smashing Pumpkin lyrics :),2015-05-29 08:29:07,d66sfg,2
"It looks like it feels pretty damn good, too! Would love to feel for myself!",2015-05-29 08:30:34,strongfox3,2
"Darlin', you are THE. WHOLE. DAMN. PACKAGE. Happy Birthday.",2015-05-29 08:31:20,Gromit51,2
Is that a blink 182 reference?,2015-05-29 08:42:09,patarandaya,2
Happy Birthday.,2015-05-29 08:42:30,SollyKins,2
I would never have guessed 33. You look beautiful! Happy Birthday! :),2015-05-29 08:42:51,strangerh99,2
"You are exquisite!  Such beautiful body, face and photos!",2015-05-29 08:43:41,bh_hffk,2
"Happy b day, and great post you sexy girl :)",2015-05-29 08:44:34,gonewildlover84,2
"you're a total smokeshow, happy birthday.",2015-05-29 08:44:40,gyshall,2
Happy birthday! You've always been on of my favorite posters.  You seem to be aging like fine wine! ;-),2015-05-29 08:45:20,Imjustaguy26,2
"I admire your beauty, you're cute and sexy, I feel happy to watch you, kisses",2015-05-29 08:47:01,mrsilversurfers,2
Happy birthday! And thankyou for making me feel better about being 33 also! Looking at your gorgeous pics make me feel like im still young and still 'got it'!!,2015-05-29 08:47:31,ThomasKingston,2
Happy birthday! 🎉🎈🎉,2015-05-29 08:48:14,curiousguyhere985,2
Happy Birthday. You are magnificent!,2015-05-29 08:49:29,DasbootTX,2
Happy birthday I hope it a fun and exciting day for you,2015-05-29 08:51:37,lostpeanut,2
Happy birthday beautiful.,2015-05-29 08:51:41,Headwound81,2
We share a Birthday! hope yours is a great one.,2015-05-29 08:53:01,MacNeal,2
Happy Birthday! I went back and looked at that set another half a dozen times. Quite simply one of the top submissions done here. Bravo!,2015-05-29 08:53:45,emptythemag,2
You rang my dinner bell! Happy birthday and thank you for sharing your beauty.,2015-05-29 08:54:04,ZeroMindCTRL,2
Absolutely gorgeous! You make that look so fucking sexy. Wishing I was the lucky man taking those pictures. Happy birthday!,2015-05-29 08:54:33,hidinginslc,2
Great song great body have a great year!,2015-05-29 08:54:44,NaughtyAudio,2
Happy birthday you sexy vixen.,2015-05-29 08:56:33,staplemonkey,2
Happy Birthday. That is one of the best sets I have seen. You are fucking hot.....,2015-05-29 08:56:56,dirtbag32,2
"Wow! The mixture of your body, your posing, your outfits (especially your business style) and your sexy smile make you so unique, beautiful and desirable - even without a nose :) ! THX for posting and happy birthday tooooo youuuuuuuu.",2015-05-29 08:57:24,AlfromEurope,2
"Mmm, as always you're better than coffee in the morning. Happy birthday, beautiful.",2015-05-29 08:57:40,Amphire,2
"so happy to see you, happy birthday baby girl!

ohh, forgot to mention, i love the little bush.  i also think it would be awesome if you dyed it the same color as your hair.",2015-05-29 08:58:03,babbleon5,2
"Woah, I think I know you n your fiancé. Good spread though",2015-05-29 08:58:08,Venicedreaming,2
Still my one and only.,2015-05-29 08:58:15,Raithed,2
+1 for the taste in music.,2015-05-29 08:59:15,Xuixien_TheEpic,2
Happy birthday! You've been missed.,2015-05-29 08:59:22,JoshShavensack,2
"Happy birthday! One of the finest photosets I've ever seen. Very creative, and the progression is the perfect balance of tease and please. The bits of your face, hidden by the composition, are my favorite part. Your outfit is amazing, and your body stunning!",2015-05-29 09:00:04,spirituallysexual,2
Happy birthday diggitydank!,2015-05-29 09:00:48,Ivraalia,2
"Happy Birthday Diggity!  May all your birthdays have albums.  You look amazing, don't stay away so long either. ;). Missed you!",2015-05-29 09:02:20,peterpan65,2
"Happy birthday Mrs. Dank, Truly the Queen of Gonewild.",2015-05-29 09:03:09,theimaginer,2
"Wow, my favorite Smashing Pumpkins song.  You are the coolest naked lady on the internet ever!",2015-05-29 09:03:13,pechinburger,2
"33 just happens to be my favorite number HAPPY BIRTHDAY ,thanks for posting your birthday suit for us I always enjoy seen a lady with a body that looks as firm as a 20yo ;)",2015-05-29 09:03:30,chickenlittle1,2
"I definitely wouldn't mind Smashing that, Pumpkin. Happy BDay",2015-05-29 09:03:39,PM_UR_SWEATER_BAGS,2
"I swear, if I ever meet a Genie, my first wish would be to spend 24 hours as Mr. Diggitydank.

you're gorgeous digs! happy birthday and don't change!",2015-05-29 09:03:41,Djandyt,2
Happy birthday!  That's a good number.  Your body is glorious!,2015-05-29 09:03:50,Buckeyezrule,2
You may be 33 but genetics felt you a hand you can win with for years. You are amazing for sharing your body and personality with us. I turned 37 yesterday and I feel great. Here's to you.,2015-05-29 09:05:50,arnoldrichard,2
"I was getting a little worried you stopped posting.  
Sexiest poster on GW fo' sho', although the competition is pretty fierce.",2015-05-29 09:05:53,ShadyShitAlt,2
Happy birthday! I hope your day will be awesome!,2015-05-29 09:06:12,Kelcius,2
Looks pretty damn good as well!,2015-05-29 09:06:21,sushipusha,2
You two do such a great job. Mrs. Dank you're a very enticing women and Mr. Dank you're a lucky sob. :),2015-05-29 09:09:29,rawalmond,2
"Happy birthday DiggityDank.

You're like a dream come true, one of the most gorgeous women ever.

I wish you the best, and hope that everything goes perfect on your birthday.",2015-05-29 09:10:34,Y3Klo,2
Wow...looking damn good!,2015-05-29 09:10:41,3spot,2
Happy Birthday!,2015-05-29 09:11:44,THATpeter,2
Looks pretty damn good.,2015-05-29 09:14:29,Zero771,2
It has been far too long. I hope you post again before your next birthday.,2015-05-29 09:15:11,Present-Your-Anus,2
"diggity, 33 looks fucking fantastic.  thanks for all the boners LOL",2015-05-29 09:16:04,quagmire82,2
It's like Christmas!,2015-05-29 09:44:50,lobomos,1
"jap[[[y baityhday ...

oh, I'm sorry, I was distracted.",2015-05-29 09:45:39,crazyhairpin,1
Happy B- day Diggity! Fantastic set once again.  I love that song too. Appropriate song title for your RL cake day (but I'm sure that's why you picked it). Hope Mr. Dank has something naughty planned for your special day.,2015-05-29 09:46:09,jaysaddiction,1
Happy birthday Diggity... you just keep getting sexier and sexier.,2015-05-29 09:46:34,bethepirate,1
"And I thought today was just going to be another boring Friday.  Thank you, Diggity, thank you!!!!",2015-05-29 09:47:59,DankityDigg,1
Happy birthday!,2015-05-29 09:49:11,pizza5260,1
33 looks like it taste good too,2015-05-29 09:50:23,MR656,1
HAPPY BIRTHDAY!!!!!! mine was the 10th of this month glad to see another sexy may Bday ;) hope you have tons of fun well more fun than your pics already show you are having!!!!!,2015-05-29 09:52:38,Sykojager,1
This is what I hope every office woman wears under their clothes!,2015-05-29 09:53:11,geek_who,1
Happy birthday to you.  Looking fantastic.,2015-05-29 09:54:53,cantgetmuchwurst,1
"Keeping it classy, love it. Happy birthday.",2015-05-29 09:57:24,rawsss,1
Happy birthday Mrs Dank! :D,2015-05-29 09:57:28,Jackthastripper,1
"You look amazing, thank you for these and happy birthday! :)",2015-05-29 09:59:11,Xandercz,1
I feel like its my birthday when you post! Happy Birthday,2015-05-29 10:00:25,pagansexgod,1
"Your sets make me think of the Rocky Horror Picture Show. Except instead of yelling where's your neck, I yell where's your nose! Kidding around of course, good to see you again.",2015-05-29 10:03:23,GETaylor,1
Crikey!,2015-05-29 10:03:44,BigRedPandaa,1
"Well, the stars have all aligned today.   Happy birthday to you, and a happy start of the weekend to all of us!",2015-05-29 10:04:49,datsincredible,1
You had me at the blink lyrics,2015-05-29 10:05:01,alexproulx,1
Happy Birthday!! You look amazing!,2015-05-29 10:05:12,Throwndown555,1
"You're just so damn classy. You've got great photo quality, a clean and nicely furnished room, great taste in outfits and album progression (not to mention music). The overall quality of everything you post is amazing. And to top it off you're gorgeous :) Please never stop posting, you'll keep putting the 18 year olds around here to shame for decades!",2015-05-29 10:06:08,i_like_fedoras,1
Happy Birthday Beautiful!  I know exactly what I would get you for your B-Day ;),2015-05-29 10:06:31,tabarnak22,1
"You do not look 33 at all!!!

Happy birthday, btw. :D",2015-05-29 10:06:33,AgonizingHillbilly,1
Happy birthday,2015-05-29 10:06:44,sundawg102,1
Happy birthday! I've missed your nylon covered legs. Thanks for the post!,2015-05-29 10:07:20,pdxcaveman05,1
"Happy birthday!!!  Thank you, for all you have done for us here!",2015-05-29 10:07:52,1fym,1
Happy Birthday! Thank you for letting us know ... and see :-),2015-05-29 10:08:37,mnmlx,1
One of the best posts ever!  Love all the beautiful photos and the SP lyrics to go with them. Great stuff.,2015-05-29 10:08:59,NoEscapingGravity,1
Happy birthday Miss. Diggity!!,2015-05-29 10:09:22,Th3BlackLotus,1
"Happy B-day, 33 looks great on you!",2015-05-29 10:10:45,raulhj,1
33 looks damn fine on you. Wish I had met you when you were 23! 💖,2015-05-29 10:11:05,rmenaker,1
"Happy Birthday!  I have to say, I clicked without looking at the name and only recognized you in that first bent over photo.  Look fabulous, as always.",2015-05-29 10:11:37,dontcallmerobert,1
"Smashing Pumpkins!!! Great song, amazing album! We are the same age.  :)",2015-05-29 10:13:39,djg828,1
"One of the reasons this sub is so popular, happy birthday!",2015-05-29 10:14:32,Loimere,1
"Happy Birthday, you look amazing at 33.  Blessed with great genes!",2015-05-29 10:14:56,Justin0320,1
Happy Birthday! Love the outfit and want to get it for my girl. Where did you pick it up?,2015-05-29 10:15:40,Ichorous007,1
Happy Birthday Dank! And thank you!,2015-05-29 10:16:55,CaptainK00ns,1
"I'm turning 21 tomorrow, I hope I look like you when I'm your age! Happy birthday!",2015-05-29 10:19:56,LustyKat,1
you're gorgeous! happy birthday sexy lady,2015-05-29 10:20:43,SkyHero,1
"Such an amazing body

Would love you to teach me yoga",2015-05-29 10:38:15,Jerseyladupforchat,4
"Perfect body, sexy tan lines, love your bush....you're making me drool and my pants are getting tight 😛",2015-05-29 13:35:09,Awake987,3
"would love to see you doing some naked yoga, please",2015-05-29 10:39:26,FlyWithMeNow,1
Can I like this post? Cuz I love it...,2015-05-29 10:45:08,elviejoepu,1
amazing I love the tan lines ;),2015-05-29 10:53:55,thebest1992,1
That is one seeeexy body!,2015-05-29 10:59:53,DeekDiply,1
Let's see you in the downward dog,2015-05-29 11:00:57,impskin,1
Holy hell what a body!!,2015-05-29 11:02:03,yinzer1,1
Wow your body is amazing,2015-05-29 11:05:45,kingpin2188,1
You look amazing.  Maybe I could give you a lil massage after yoga? ;),2015-05-29 11:07:23,Voltage_14,1
Wow top5 body on GW.  Just wow,2015-05-29 11:14:01,MidwestGuy03,1
INTOXICATING SHOT!!!,2015-05-29 11:28:46,mayaswellplay,1
I can see you won the genetic lottery. Damn!,2015-05-29 11:38:49,ItsDarts,1
Lovely perspective. Stunning view.,2015-05-29 12:07:09,only5pennies,1
Love the tan lines!,2015-05-29 12:27:51,huggie74,1
Curves for days! You must break necks in yoga pants!,2015-05-29 12:46:10,Funcouple0811,1
My eyeballs just orgasmed,2015-05-29 13:06:09,AmazinBlazinBran,1
Age?,2015-05-29 13:42:58,socalfbplaya69,1
Very sexy! Some yoga poses nude?,2015-05-29 13:50:02,Lipsaresealed2,1
sexy...,2015-05-29 13:57:46,alwaystherenever,1
Sweet Jesus - it's like seeing EV_ again! ***PERFECT*** tits!,2015-05-29 13:58:14,Beardedly,1
Sweet baby Jesus that is an exceptional view!,2015-05-29 14:05:39,JayRodsChickenHut,1
"Hmmm...

Your tan lines don't *quite* cover your nipples.

I'd **love** to see you on the beach in *that* bikini.

'Course, I'd be hard pressed to hide my excitement in my bathing suit.",2015-05-29 14:27:25,TSMFOTP,1
that made my day. Thank you,2015-05-29 14:29:07,Wallyalex,1
we should practice some time ;) gorgeous,2015-05-29 14:33:51,dronin8,1
Encore!,2015-05-29 14:39:44,precisionshooter,1
"Reasons I like going to the gym:

- This.

The end.",2015-05-29 14:44:30,beardedgntlmn,1
That's art.,2015-05-29 14:47:58,rickjamesdean,1
Mmmm that hump.,2015-05-29 15:02:24,agbgw,1
Ugh you doing naked yoga can their be anything sexier?,2015-05-29 15:12:37,BoredomStartsTrouble,1
Perfect figure.,2015-05-29 15:16:48,bigwillhogan,1
Jenkies,2015-05-29 15:26:08,ictreddit,1
"My god, smokin' hot!!!",2015-05-29 15:33:38,bblvr,1
"Great Googly Mooogly.  Put a fork in me, I'm done.",2015-05-29 16:10:40,Bpb41,1
Mother of God...,2015-05-29 16:26:03,Goofz,1
Best thing I have seen all day,2015-05-29 16:34:46,Mbones1899,1
you're perfection to me,2015-05-29 16:47:30,robsolutely,1
Wow! Come join me for yoga!,2015-05-29 16:55:24,Sshakeweights,1
"I wanted to say thank you.

Thank you.",2015-05-29 16:57:31,darcmeat,1
sweet mother of god,2015-05-29 17:17:56,Seahawksfan13,1
"Yoga, Hm? 

So just how flexible are you? ;)",2015-05-29 18:06:10,K1ng_N0thing,1
awesome tan,2015-05-29 18:10:08,evillgrimm,1
Hip bonesssss!!!,2015-05-29 18:13:23,Anonymau5Love,1
"Naked yoga, huh. I wonder what that looks like?...  
I said ""I WONDER WHAT THAT LOOKS LIKE?"" ^^Subtle ^^enough?",2015-05-29 18:36:11,uninventiveFakeName,1
You make the yoga into the hot yoga. Wow.,2015-05-29 18:47:58,Haparnicus,1
A) sexy tan lines B) your blessed in all the right places,2015-05-29 18:53:53,curiouscat09,1
Can we get a little downward dog?,2015-05-29 19:10:48,ElVatoSuave,1
"My actual reaction was ""oh jeez, that's just ridiculous! "" said out loud... to noone.",2015-05-29 19:51:28,CloseToSpectacular,1
Holy shit!  That is grade-A.  Grade.  A.,2015-05-29 20:10:28,TurkMcGurk,1
Oh my! Your body is perfect😍,2015-05-29 10:44:21,dcestroni,1
I love what you've done with the place.,2015-05-29 11:59:52,PM_ME_UR_SIMP,0
"Does anyone know if it's acceptable to hire a naked yoga instructor for my brothers bachelor party? I don't want to get him a stripper, I hate the awkward situation with the bachelor getting grinded on while everyone watches. I want to do something unique. Like have everyone participate in a yoga session while the instructor is nude. Nothing trashy. Is this even a thing or would I have trouble hiring somebody to do this?",2015-05-29 15:56:14,skatermario3,0
Babe you're too beautiful and too good of a person to be posing nude online. Have some self respect. I can help you. Would you like to go on a date with me? I'll treat you like a princess and show you how nice of a guy I am. I'll restore your confidence in love and chivalry.,2015-05-29 12:15:36,raycomfort112,-13
Were you all alone?,2015-05-29 13:45:03,MikeyLikesIt2010,1
would love to give you some room service,2015-05-29 13:45:41,Agamemnon2012,1
The nipple studs are glorious. I'd play with those all night long.,2015-05-29 13:50:52,bgfalcon419,1
I feel like every hotel ever has that same shower curtain.,2015-05-29 13:51:52,ActuallyItsSumnus,1
Love those piercings! And my GOD that ass!,2015-05-29 13:52:39,tit_addict,1
beautiful,2015-05-29 13:53:42,alwaystherenever,1
Very sexy,2015-05-29 13:54:13,jimmywine6,1
"as a former room service waiter, I would have loved to find someone like that when I visited",2015-05-29 14:00:09,GilroyMD,1
I wish I could've been there,2015-05-29 14:11:45,quietshyguy94,1
You look lovely,2015-05-29 14:29:36,MenWhoGolf,1
I'm always horny and alone at HGIs as well. You've got a great body and I love the piercings!,2015-05-29 14:47:28,eddiec02,1
What is the room  LOL,2015-05-29 15:16:05,Renman1605,1
That looks nice on you.,2015-05-29 15:52:05,PM_ME_UR_SIMP,1
Tell me you brought some toys to play with your in the room.,2015-05-29 16:00:14,rowstomper,1
"What is it about hotel rooms that make you get all horndoggy? Happens every time i go on the road by myself. 

And great pictures. Thanks for sharing!",2015-05-29 20:03:04,crazylegs15,1
"If those are videos stills, I want to see the video ;)",2015-05-29 13:32:16,the_dj_zig,7
I feel for you - it must be tricky for a girl like you to find a man;-P,2015-05-29 11:56:04,hexXxanaut,3
"&gt; Video stills

Oh you tease!",2015-05-29 12:52:05,dyslexicbunny,2
Your bed is always so nicely made.,2015-05-29 13:46:14,Heytxn,2
Lovely as always.,2015-05-29 11:19:08,edisonsmedecine,1
Love those legs ;),2015-05-29 11:22:05,Voltage_14,1
Keep an electric toothbrush on standby,2015-05-29 11:22:31,impskin,1
"Well, if you're frustrated, then I am, too. I have a AA battery or two floating around here somewhere, shall I bring them over?",2015-05-29 11:23:09,MalthusTheMighty,1
Why? if you are beautiful....,2015-05-29 11:24:04,MarAnt08,1
"Love your body, just amazing",2015-05-29 11:26:45,johnny19119,1
I'll substitute as your play you,2015-05-29 11:26:51,johnni2times,1
I can help with that,2015-05-29 11:37:52,NotReallyThatSecret,1
I know the feeling.,2015-05-29 11:55:24,only5pennies,1
Miss little lamb you are quickly becoming my favorite,2015-05-29 11:55:29,Sportsguy098,1
I would be happy to help you out. We can play or I can video.,2015-05-29 12:16:12,Lipsaresealed2,1
If it's any consolation you look gorgeous,2015-05-29 12:25:09,arenyk,1
You'll probably feel better if you remove the face text :P,2015-05-29 12:58:22,uncannyvalley_79,1
"If at first You don't succeed Try, Try Again!!  You are Gorgeous!!",2015-05-29 13:18:17,KindDaddy,1
"Serves you right, tease..",2015-05-29 13:21:11,Dutchie2,1
yea. those feet and that body....hot!,2015-05-29 13:35:25,Polifili,1
Your every thought and motion contributes to the beauty of the universe.,2015-05-29 14:00:53,PM_ME_UR_SIMP,1
"Let me know where you are and I'll run you some batteries! Is it the long beautiful legs? Yep. The flowing blonde hair? Yep. The perky ample breasts? Yep. The liberty to post yourself naked on the world wide web? Yep. You're the real deal, Lucy. Want you more with every post...",2015-05-29 14:33:20,ILikeThePrettyOnes,1
we will await another chance..,2015-05-29 14:50:35,boytoy4545,1
"A half [""eek"" of pink](http://imgur.com/a/JjA9f)?",2015-05-29 14:58:42,Checks_Gone_Wild,1
I would love to unfrustrate you. I'll unfrustrate cell on your body.,2015-05-29 16:26:23,Mugwort1,1
You have really cute feet. You should post in /r/feet,2015-05-29 16:31:33,llPoptardll,1
so am I; i wanted to see the rest of what was gonna happen,2015-05-29 17:24:51,quagmire82,1
Such sexy toes!,2015-05-29 11:24:35,MrMonicotti,1
Them feet,2015-05-29 11:56:17,MenWhoGolf,1
"You look so smooth like butter, you're making my mouth water. May I see you bent over and a little closer to the camera, please? So I can be less frustrated, of course.",2015-05-29 11:21:56,thedirtytruths,-1
